address,latitude,longitude,Bank
"ALFAMART AMALIA RAYA 1 JL AMALIA RAYA, PENGGILINGAN, CAKUNG, JAKTIM",-6.208850000,106.935510000,BCA
"IKHWANIYAH MART 1 POMPES IKHWANIYAH, JL PANTI ASUHAN KP CEGER RT 08/05, JURANG MANG U BARAT, PDK AREN, TANGSEL",-6.253426300,106.726906100,BCA
"ALFAMIDI JATIWARINGIN RAYA CRM 2 JL RAYA JATIWARINGIN 48 CEMPAKA, PONDOK GEDE, BEKA",-6.264069000,106.911002000,BCA
"ALFAMIDI JATIWARINGIN RAYA CRM 1 JL RAYA JATIWARINGIN 48 CEMPAKA, PONDOK GEDE, BEKASI",-6.264069000,106.911002000,BCA
ALFAMART TIPAR CAKUNG I - 3 JL TIPAR CAKUNG RAYA JAKARTA UTARA,-6.132257000,106.920289000,BCA
TAMAN PALEM CRM 5 PERUM TAMAN PALEM LESTARI BLOK C5 / 52 JAKBAR,-6.137080000,106.722490000,BCA
TAMAN PALEM CRM 1 PERUM TAMAN PALEM LESTARI BLOK C5 / 52 JAKBAR,-6.137080000,106.722490000,BCA
TAMAN PALEM CRM 2 PERUM TAMAN PALEM LESTARI BLOK C5 / 52 JAKBAR,-6.137080000,106.722490000,BCA
TAMAN PALEM CRM 3 PERUM TAMAN PALEM LESTARI BLOK C5 / 52 JAKBAR,-6.137080000,106.722490000,BCA
TAMAN PALEM CRM 4 PERUM TAMAN PALEM LESTARI BLOK C5 / 52 JAKBAR,-6.137080000,106.722490000,BCA
JAKGROSIR KRAMAT JATI 1 PUSAT PERKULAKAN PASAR INDUK KRAMAT JATI,-6.295700000,106.870200000,BCA
INDOMARET RANCHO INDAH CRM JL RANCOINDAH NO17 RT001 RW002 KEL TGBARAT KEC JAG,-6.304479400,106.841529200,BCA
ALFAMART MAHONI JAK UT JL MAHONI SELATAN NO 3 JAKARTA UTARA,-6.121700000,106.913100000,BCA
"ALFAMART ANUGRAH RAYA BKS CRM 1 JL ANUGRAH RAYA RT 07/04, JATIWARINGI, PONDOK GEDE",-6.258697000,106.915492000,BCA
INDOMARET POINT PALEM LESTARI II TAMAN PALEM LESTARI BLOK A 11 NO 01 JAKBAR,-6.136963000,106.722368000,BCA
"SUPER GROSIR & SWALAYAN SEMPER CRM 1 JL TIPAR CAKUNG NO. 2, SEMPER BARAT, JAKUT",-6.129800000,106.919000000,BCA
APOTIK SUPER FARMA JL TIPAR CAKUNG NO 2 SEMPER BARAT JAKARTA UTARA,-6.129668000,106.919030000,BCA
MITRA 10 DAAN MOGOT JL RAYA DAAN MOGOT KM19 KALIDERES JAKBAR,-6.154208000,106.714541000,BCA
"ALFAMART NANGKA TANJUNG BARAT JL NANGKA NO 1000 RT 12/4, TANJUNG BARAT, JAGAKARSA, JAKSEL",-6.304700000,106.842400000,BCA
"INDOMARET LEBAK BULUS III JL RYLEBAKBULUS 3 NO2B RT017/07 PDKLABU, CILANDAK, JAKSEL",-6.302200000,106.791900000,BCA
BINTARO PLAZA CRM 2 SEKTOR 3A PERUMAHAN BINTARO JAYA,-6.272942000,106.741795000,BCA
BINTARO PLAZA CRM 3 SEKTOR 3A PERUMAHAN BINTARO JAYA,-6.272942000,106.741795000,BCA
ALFAMART TIPAR CAKUNG III JL TIPAR CAKUNG KEC CAKUNG JAKARTA TIMUR,-6.164811000,106.934274000,BCA
INDOMARET MANGGA XXII (TOYM) JAKARTA UTARA JL MANGGA NO 22 RT010 LAGOA KOJA JAKUT,-6.117800000,106.910600000,BCA
"INDOMARET HOS COKROAMINOTO TANGERANG JL RAYA HOS COKROAMINOTO GG IIYAS II KARANG TIMUR, KARANG TENGAH TANGERANG",-6.226700000,106.713500000,BCA
"ALFAMIDI RADEN SALEH CRM JL RADEN SALEH NO 15 RT 03/08, KARANG TENGAH, TANGERANG",-6.214500000,106.710300000,BCA
INDOMARET JURANG MANGU TIMUR TANGSEL CRM JL PANTI ASUHAN NO120 RT001 RW012 TANGSEL,-6.259800000,106.730300000,BCA
"ALFAMART TIPAR CAKUNG V JL TIPAR CAKUNG NO 1 RT 01/07, CAKUNG, JAKTIM",-6.172900000,106.936200000,BCA
"ALFAMART PINANG RANTI IV JL RAYA PONDOK GEDE RT08/01 NO 08, PINANG RANTI, MAKASAR, JAKARTA TIMUR",-6.290600000,106.881700000,BCA
INDOMARET HOS COKROAMINOTO CILEDUG JL HOS COKROAMINOTO KEDONDONG TANGERANG,-6.226500000,106.713100000,BCA
INDOMARET HOS COKROAMINOTO CILEDUG 2 JL HOS COKROAMINOTO KEDONDONG TANGERANG,-6.226500000,106.713100000,BCA
INDOMARET CEGER RAYA II TANGSEL CRM 1 JL RY CEGER NO12 A-B JURANGMANGUPONDOKARENTANGSEL,-6.262356000,106.731880000,BCA
"TAMAN KENCANA CRM 6 KOMP TMN KENCANA, JL KALIANDRA RY NO1, CENGKARENG, JAKARTA BARAT",-6.127980000,106.726890000,BCA
"TAMAN KENCANA CRM 7 KOMP TMN KENCANA, JL KALIANDRA RY NO1, CENGKARENG, JAKARTA BARAT",-6.127980000,106.726890000,BCA
"TAMAN KENCANA CRM 8 KOMP TMN KENCANA, JL KALIANDRA RY NO1, CENGKARENG, JAKARTA BARAT",-6.127980000,106.726890000,BCA
"TAMAN KENCANA CRM 1 KOMP TMN KENCANA, JL KALIANDRA RY NO1, CENGKARENG, JAKARTA BARAT",-6.127980000,106.726890000,BCA
"TAMAN KENCANA CRM 2 KOMP TMN KENCANA, JL KALIANDRA RY NO1, CENGKARENG, JAKARTA BARAT",-6.127980000,106.726890000,BCA
"TAMAN KENCANA CRM 3 KOMP TMN KENCANA, JL KALIANDRA RY NO1, CENGKARENG, JAKARTA BARAT",-6.127980000,106.726890000,BCA
"TAMAN KENCANA CRM 4 KOMP TMN KENCANA, JL KALIANDRA RY NO1, CENGKARENG, JAKARTA BARAT",-6.127980000,106.726890000,BCA
"TAMAN KENCANA CRM 5 KOMP TMN KENCANA, JL KALIANDRA RY NO1, CENGKARENG, JAKARTA BARAT",-6.127980000,106.726890000,BCA
"EBC ONE BEL PARK FATMAWATI CRM 3 JL RS FATMAWATI NO 1, JAKARTA SELATAN",-6.303700000,106.795600000,BCA
"EBC ONE BEL PARK FATMAWATI CRM 4 JL RS FATMAWATI NO 1, JAKARTA SELATAN",-6.303700000,106.795600000,BCA
"EBC ONE BEL PARK FATMAWATI CRM 1 JL RS FATMAWATI NO 1, JAKARTA SELATAN",-6.303700000,106.795600000,BCA
"EBC ONE BEL PARK FATMAWATI CRM 2 JL RS FATMAWATI NO 1, JAKARTA SELATAN",-6.303700000,106.795600000,BCA
KRAMAT JAYA CRM 7 JL KRAMAT JAYA BLOK F1/10 - JAKARTA,-6.127804200,106.918680000,BCA
KRAMAT JAYA CRM 3 JL KRAMAT JAYA BLOK F1/10 - JAKARTA,-6.127804200,106.918680000,BCA
KRAMAT JAYA CRM 6 JL KRAMAT JAYA BLOK F1/10 - JAKARTA,-6.127804200,106.918680000,BCA
"DAAN MOGOT BARU CRM 1 RUKAN PUSAT BISNIS KJF 9-10, JL RY DAAN MOGOT",-6.150392000,106.715233000,BCA
"DAAN MOGOT BARU CRM 2 RUKAN PUSAT BISNIS KJF 9-10, JL RY DAAN MOGOT",-6.150392000,106.715233000,BCA
ALFAMART TAMAN KENCANA 2 JL TAMAN KENCANA BLOK C 1 NO 5-6 JAKBAR,-6.128033000,106.726736000,BCA
ALFAMART TAMAN KENCANA JL TAMAN KENCANA BLOK C 1 NO 5-6 JAKBAR,-6.128033000,106.726736000,BCA
"NAGA SWALAYAN TB SIMATUPANG CRM 1 JL TB SIMATUPANG BLOK U, TANJUNG BARAT, KEC JAGAKARSA, JAKARTA SELATAN",-6.304405000,106.847275000,BCA
ALFAMIDI HOS COKROAMINOTO CILEDUG JL HOS COKROAMINOTO CILEDUG TANGERANG,-6.226200000,106.712800000,BCA
"DAAN MOGOT BARU CRM 3 RUKAN PUSAT BISNIS KJF 9-10, JL RY DAAN MOGOT",-6.150396000,106.715076000,BCA
"DAAN MOGOT BARU CRM 4 RUKAN PUSAT BISNIS KJF 9-10, JL RY DAAN MOGOT",-6.150396000,106.715076000,BCA
"ALFAMART RUKO COLUMBUS GREEN LAKE CITY RUKO COLUMBUS BLOK A 29-30 CLUSTER AMERIKA LATIN, PETIR, CIPONDOH, TANGERANG",-6.183711000,106.707674000,BCA
ALFAMIDI CEGER RAYA CRM 1 JL RYCEGER KELJURANGMANGUTIMUR KECPDK ARENTGR,-6.262555000,106.731624000,BCA
ALFAMIDI CEGER RAYA CRM 2 JL RYCEGER KELJURANGMANGUTIMUR KECPDK ARENTGR,-6.262555000,106.731624000,BCA
ALFAMART KALIMALANG II JL KH NOER ALI ( KALIMALANG ) NO 5A JAKTIM,-6.247448000,106.923970000,BCA
"ALFAMIDI MENTENG TERUSAN JAKUT JL MENTENG TERUSAN NO 107 RT 17/7,  LAGOA, KOJA, JAKUT",-6.112400000,106.906800000,BCA
"RS MITRA KELUARGA BINTARO CRM 1 JL PONDOK BETUNG RAYA RT002/RW002, BINTARO UTAMA SEKTOR 3A, PDK KARYA, PDK AREN, TANGERANG SELATAN",-6.271140800,106.738845400,BCA
"EBC TAMAN MINI SQUARE CRM 1 JL TAMAN MINI RAYA, GARUDA, PINANG RANTI, JAKARTA",-6.291800000,106.880700000,BCA
"EBC TAMAN MINI SQUARE CRM 2 JL TAMAN MINI RAYA, GARUDA, PINANG RANTI, JAKARTA",-6.291800000,106.880700000,BCA
"EBC TAMAN MINI SQUARE CRM 3 JL TAMAN MINI RAYA, GARUDA, PINANG RANTI, JAKARTA",-6.291800000,106.880700000,BCA
"EBC TAMAN MINI SQUARE CRM 4 JL TAMAN MINI RAYA, GARUDA, PINANG RANTI, JAKARTA",-6.291800000,106.880700000,BCA
"EBC TAMAN MINI SQUARE CRM 5 JL TAMAN MINI RAYA, GARUDA, PINANG RANTI, JAKARTA",-6.291800000,106.880700000,BCA
"EBC TAMAN MINI SQUARE CRM 6 JL TAMAN MINI RAYA, GARUDA, PINANG RANTI, JAKARTA",-6.291800000,106.880700000,BCA
ALFAMART REMPOA CRM 1 JL REMPOA RAYA NO 12 A CIPUTAT TANGERANG SELATAN,-6.288498000,106.759513000,BCA
"INDOMARET ADHIYAKSA LEBAK BULUS JL ADHIYAKSA KAV CEMPAKA PUTIH BLOK W NO 5, LEBAK BULUS, CILANDAK, JAKSEL",-6.297700000,106.776300000,BCA
"INDOMARET TB SIMATUPANG JL. TB SIMATUPANG NO.47, TANJUNG BARAT JAKSEL",-6.304081000,106.850744000,BCA
"INDOMARET PINANG RANTI ( TO3D )JAKARTA TIMUR JL PINANG RANTI NO 10,PDK GEDE,JAKARTA TIMUR",-6.290559000,106.883131000,BCA
KALIMALANG CRM 5 JL TARUM BARAT BLOK E NO 5 - JAKARTA - 13450,-6.247728100,106.924140700,BCA
ALFAMART INPRES LARANGAN JL INPRES LARANGAN NO 29 RT 02 RW 09 KEL LARANGAN KEC LARANGAN TANGERANG,-6.247000000,106.720700000,BCA
ALFAMART INPRES LARANGAN 2 JL INPRES LARANGAN NO 29 RT 02 RW 09 KEL LARANGAN KEC LARANGAN TANGERANG,-6.247000000,106.720700000,BCA
ALFAMART TB SIMATUPANG V JL TB SIMATUPANG NO 47A 8 TANJUNG BARAT JAGAKARSA JAKARTA SELATAN,-6.304400000,106.851100000,BCA
ALFAMART RANCHO INDAH JL RANCHO INDAH NO 7 JAKARTA SELATAN,-6.304583000,106.850441000,BCA
"MAL MATAHARI PURI DAAN MOGOT CRM 1 JL DAAN MOGOT RAYA KM 16, JAKARTA",-6.150983000,106.714028000,BCA
"ALFAMIDI BAMBU LARANGAN CRM 1 JL BAMBU LARANGAN RT 003/009, PEGADUNGAN, KALIDERES, JAKBAR",-6.142900000,106.717400000,BCA
GOLDEN POINT CENTER CRM 1 PLAZACIPUTATMAS BLOKAD 5 JL IR JUANDA 5A TGR,-6.291648000,106.763371000,BCA
"PONDOK LESTARI CRM 1 RUKO PDK LESTARI BLOK C/7-8, JL CILEDUG RAYA",-6.224776000,106.711339000,BCA
"PONDOK LESTARI CRM 2 RUKO PDK LESTARI BLOK C/7-8, JL CILEDUG RAYA",-6.224776000,106.711339000,BCA
"PONDOK LESTARI CRM 3 RUKO PDK LESTARI BLOK C/7-8, JL CILEDUG RAYA",-6.224776000,106.711339000,BCA
"PONDOK LESTARI CRM 4 RUKO PDK LESTARI BLOK C/7-8, JL CILEDUG RAYA",-6.224776000,106.711339000,BCA
"INDOMARET BUNGA RAMPAI JL. BUNGA RAMPAI RAYA, BLOK 22 NO. 4",-6.224402000,106.934411000,BCA
"PONDOK LESTARI CRM 5 RUKO PDK LESTARI BLOK C/7-8, JL CILEDUG RAYA",-6.224770000,106.711290000,BCA
ALFAMIDI KRAMAT JAYA II JL KRAMAT JAYA NO 27 RT 03/12 KOJA JAKUT,-6.123507000,106.917063000,BCA
"INDOMARET KRESEK RAYA JAKARTA JL RAYA KRESEK KAV NO 1 RT5/13, DURI KOSAMBI, CENGKARENG, JAKARTA BARAT",-6.176800000,106.707400000,BCA
"KOJA TRADE MALL CRM 1 JL KRAMAT JAYA, KOJA - TANJUNG PRIOK, JAKUT",-6.123164000,106.916890000,BCA
"KOJA TRADE MALL CRM 2 JL KRAMAT JAYA, KOJA - TANJUNG PRIOK, JAKUT",-6.123164000,106.916890000,BCA
"EBC TAMAN PALEM LESTARI CRM 2 KOMPLEK TAMAN PALEM LESTARI BLOK C5 NO 52-53, JAKARTA BARAT",-6.135577000,106.720708000,BCA
"EBC TAMAN PALEM LESTARI CRM 1 KOMPLEK TAMAN PALEM LESTARI BLOK C5 NO 52-53, JAKARTA BARAT",-6.135654000,106.720639000,BCA
"EBC TAMAN PALEM LESTARI CRM 3 KOMPLEK TAMAN PALEM LESTARI BLOK C5 NO 52-53, JAKA",-6.135654000,106.720639000,BCA
"EBC TAMAN PALEM LESTARI CRM 5 KOMPLEK TAMAN PALEM LESTARI BLOK C5 NO 52-53, JAKA",-6.135654000,106.720639000,BCA
PASAR KOJA BARU 1 JL BHAYANGKARA KEL TUGU UTARA KEC KOJA JAKARTA UTARA,-6.121500000,106.915900000,BCA
ALFAMART IR H JUANDA CRM 1 JL IR H JUANDA CIRENDEU CIPUTAT TANGSEL 15419,-6.293439000,106.765640000,BCA
PP PLAZA JL LET. JEND TB SIMATUPANG NO57 PS REBO JKT,-6.303123000,106.857545000,BCA
INDOMARET COKROAMINOTO II TANGERANG JL HOS COKROAMINOTO RT01 RW07 TANGERANG,-6.225300000,106.711100000,BCA
ALFAMART PONDOK LESTARI II JL HOS COKROAMINOTO TANGERANG,-6.225000000,106.711000000,BCA
BONA INDAH CRM 2 PLZ BONA INDAH BLOK B/12 JL KARANG TENGAH RY,-6.300555000,106.780356000,BCA
BONA INDAH CRM 3 PLZ BONA INDAH BLOK B/12 JL KARANG TENGAH RY,-6.300555000,106.780356000,BCA
BONA INDAH CRM 4 PLZ BONA INDAH BLOK B/12 JL KARANG TENGAH RY,-6.300555000,106.780356000,BCA
BONA INDAH CRM 1 PLZ BONA INDAH BLOK B/12 JL KARANG TENGAH RY,-6.300555000,106.780356000,BCA
"ALFAMART MATRAMAN JL. MATRAMAN RAYA, JAKARTA TIMUR",-6.210000000,106.938200000,BCA
EBC CONDET CRM 3 JL RAYA CONDET 1-I RT 005/03 JAKARTA TIMUR,-6.303449000,106.857308000,BCA
EBC CONDET CRM 1 JL RAYA CONDET 1-I RT 005/03 JAKARTA TIMUR,-6.303449000,106.857308000,BCA
EBC CONDET CRM 5 JL RAYA CONDET 1-I RT 005/03 JAKARTA TIMUR,-6.303449000,106.857308000,BCA
EBC CONDET CRM 6 JL RAYA CONDET 1-I RT 005/03 JAKARTA TIMUR,-6.303449000,106.857308000,BCA
EBC CONDET CRM 7 JL RAYA CONDET 1-I RT 005/03 JAKARTA TIMUR,-6.303449000,106.857308000,BCA
"ALFAMART BUMI HARAPAN JAYA JL H JENIH RT12/01, RAMBUTAN, CIRACAS, JAKARTA TIMUR",-6.297000000,106.873700000,BCA
"PONDOK GEDE CRM 1 JL PONDOK GEDE NO 43 RT/RW 001/007, LUBANG BUAYA, JAKARTA TIMUR",-6.248578200,106.924994100,BCA
"PONDOK GEDE CRM 2 JL PONDOK GEDE NO 43 RT/RW 001/007, LUBANG BUAYA, JAKARTA TIMUR",-6.248578200,106.924994100,BCA
KALIMALANG CRM 6 JL TARUM BARAT BLOK E NO 5 - JAKARTA - 13450,-6.248578200,106.924994100,BCA
KALIMALANG CRM 1 JL TARUM BARAT BLOK E NO 5 - JAKARTA - 13450,-6.248578200,106.924994100,BCA
KALIMALANG CRM 2 JL TARUM BARAT BLOK E NO 5 - JAKARTA - 13450,-6.248578200,106.924994100,BCA
KALIMALANG CRM 3 JL TARUM BARAT BLOK E NO 5 - JAKARTA - 13450,-6.248578200,106.924994100,BCA
KALIMALANG CRM 4 JL TARUM BARAT BLOK E NO 5 - JAKARTA - 13450,-6.248578200,106.924994100,BCA
"INDOMARET GUNUNG BALONG JAKSEL JL GUNUNGBALONGRAYA,LEBAKBULUS,CILANDAK,JAKSEL",-6.303600000,106.788500000,BCA
GIANT LEBAK BULUS JL. LEBAK BULUS RAYA NO. 11 JAKARTA SELATAN,-6.299800000,106.777800000,BCA
"MAL MATAHARI PURI DAAN MOGOT CRM 2 JL DAAN MOGOT RAYA KM 16, JAKARTA",-6.150700000,106.713200000,BCA
"MAL MATAHARI PURI DAAN MOGOT CRM 3 JL DAAN MOGOT RAYA KM 16, JAKARTA",-6.150700000,106.713200000,BCA
"MAL MATAHARI PURI DAAN MOGOT CRM 4 JL DAAN MOGOT RAYA KM 16, JAKARTA",-6.150700000,106.713200000,BCA
INDOMARET RADEN SALEH III ( TVFN ) TANGERANG JL RADEN SALEH RT003/004 KARANG TENGAH TGR,-6.216900000,106.708500000,BCA
"CRM INDOMARET KELAPA MUDA RAYA V JL KELAPA HIBRIDA RT7/RW7, PONDOK KELAPA, DUREN SAWIT JAKARTA TIMUR",-6.239370000,106.929740000,BCA
DAN DAN BARATA TGR JL BARATA KARYA NO290 RT05/07 KRG TNGH TGR,-6.215380000,106.708122000,BCA
ALFAMART SEMANGKA KOJA CRM 1 JL SEMANGKA RAYA NO 15 RT 02 RW 4 KEL LAGOA KEC KOJA - JAKARTA UTARA,-6.115753000,106.911998000,BCA
"PIK AVENUE CRM 3 JL PANTAI INDAH KAPUK, KAMAL MUARA, PENJARINGAN, J",-6.108580000,106.740200000,BCA
"INDOMARET KARANG TENGAH RAYA JL KARANGTENGAHRAYA RT005RW04 LEBAK BULUS, CILANDAK, JAKSEL",-6.301200000,106.780600000,BCA
SPBU COCO 31.118.02 KALIDERES JL DAAN MOGOT RAYA KM 16 KEL KALIDERES KEC KALIDERES JAKARTA BARAT,-6.155399000,106.711290000,BCA
ALFAMART PINANG RANTI PONDOK GEDE RAYA RT 06/02 PINANG RANTI MAKASSAR JAKTIM,-6.291047000,106.885276000,BCA
"INDOMARET PINANG RANTI II JL RAYA PONDOK GEDE 3 RT 06/02 PINANG RANTI MAKASAR, JAKARTA TIMUR",-6.291100000,106.885200000,BCA
INDOMARET GRAHA MORRIS DAAN MOGOT BARU 2 JL DAAN MOGOT BARU BLOK LC2 NO 17 JAKBAR,-6.150168000,106.713091000,BCA
INDOMARET GRAHA MORRIS DAAN MOGOT BARU JL DAAN MOGOT BARU BLOK LC2 NO 17 JAKBAR,-6.150168000,106.713091000,BCA
"INDOMARET KINTAMANI 18 CRM JL KINTAMANI RAYA RT8/RW12,KALIDERES, JAKBAR",-6.151750000,106.712450000,BCA
"INDOMARET BANGUN REKSA JL BARATA RAYA NO 44, KARANG TENGAH, TANGERANG",-6.215160000,106.707800000,BCA
"PANTAI INDAH KAPUK KCU CRM 5 JL PANTAI INDAH KAPUK UTARA I BLOK F, KAPUK MUARA, PENJARINGAN - JAKARTA UTARA",-6.108329800,106.740135200,BCA
"PANTAI INDAH KAPUK KCU CRM 6 JL PANTAI INDAH KAPUK UTARA I BLOK F, KAPUK MUARA, PENJARINGAN - JAKARTA UTARA",-6.108329800,106.740135200,BCA
"PANTAI INDAH KAPUK KCU CRM 7 JL PANTAI INDAH KAPUK UTARA I BLOK F, KAPUK MUARA, PENJARINGAN - JAKARTA UTARA",-6.108329800,106.740135200,BCA
"PANTAI INDAH KAPUK KCU CRM 1 JL PANTAI INDAH KAPUK UTARA I BLOK F, KAPUK MUARA, PENJARINGAN - JAKARTA UTARA",-6.108329800,106.740135200,BCA
"PANTAI INDAH KAPUK KCU CRM 2 JL PANTAI INDAH KAPUK UTARA I BLOK F, KAPUK MUARA, PENJARINGAN - JAKARTA UTARA",-6.108329800,106.740135200,BCA
"PANTAI INDAH KAPUK KCU CRM 3 JL PANTAI INDAH KAPUK UTARA I BLOK F, KAPUK MUARA, PENJARINGAN - JAKARTA UTARA",-6.108329800,106.740135200,BCA
"PANTAI INDAH KAPUK KCU CRM 4 JL PANTAI INDAH KAPUK UTARA I BLOK F, KAPUK MUARA, PENJARINGAN - JAKARTA UTARA",-6.108329800,106.740135200,BCA
"NASRINDO SWALAYAN JL. KEBAGUSAN RAYA NO.1, JAKARTA SELATAN",-6.309129000,106.826798000,BCA
INDOMARET JIMBARAN JL JIMBARAN BLOK 5B NO 5-6 JAKARTA BARAT,-6.152315000,106.712166000,BCA
"ALFAMART TAMAN PALEM LESTARI III JL TAMAN PALEM LESTARI NO 26, RT01/16, CENGKARENG BARAT, CENGKARENG, JAKARTA BARAT",-6.134873000,106.719983000,BCA
"PIK AVENUE CRM 1 JL PANTAI INDAH KAPUK, KAMAL MUARA, PENJARINGAN, JAKARTA",-6.108500000,106.739800000,BCA
"PIK AVENUE CRM 2 JL PANTAI INDAH KAPUK, KAMAL MUARA, PENJARINGAN, JAKARTA",-6.108500000,106.739800000,BCA
"PIK AVENUE CRM 4 JL PANTAI INDAH KAPUK, KAMAL MUARA, PENJARINGAN, J",-6.108500000,106.739800000,BCA
"PIK AVENUE CRM 5 JL PANTAI INDAH KAPUK, KAMAL MUARA, PENJARINGAN, J",-6.108500000,106.739800000,BCA
"PIK AVENUE CRM 6 JL PANTAI INDAH KAPUK, KAMAL MUARA, PENJARINGAN, J",-6.108500000,106.739800000,BCA
"ALFAMIDI TANJUNG BARAT JL LENTENG AGUNG RT03/01, LENTENG AGUNG, JAGAKARSA, JAKARTA SELATAN",-6.308500000,106.838100000,BCA
"ALFAMIDI KAMAL RAYA II JL KAMAL RAYA NO E,F,G,H, TEGAL ALUR, KALI DERES, JAKARTA BARAT",-6.126500000,106.724600000,BCA
INDOMARET KRAMAT JAYA 22 JL KRAMAT JAYA 22 BLOK A NO 3 KAV NO 3 KEL TUGU UTARA KEC KOJA JAKARTA UTARA,-6.120964000,106.917106000,BCA
"ALFAMART SEMANAN RAYA III CRM 1 JL RAYA SEMANAN, KEL SEMANAN, KEC KALIDERES, JAKAR",-6.169520000,106.706917000,BCA
"ALFAMIDI HAJI MENCONG 2 JL H MENCONG, PANINGGILAN, CILEDUK, TGR",-6.243000000,106.716500000,BCA
"ALFAMIDI HAJI MENCONG JL H MENCONG, PANINGGILAN, CILEDUK, TGR",-6.243000000,106.716500000,BCA
INDOMARET KKO CILANDAK JL CILANDAK KKO NO 40 JAKARTA SELATAN,-6.309722000,106.814014000,BCA
KEBAB TURKI JL RS FATMAWATI NO 33 CILANDAK PD LABU,-6.306400000,106.793600000,BCA
OMI KARISMA IV JL NANGKA GG LANGGAR 74D TANJUNG BRT JAKSEL,-6.307707000,106.846566000,BCA
CARREFOUR CBD CILEDUG JL HOS COKROAMINOTO NO93 KARANG TENGAHCILEDUG,-6.222974000,106.708633000,BCA
"ALFAMART JATIWARINGIN IV BEKASI CRM 1 JL RAYA JATIWARINGIN NO 99, JATIWARINGIN, PONDOK G",-6.269790000,106.911825000,BCA
ALFAMART METRO RADEN SALEH KOMP METRO PERMATA 1 BLOK N8 / 9-10 TANGERANG,-6.209300000,106.705700000,BCA
"CIRCLE K JAK0211 JATINEGARA BARAT JL. JATINEGARA BARAT NO.124, JAKARTA TIMUR",-6.211800000,106.939500000,BCA
"INDOMARET PENGGILINGAN RAYA 1 JL PENGGILINGAN RAYA RT012/011 NO 4, PENGGILINGAN, CAKUNG, JAKTIM",-6.211800000,106.939500000,BCA
"INDOMARET PENGGILINGAN RAYA 2 JL PENGGILINGAN RAYA RT012/011 NO 4, PENGGILINGAN, CAKUNG, JAKTIM",-6.211800000,106.939500000,BCA
ACE HARDWARE BONA INDAH KOMP BONA INDAH BUSINESS CENTER JL KARANG TENGAH BLOK B/1 NO 9C -9L KEL LEBAK BULUS KEC CILANDAK JAKARTA SELATAN,-6.302843000,106.781573000,BCA
ALFAMART BERUANG TANG SEL CRM 1 JL BERUANG RAYA PONDOK RANJI TANGSEL,-6.275377000,106.738853000,BCA
ALFAMART BAMBU LARANGAN JL BAMBU LARANGAN RAYA RT 08/09 JAKARTA BARAT,-6.139002000,106.716676000,BCA
INDOMARET KESEHATAN CIJANTUNG JL KESEHATAN CIJANTUNG JAKARTA TIMUR,-6.304600000,106.859100000,BCA
ALFAMART MAWAR MERAH JL MAWAR MERAH RAYA NO 6 JAKARTA TIMUR,-6.224584000,106.936722000,BCA
GRAHA SEGARA 1 JL TIMOR RAYA NO 1 KOJA TANJUNG PRIOK,-6.101900000,106.900400000,BCA
"ALFAMIDI GREEN LAKE CORDOBA CRM JL GREEN LAKE CITY CORDOBA NO 38, 39, 50, 51, PETI",-6.185341000,106.704289000,BCA
CILANDAK KKO II CRM 1 KOMP PERTOKOAN JL RAYA CILANDAK KKO 5 RAGUNAN JAKSEL,-6.310047600,106.811951800,BCA
CILANDAK KKO II CRM 2 KOMP PERTOKOAN JL RAYA CILANDAK KKO 5 RAGUNAN JAKSEL,-6.310047600,106.811951800,BCA
CILANDAK KKO II CRM 3 KOMP PERTOKOAN JL RAYA CILANDAK KKO 5 RAGUNAN JAKSEL,-6.310047600,106.811951800,BCA
"ALFAMIDI MENTENG KOJA CRM JL MENTENG RT 1/RW 14, LAGOA, KOJA, JAKARTA UTARA",-6.113132500,106.911900500,BCA
ALFAMART PINANG RAYA JL PINANG RAYA NO 6 PONDOK LABU JAKSEL,-6.307947000,106.797990000,BCA
RS HARAPAN BUNDA PASAR REBO JL RAYA BOGOR KM 22 NO 44 JAKARTA TIMUR,-6.301445000,106.868561000,BCA
DAN DAN BINTARO SEKTOR V CRM 1 BINTARO UTAMA RAYA 5 PONDOK KARYA TANGSEL,-6.270287800,106.733548900,BCA
"ALFAMIDI WR SUPRATMAN II CRM 1 JL WR SUPRATMAN RT 006/10, RENGAS, CIPUTAT TIMUR,",-6.283011000,106.746420000,BCA
"ALFAMIDI PONDOK KELAPA JL PONDOK KELAPA RAYA, KAV PTB DKI BLOK A12/4 RT05/011, MALAKA JAYA, DUREN SAWIT, JAKARTA TIMUR",-6.231600000,106.935000000,BCA
MARKET CITY PANTAI INDAH KAPUK JL. PLUIT SELATAN 200 - JAKARTA - 14440,-6.107091000,106.738973000,BCA
"ALFAMART PENGGILINGAN BARU JL RAYA PENGGILINGAN RT 002 RW 004, KEL PENGGILINGAN, KEC CAKUNG, JAKARTA TIMUR",-6.214600000,106.939700000,BCA
ALFAMART KARANG TENGAH CILANDAK JL KARANG TENGAH I NO 2A JAKARTA SELATAN,-6.303600000,106.781700000,BCA
ALFAMART KRAMAT JAYA SEMPER JL. KRAMAT JAYA 44C  JAKARTA UTARA,-6.118500000,106.916800000,BCA
INDOMARET KRAMAT JAYA III JL KRAMAT JAYA BLOK F GG VIII NO 3 JAKUT,-6.118554000,106.916887000,BCA
ALFAMART NUSA INDAH RAYA JL NUSA INDAH RAYA 16 PERUMNAS KLENDER JAKTIM,-6.219900000,106.938600000,BCA
ALFAMART NUSA INDAH RAYA 2 JL NUSA INDAH RAYA 16 PERUMNAS KLENDER JAKTIM,-6.219900000,106.938600000,BCA
YAYASAN BUDHA TZU CHI JL BOULEVARD PANTAI INDAH KAPUK JAKARTA UTARA,-6.107300000,106.738600000,BCA
FOOD PLAZA CRM JL PANTAI INDAH KAPUK BOULEVARD JAKARTA UTARA,-6.104119000,106.741655000,BCA
"FOOD PLAZA CRM 2 JL PANTAI INDAH KAPUK BOULEVARD PENJARINGAN, JAKAR",-6.104119000,106.741655000,BCA
"CRM PLAZA BARU CILEDUG 1 JL HOS COKROAMINOTO, TANGERANG",-6.224958000,106.708092000,BCA
"CRM PLAZA BARU CILEDUG 2 JL HOS COKROAMINOTO, TANGERANG",-6.224958000,106.708092000,BCA
"FRESH MARKET JAKARTA UTARA CRM 1 JL ARTERI PANTAI INDAH KAPUK, JAKARTA UTARA",-6.103982000,106.741648000,BCA
"SPBU PONDOK KOPI JL. R. SOEKAMTO, PONDOK KOPI - JAKARTA TIMUR",-6.226917000,106.936971000,BCA
"SPBU 34.12410 KARANG TENGAH JL KARANG TENGAH NO 7-8 LEBAK BULUS , JAKSEL",-6.304083000,106.781933000,BCA
"ALFAMIDI CILANDAK KKO JL. MARGASATWA, JAKARTA SELATAN",-6.310942000,106.813457000,BCA
INDOMARET PONDOK KELAPA II JAKTIM JL PDK KELAPA BLK L NO 4 PONDOK KELAPA DUREN SAWIT JAKTIM,-6.234009000,106.934646000,BCA
"GIANT CIPINANG JL JEND BASUKI RACHMAD CIPINANG BESAR, JAKTIM",-6.217300000,106.939600000,BCA
"INDOMARET STASIUN PONDOK KOPI JL MAKMUR NO 1 RT001/004, CAKUNG, JAKARTA TIMUR",-6.217300000,106.939600000,BCA
ALFAMART MENTENG JAK UT JL MENTENG NO 70 KOJA JAKARTA UTARA,-6.113005500,106.912899100,BCA
INDOMARET PLUS JATIWARINGIN JL JATIWARINGI JATIWARINGIN KEC PONDOK GEDE BKS,-6.271500000,106.912000000,BCA
INDOMARET PLUS JATIWARINGIN 2 JL JATIWARINGI JATIWARINGIN KEC PONDOK GEDE BKS,-6.271500000,106.912000000,BCA
"ALFAMIDI CEGER RAYA III CRM 1 JL CEGER RAYA RUKO NO 1A,B,C,D, JURANG MANGU TIMUR",-6.263102000,106.726736000,BCA
ALFAMART LENTENG AGUNG IV CRM 2 JL RAYA LENTENG AGUNG NO 9 JAKARTA SELATAN,-6.310600000,106.837700000,BCA
ALFAMART LENTENG AGUNG IV CRM 1 JL RAYA LENTENG AGUNG NO 9 JAKARTA SELATAN,-6.310600000,106.837700000,BCA
INDOMARET TAMAN SURYA JL PERUM TAMAN SURYA II BLOK C2 KALIDERES,-6.136707000,106.716373000,BCA
"PRIMA FRESHMART TB SIMATUPANG JL TB SIMATUPANG NO 1 RT 008 RW 002, GEDONG, PASAR REBO, JAKARTA TIMUR",-6.304700000,106.862900000,BCA
ALFAMIDI BINTARO UTAMA V CRM JL. BINTARO UTAMA 5 BLOK EA 1/3 TANG - SEL,-6.270308000,106.732209000,BCA
INDOMARET PLUS JIMBARAN II JAKARTA BARAT 2 DAAN MOGOT BARU BLOK LB2 11A - 11B KEL KALIDERES KEC KALIDERES JAKARTA BARAT,-6.147600000,106.711300000,BCA
"ALFAMART RUKO CORDOBA 2 JL GREEN LAKE CITY CORDOBA BLOK F36, PETIR, CIPONDOH, TANGERANG",-6.186389000,106.702914000,BCA
"ALFAMART SEMANAN RAYA CRM 1 JL RAYA SEMANAN NO 86, RT 008/08, CENGKARENG",-6.167576000,106.705131000,BCA
INDOMARET PLUS JIMBARAN II JAKARTA BARAT DAAN MOGOT BARU BLOK LB2 11A - 11B KEL KALIDERES KEC KALIDERES JAKARTA BARAT,-6.147654000,106.710998000,BCA
"ALFAMART RUKO CORDOBA JL GREEN LAKE CITY CORDOBA BLOK F36, PETIR, CIPONDOH, TANGERANG",-6.186385000,106.702744000,BCA
ALFAMART GOLD COAST JL PANTAI INDAH KAPUK BOULEVARD UB - GRB/009 KAMAL MUARA JAKARTA UTARA,-6.104200000,106.740300000,BCA
"INDOMARET KOMARUDIN II JAKARTA TIMUR JL KOMARUDIN RAYA RT03/05, PENGGILINGAN, CAKUNG, JAKARTA TIMUR",-6.209400000,106.941900000,BCA
ALFAMART KOMARUDIN II JL. KOMARUDIN RAYA NO. 15 RT. 03/05 JAKTIM,-6.209100000,106.942000000,BCA
KRAMAT JAYA CRM 4 JL KRAMAT JAYA BLOK F1/10 - JAKARTA,-6.116697300,106.917184900,BCA
KRAMAT JAYA CRM 5 JL KRAMAT JAYA BLOK F1/10 - JAKARTA,-6.116697300,106.917184900,BCA
KRAMAT JAYA CRM 1 JL KRAMAT JAYA BLOK F1/10 - JAKARTA,-6.116697300,106.917184900,BCA
KRAMAT JAYA CRM 2 JL KRAMAT JAYA BLOK F1/10 - JAKARTA,-6.116697300,106.917184900,BCA
"ALFAMART PONDOK KELAPA 2 JL RAYA PONDOK KELAPA B1 1/14, JAKARTA",-6.238037000,106.934145000,BCA
"ALFAMART CIPTO MANGUNKUSUMO II TGR CRM 1 JL DR CIPTO MANGUNKUSUMO / H MENCONG RT01/11, PANI",-6.243138000,106.713666000,BCA
ALFAMART CIPTO MANGUNKUSUMO CRM 1 JL HAJI MENCONG NO 35 PENINGGILAN UTARA CILEDUG TA,-6.243138000,106.713666000,BCA
"ALFAMART KEBAGUSAN II JL. KEBAGUSAN RAYA. KEBAGUSAN , PASAR MINGGU",-6.312700000,106.825600000,BCA
OMI AGUNG JL RAYA H KAMANG NO 10 RT008/RW010 PONDOK LABU CILANDAK JAKARTA SELATAN,-6.308309000,106.789975000,BCA
"ALFAMIDI FATMAWATI JL RS FATMAWATI RAYA, JAKARTA SELATAN",-6.309342000,106.793656000,BCA
"ALFAMIDI SEMANAN AMD 2 JL SEMANAN AMD 1 RT 14/08, DURI KOSAMBI, CENGKARENG, JAKARTA BARAT",-6.177483000,106.702519000,BCA
"BEAU BINTARA RAYA JL BINTARA RAYA NO 6 BINTARA, KEC BEKASI BARAT, BEKASI",-6.229248000,106.938002500,BCA
SPBU 34-13422 KALIMALANG JL RY KALIMALANG BLOKQ2-C KALIMALANG JAKTIM,-6.248050000,106.930130000,BCA
"ALFAMART RANCHO INDAH II JL TANJUNG BARAT RANCO INDAH DALAM RT 7/1, JAKSEL",-6.309700000,106.851100000,BCA
ALFAMART LENTENG AGUNG II JL TANJUNG BARAT SELATAN JAGAKARSA,-6.312000000,106.838800000,BCA
"ALFAMIDI PONDOK LABU CRM 1 JL FATMAWATI NO 47, PONDOKLABU, JAKARTA",-6.309500000,106.793600000,BCA
SPBU 34-13802 PONDOK GEDE CRM 1 JL RAYA PONDOK GEDE NO.40 JAKARTA TIMUR 13810,-6.289764800,106.894449800,BCA
"ALFAMIDI SEMANAN AMD 1 JL SEMANAN AMD 1 RT 14/08, DURI KOSAMBI, CENGKARENG, JAKARTA BARAT",-6.177432000,106.702150000,BCA
"ALFAMIDI GREEN LAKE EAST ASIA JL GREEN LAKE GREAT WALK BLOK A NO 28-31, PETIR, CIPONDOH, TANGERANG",-6.193625000,106.701311000,BCA
"ALFAMIDI KAMPUNG UTAN II CRM 1 JL RAYA WR SUPRATMAN 47 RT 005/009, RENGAS, CIPUTA",-6.286200000,106.746100000,BCA
"ALFAMIDI KAMPUNG UTAN II CRM 2 JL RAYA WR SUPRATMAN 47 RT 005/009, RENGAS, CIPUTA",-6.286200000,106.746100000,BCA
INDOMARET RAYA JAPOS CRM 1 JL RAYA JAPOS RT06 RW03 JURANG MANGU BARAT - PONDO,-6.257273000,106.720273000,BCA
PONDOK CABE CRM 3 RUKO PDK CABE MUTIARA JL CABE RAYA - CIPUTAT,-6.346973730,106.750202100,BCA
