address,latitude,longitude,Bank
PONDOK GEDE PLAZA CRM 6 PONDOK GEDE PLAZA BLOK H 3 & 5 JL PONDOK GEDE RAYA BEKASI,-6.284381000,106.910170000,BCA
INDOMARET MANUNGGAL TMII JL MANUNGGAL XVII PINTU 2 TMII JAKTIM,-6.297100000,106.894400000,BCA
"ALFAMART CIRENDEU II CRM 1 JL CIRENDEU RAYA, CIPUTAT, TANGERANG SELATAN",-6.308685000,106.772250000,BCA
ALFAMART MARNA PUTRA BKS CRM 1 JL MARNAPUTRA ATAS RUKO BLK4A JTBENING BKS,-6.259837000,106.930510000,BCA
"INDOMARET MENCENG RAYA 45 JAKARTA BARAT JL MENCENG RAYA BLOK B 1 NO 4 - 7, RT 05 / 11, JAKARTA BARAT",-6.121100000,106.716700000,BCA
INDOMARET DURIAN JAGAKARSA JL DURIAN RT01 RW04 JAGAKARSA JAGAKARSA JAKSEL,-6.319039000,106.815710000,BCA
ALFAMART JATINEGARA BARAT 2 JL JATINEGARA BARAT NO 2 RT 01/05 KEL KAMPUNG MELAYU KEC JATINEGARA JAKTIM,-6.175200000,106.949200000,BCA
"ALFAMART KAYU TINGGI JL KAYU TINGGI NO 49, CAKUNG TIMUR, CAKUNG, JAKARTA TIMUR",-6.175200000,106.949200000,BCA
"RS MITRA KELUARGA KALIDERES 1 JL PETA SELATAN NO 11, RT/ RW 007/011, KALIDERES, JAKBAR",-6.149763000,106.702418000,BCA
INDOMARET H NAMAN JL H NAMAN NO 31 JAKARTA TIMUR,-6.242509200,106.939984600,BCA
"DAN DAN CITRA GARDEN II RUKO CITRA GARDEN 2, BLOK H2, JAKARTA BARAT",-6.143031000,106.704700000,BCA
ACE HARDWARE CITRA VI PERUM CITRA GARDEN CITY (CITRA 6) KEL PEGADUNGAN KEC KALIDERES CITRA 6 BLOK J6 PEGADUNGAN JAKARTA BARAT,-6.126264000,106.713052000,BCA
FARMERS MARKET CITRA VI PERUM CITRA 6 BLOK J6A TEGAL ALUR KALIDERES JAKARTA BARAT,-6.126294000,106.712739000,BCA
BCA SYARIAH MIKRO BUR PSR CILEDUG TGR RUKO DIAN PLZ 12 A JL R FATAH NO 8A CILEDUG,-6.235900000,106.702500000,BCA
"INDOMARET BOULEVARD JGC PERUM JAKARTA GARDEN CITY SHOPPING ARCADE A07-08, RT10/RW9, CAKUNG TIMUR, JAKARTA TIMUR",-6.179910900,106.950410000,BCA
INDOMARET DIAN PLAZA TANGERANG JL RADEN FATAH RUKO DIAN PLAZA SUDIMARA TANGERANG,-6.235700000,106.702400000,BCA
"KLINIK SUCI HUSADA JL. SUCI NO. 21 SUSUKAN CIRACAS, JAKARTA",-6.309000000,106.874800000,BCA
INDOMARET ROROTAN BABEK JL ROROTAN BABEK TNI ROROTAN CILINCING JAKARTA UTARA,-6.158400000,106.946700000,BCA
INDOMARET ROROTAN BABEK 2 JL ROROTAN BABEK TNI ROROTAN CILINCING JAKARTA UTARA,-6.158400000,106.946700000,BCA
"ALFAMART LAMPIRI II JL PONDOK KELAPA SELATAN, KEL PONDOK KELAPA, KEC DUREN SAWIT, JAKARTA TIMUR",-6.252400000,106.935900000,BCA
INDOMARET KIHAJAR DEWANTORO II JL KIHAJAR DEWANTORO BLOK D2 / 45 RT 003 RW 003 GONDRONG CIPONDOH TANGERANG,-6.197715000,106.694607000,BCA
"INDOMARET CEMPAKA VI CRM JL RAYA KAYU TINGGI 1, KEL CAKUNG TIMUR, KEC CAKUNG JAKARTA TIMUR",-6.173949700,106.949981900,BCA
LOTTEMART BINTARO CRM 1 JL MH THAMRIN CBD AREA KAV 01-06 BLOK B7 TGR,-6.274708000,106.724722000,BCA
LOTTEMART BINTARO CRM 2 JL MH THAMRIN CBD AREA KAV 01-06 BLOK B7 TGR,-6.274708000,106.724722000,BCA
LOTTEMART BINTARO CRM 3 JL MH THAMRIN CBD AREA KAV 01-06 BLOK B7 TGR,-6.274708000,106.724722000,BCA
LOTTEMART BINTARO CRM 4 JL MH THAMRIN CBD AREA KAV 01-06 BLOK B7 TGR,-6.274708000,106.724722000,BCA
LOTTEMART BINTARO CRM 5 JL MH THAMRIN CBD AREA KAV 01-06 BLOK B7 TGR,-6.274708000,106.724722000,BCA
LOTTEMART BINTARO CRM 6 JL MH THAMRIN CBD AREA KAV 01-06 BLOK B7 TGR,-6.274708000,106.724722000,BCA
"ALFAMIDI DEWANTORO TGR JL KI HAJAR DEWANTORO RT 003/004, GONDRONG, CIPONDOH, TANGERANG",-6.197744000,106.694490000,BCA
INDOMARET KIHAJAR DEWANTORO II 2 JL KIHAJAR DEWANTORO BLOK D2 / 45 RT 003 RW 003 GONDRONG CIPONDOH TANGERANG,-6.197663000,106.694462000,BCA
"ALFAMIDI RADEN FATAH II CRM 1 JL RADEN FATAH NO 23 RT 1/1, PANINGGILAN UTARA, CI",-6.239278000,106.703368000,BCA
"SPBU 33-13801 KAMPUNG RAMBUTAN 1 JL TB SIMATUPANG KAMPUNG RAMBUTAN, CIRACAS JAKARTA TIMUR",-6.308000000,106.877900000,BCA
INDOMARET CITRA GARDEN II CRM PERUM CITRA GARDEN II 19 PEGADUNGAN KALIDERES JAKARTA BARAT,-6.135261000,106.707170000,BCA
PLAZA PONDOK GEDE II CRM 4 PLAZA PONDOK GEDE 2 BLOK A NO 20 & 21 BEKASI,-6.285400000,106.911100000,BCA
PLAZA PONDOK GEDE II CRM 5 PLAZA PONDOK GEDE 2 BLOK A NO 20 & 21 BEKASI,-6.285400000,106.911100000,BCA
PLAZA PONDOK GEDE II CRM 1 PLAZA PONDOK GEDE 2 BLOK A NO 20 & 21 BEKASI,-6.285400000,106.911100000,BCA
PLAZA PONDOK GEDE II CRM 2 PLAZA PONDOK GEDE 2 BLOK A NO 20 & 21 BEKASI,-6.285400000,106.911100000,BCA
PLAZA PONDOK GEDE II CRM 3 PLAZA PONDOK GEDE 2 BLOK A NO 20 & 21 BEKASI,-6.285400000,106.911100000,BCA
ALFAMART WR SUPRATMAN V CRM 1 JL WR SUPRATMAN GG MASJID NO 4 TANGSEL,-6.297017000,106.747913000,BCA
INDOMARET RADEN FATAH III JL RADEN FATAH NO 89 RT 01 RW 01 TGR,-6.241000000,106.703200000,BCA
"DAN DAN JATIWARINGIN JL BONTANG BLOK A XI NO 3 RT 004 / RW 013, JATIWARINGIN, PONDOK GEDE, BEKASI",-6.274600000,106.922200000,BCA
ALFAMART KEBAGUSAN IV JL RAYA JATIPADANG NO 06 RT 004/04 JAKSEL,-6.321310000,106.825440000,BCA
INDOMARET JATI PADANG JL KEBAGUSAN RAYA RT 011/RW055 JAKSEL,-6.321501000,106.824949000,BCA
RS BINTARO INTERNASIONAL JL MHTHAMRIN BLOKB3 NO1 SEKTOR 7 TANGERANG SELATAN,-6.275816000,106.723950000,BCA
ALFAMART GAMPRIT CRM 1 JL GAMPRIT RAYA PONDOK GEDE BEKASI,-6.278271000,106.919773000,BCA
"AEON MALL JAKARTA GARDEN CITY CRM 5 LT LG LOT G-70, JL CASSIA UTAMA NO 46, CAKUNG TIMU",-6.172671500,106.951399600,BCA
"AEON MALL JAKARTA GARDEN CITY CRM 6 LT LG LOT G-70, JL CASSIA UTAMA NO 46, CAKUNG TIMU",-6.172671500,106.951399600,BCA
"AEON MALL JAKARTA GARDEN CITY CRM 1 LT LG LOT G-70, JL CASSIA UTAMA NO 46, CAKUNG TIMUR, CAKUNG, JAKARTA TIMUR",-6.172671500,106.951399600,BCA
"AEON MALL JAKARTA GARDEN CITY CRM 2 LT LG LOT G-70, JL CASSIA UTAMA NO 46, CAKUNG TIMUR, CAKUNG, JAKARTA TIMUR",-6.172671500,106.951399600,BCA
"AEON MALL JAKARTA GARDEN CITY CRM 3 LT LG LOT G-70, JL CASSIA UTAMA NO 46, CAKUNG TIMUR, CAKUNG, JAKARTA TIMUR",-6.172671500,106.951399600,BCA
"AEON MALL JAKARTA GARDEN CITY CRM 4 LT LG LOT G-70, JL CASSIA UTAMA NO 46, CAKUNG TIMUR, CAKUNG, JAKARTA TIMUR",-6.172671500,106.951399600,BCA
INDOMARET GRAND SURYA CRM 1 KOMPGRAND SURYACENTERBLOKMMI NO 40-41 JAKBAR,-6.134535000,106.705996000,BCA
INDOMARET KARANG TENGAH JL KARANG TENGAH CILANDAK JAKARTA SELATAN,-6.315485000,106.782217000,BCA
"INDOMARET WR SUPRATMAN IV CRM 1 JL WR SUPRATMAN NO 30 CIPUTAT TIMUR, TANGERANG SEL",-6.299079000,106.748967000,BCA
"PASAR BENGKOK CRM 1 JL KH HASYIM ASHARI NO 34, PEDURENAN KARANG TENGAH",-6.222002100,106.696037600,BCA
ELECTRONIC CITY BINTARO CRM 1 JL BOULEVARD BINTARO JAYA BLOK 7/D 01 BINTARO JAYA,-6.275210000,106.722540000,BCA
"ALFAMART IR H JUANDA III CIPUTAT CRM 1 JL IR H JUANDA RT06/01, CEMPAKA PUTIH, CIPUTAT, TA",-6.305114000,106.758198000,BCA
"BINTARO CRM 4 CENTRAL BUSINESS DISTRICT, BINTARO JAYA SEKTOR VII, TANGERANG SELATAN",-6.275119000,106.722340400,BCA
INDOMARET MENJANGAN RAYA TANGSEL CRM 1 JL RAYAMENJANGAN KELPONDOKRANJI KECCIPUTAT TANGSEL,-6.291418000,106.738390000,BCA
"ALFAMART ALBAIDO JL LUBANG BUAYA RT04/05, LUBANG BUAYA, CIPAYUNG, JAKARTA TIMUR",-6.296900000,106.900300000,BCA
"INDOMARET HANKAM RAYA ( TXQ2 ) CRM 1 JL RAYA HANKAM NO 23 RT 02 RW 02, BEKASI",-6.286000000,106.913300000,BCA
"INDOMARET HANKAM RAYA ( TXQ2 ) CRM 2 JL RAYA HANKAM NO 23 RT 02 RW 02, BEKASI",-6.286000000,106.913300000,BCA
"INDOMARET HANKAM RAYA ( TXQ2 ) CRM 3 JL RAYA HANKAM NO 23 RT 02 RW 02, BEKASI",-6.286000000,106.913300000,BCA
INDOMARET PETA UTARA ( TGPG ) JAKARTA BARAT JL PETA UTARA RT06/06 PEGADUNGAN JAKBAR,-6.141083000,106.702341000,BCA
INDOMARET KEDUNGDORO SBY CRM 2 JL KEDUNGDORO NO 107 SURABAYA,-6.314498800,106.868148000,BCA
INDOMARET TRUNOJOYO BANGKALAN CRM JL TRUNOJOYO NO 13 BANGKALAN,-6.314498800,106.868148000,BCA
INDOMARET A YANI 27 MOJOKERTO CRM JL A YANI NO 27 MOJOKERTO,-6.314498800,106.868148000,BCA
INDOMARET SUCI JL SUCI NO 45 CIRACAS JAKARTA TIMUR,-6.314500000,106.868200000,BCA
"INDOMARET MENJANGAN PDK RANJI TANGSEL CRM 1 JL MENJANGAN RAYA NO73 PDKRANJI, CIPUTAT TIMUR, TA",-6.292049500,106.738719800,BCA
"ALFAMART GUNUNG ANYAR TAMBAK RUKO GUNUNG ANYAR RESIDENCE R36-R37, GUNUNG ANYAR TAMBAK, SURABAYA",-6.314498800,106.868614800,BCA
"ALFAMIDI H NAMAN JL H NAMAN NO 24 RT 13/03, PONDOK KELAPA, DUREN SAWIT, JAKTIM",-6.244500000,106.942700000,BCA
"H. NAMAN JL H. NAMAN NO 8, PONDOK KELAPA, JAKTIM",-6.245027000,106.942499000,BCA
INDOMARET GRAND SURYA KOMPGRAND SURYACENTERBLOKMMI NO 40-41 JAKBAR,-6.134163000,106.704877000,BCA
"INDOMARET PULO GEBANG I 2 JL PERUMAHAN PULO GEBANG BLOK D5/11-12, JAKARTA TIMUR",-6.195800000,106.954000000,BCA
INDOMARET BINTARA JAYA RAYA CRM 1 JL BINTARA JAYA RAYA NO 3 RT 008/10 BEKASI BARAT,-6.236626000,106.946185000,BCA
SPBU 34.13418 H. NAMAN CRM 1 JL H NAMAN NO 29 PONDOK KELAPA JAKARTA TIMUR,-6.246190000,106.942325000,BCA
"INDY PROPERTY BINTARO INDONESIA 1 INDY BINTARO OFFICE PARK, GEDUNG F LT 3, JL BOULEVARD JAYA BLOK B7/ A6 CBD BINTARO VII, KEL PONDOK JAYA, KEC PONDOK AREN, TANGSEL",-6.274300000,106.720400000,BCA
ALFAMART PONDOK AREN II CRM 1 JL PONDOK AREN RAYA RT 003 PONDOK AREN TANGERANG S,-6.263221100,106.712382400,BCA
"ALFAMART H SAPRI PONDOK AREN CRM 1 JL H SAPRI RT 5/9, PONDOK AREN, PONDOK AREN, TANGE",-6.253094000,106.706326000,BCA
INDOMARET BINTARA RAYA CRM 1 JL BINTARA 4 RT 06 01 BINTARA BEKASI BARAT,-6.225895000,106.950031000,BCA
"INDOMARET PULO GEBANG I JL PERUMAHAN PULO GEBANG BLOK D5/11-12, JAKARTA TIMUR",-6.195262400,106.954556400,BCA
"CIRENDEU CRM 1 JL CIRENDEU RAYA NO 14, CIRENDEU, TANGERANG SELATAN",-6.312517000,106.769809000,BCA
"CIRENDEU CRM 2 JL CIRENDEU RAYA NO 14, CIRENDEU, TANGERANG SELATAN",-6.312517000,106.769809000,BCA
ALFAMIDI BINTARA JAYA CRM 1 JL BINTARA JAYA RAYA KEL BINTANG JAYA BEKASI,-6.238978000,106.945888000,BCA
SUPERINDO CIPUTAT CRM 1 JL WR SUPRATMAN RT 02 RW 05 TANGSEL,-6.302803000,106.751670000,BCA
"INDOMARET WR SUPRATMAN 45 TANGSEL CRM 1 JL RAYA WR SUPRATMAN, CEMPAKAPUTIH, CIPUTAT TIMUR,",-6.303852000,106.753306000,BCA
ALFAMART TANJAKAN AURI JL TANJAKAN AURI NO 48 JAKARTA TIMUR,-6.244902800,106.943657900,BCA
INDOMARET ARINDA PERMAI TANGSEL CRM RUKO ARINDA PERMAI I B5 PONDOK AREN TANGSEL,-6.260925000,106.710306000,BCA
APOTIK TRIDHARMA JAGAKARSA 2 JL MOCH KAFI 1 NO25D1-D3 JAGAKARSA JAKSEL,-6.323470000,106.811368000,BCA
APOTIK TRIDHARMA JAGAKARSA JL MOCH KAFI 1 NO25D1-D3 JAGAKARSA JAKSEL,-6.323470000,106.811368000,BCA
INDOMARET RADEN FATAH RAYA TGR JL RADEN FATAH RUKO DIAN MANSION PARUNG SERAP TANGERANG,-6.243100000,106.701000000,BCA
"ALFAMART KUSUMA INDAH CRM 1 JL KUSUMA RAYA NO 2, KOMPLEK WISMA KUSUMA INDAH, P",-6.288785800,106.912604900,BCA
INDOMARET BINTARA JAYA PERMAI BEKASI CRM 1 JL BINTARA JAYA PERMAI RT 01/ 09 NO 51 BEKASI BARA,-6.240445000,106.945806000,BCA
"ALFAMIDI H MANSYUR JL H MANSYUR RT06/RW04, GONDRONG, CIPONDOH, TANGERANG",-6.200258000,106.690695000,BCA
"ALFAMART GONGSENG III JL RAYA GONGSENG UJUNG, KEL BARU, KEC PASAR REBO, JAKARTA TIMUR",-6.315700000,106.869500000,BCA
"ALFAMART H BAPING CRM JL H BAPING NO 37, RT07/09, CIRACAS, CIRACAS, JAKA",-6.315700000,106.869500000,BCA
ALFAMIDI LUBANG BUAYA CRM JL LUBANG BUAYA RT 01-05 JAKARTA TIMUR,-6.297304000,106.902834000,BCA
INDOMARET LUBANG BUAYA JL MONUMEN PANCASILA SAKTI LUBANG BUAYA JKT,-6.297304000,106.902834000,BCA
ALFAMIDI CEGER JL RYCEGER RT002RW002 NO39CEGERCIPAYUNGJAKTIM,-6.306791870,106.888559100,BCA
"INDOMARET PLUS PETA BARAT I CRM JL PETA BARAT NO 1, KALIDERES, JAKBAR",-6.143887600,106.699210800,BCA
METRO TANAH ABANG CRM 5 PASAR GROSIR METRO TANAH ABANG 2JAKARTA,-6.297465000,106.902964000,BCA
"INDOMARET JOE KELAPA TIGA JL KELAPA TIGA (JOE) RT02 RW06, LENTENG AGUNG, JAGAKARSA, JAKSEL",-6.324500000,106.830100000,BCA
"STKIP PANCA SAKTI BEKASI 1 JL RAYA HANKAM NO 54 JATIRAHAYU, PONDOK GEDE, BEKASI",-6.287837000,106.914649000,BCA
INDOMARET AGUNG RAYA JL AGUNG RAYA I NO 1 JAGAKARSA,-6.323950000,106.837250000,BCA
"ALFAMART PETA UTARA II JL. PETA UTARA RT.004/002, KALIDERES - JAKBAR",-6.134614000,106.702672000,BCA
"ALFAMIDI KEBAGUSAN III CRM GG LANGGAR III NO 6B, JAGAKARSA",-6.324928500,106.821978700,BCA
"ALFAMIDI PULO GEBANG JL PULO GEBANG RT 03 RW 06, KEL PULO GEBANG, KEC CAKUNG, JAKARTA TIMUR",-6.203000000,106.955500000,BCA
"TIP TOP PONDOK GEDE CRM 1 JL JATI MAKMUR NO. 30, PONDOK GEDE - BEKASI",-6.285219000,106.917886200,BCA
"GIANT CBD BINTARO CRM 2 GRAHA HERO, 3RD FLOOR, CBD BINTARO JAYA SEKTOR 7 B",-6.275893000,106.719369000,BCA
"GIANT CBD BINTARO CRM 3 GRAHA HERO, 3RD FLOOR, CBD BINTARO JAYA SEKTOR 7 B",-6.275893000,106.719369000,BCA
"GIANT CBD BINTARO CRM 1 GRAHA HERO, 3RD FLOOR, CBD BINTARO JAYA SEKTOR 7 BLOK B7/A7, PONDOK JAYA, PONDOK AREN, TANGERANG SELATAN",-6.275893000,106.719369000,BCA
ALFAMART PANGKALAN JATI CRM 1 JL PANGKALAN JATI II NO 104 RT 04/02 KEL PANGKALAN,-6.322316000,106.795426000,BCA
ALFAMIDI PANGKALAN JATI CRM 1 JL PANGKALAN JATI NO 1 LIMO DEPOK,-6.322316000,106.795426000,BCA
SPBU 34.15118 HASYIM ASHARI JL KH HASYIM ASHARI NO 90 PINANG TANGERANG,-6.223200000,106.693100000,BCA
ALFAMIDI CIRENDEU (SH99) CRM JL CIRENDEU RAYA 12-9 TANGERANG SELATAN,-6.313321000,106.767287300,BCA
INDOMARET PARUNG SERAB TANGSEL CRM 1 JL RADEN FATAH CILEDUG TANGSEL,-6.248300000,106.701735000,BCA
INDOMARET LENTENG AGUNG 28 (TH6K) JL LENTENG AGUNG RT13/05 KEL LENTENG AGUNG KEC JAGAKARTA JAKSEL,-6.325000000,106.833500000,BCA
INDOMARET GONDRONG 2 JL KH MANSYUR NO 1 RT 06/04 TANGERANG,-6.200567000,106.689467000,BCA
INDOMARET GONDRONG JL KH MANSYUR NO 1 RT 06/04 TANGERANG,-6.200567000,106.689467000,BCA
CERIAMART KEBANTENAN JL KEBANTENAN I NO 1A RT 04/RW05 KEL SEMPER TIMUR KEC CILINCING JAKARTA UTARA,-6.109500000,106.928200000,BCA
ALFAMART HASYIM ASHARI GONDRONG JL HASYIM ASHARI NO 07 RT06/04 GONDRONG TGR,-6.199842000,106.689400000,BCA
"INDOMARET CLUB HOUSE EAST ASIA CRM 1 CLUB HOUSE EAST ASIA GONDRONG, CIPONDOH TANGERANG",-6.199657100,106.689349200,BCA
"BINTARO CRM 1 CENTRAL BUSINESS DISTRICT, BINTARO JAYA SEKTOR VII, TANGERANG SELATAN",-6.274590000,106.717724000,BCA
"BINTARO CRM 2 CENTRAL BUSINESS DISTRICT, BINTARO JAYA SEKTOR VII, TANGERANG SELATAN",-6.274590000,106.717724000,BCA
BINTARO SENTRA MENTENG CRM 1 RUKO SENTRA MENTENG BLOK MN NO 3 TANG SEL BINTARO SEKTOR VII,-6.274590000,106.717724000,BCA
BINTARO SENTRA MENTENG CRM 2 RUKO SENTRA MENTENG BLOK MN NO 3 TANG SEL BINTARO SEKTOR VII,-6.274590000,106.717724000,BCA
BINTARO SENTRA MENTENG CRM 3 RUKO SENTRA MENTENG BLOK MN NO 3 TANG SEL BINTARO SEKTOR VII,-6.274590000,106.717724000,BCA
BINTARO UTAMA CRM 4 BINTARO JY BLOK E KAV 3-5 JL BINTARO UTAMA,-6.274590000,106.717724000,BCA
BINTARO UTAMA CRM 1 BINTARO JY BLOK E KAV 3-5 JL BINTARO UTAMA,-6.274590000,106.717724000,BCA
BINTARO UTAMA CRM 2 BINTARO JY BLOK E KAV 3-5 JL BINTARO UTAMA,-6.274590000,106.717724000,BCA
"ALFAMART BINTARA JAYA RAYA JL BINTARA JAYA RAYA NO 80, BINTARA, JAKARTA TIMUR",-6.243190400,106.946359100,BCA
NISSI BINTARO CRM 1 JL TEGAL ROTAN RAYA NO 78,-6.283820000,106.725590000,BCA
"ALFAMIDI PARUNG SERAB JL RADEN FATAH, PARUNG SERAB, CILEDUG, TGR",-6.248200000,106.701400000,BCA
"SUPERINDO HASYIM ASHARI (GONDRONG) JL KH HASYIM ASHARI, NEROKTOG, RT 001/RW 002,NEGROTOG, KEC TANGERANG, KOTA TANGERANG",-6.201224000,106.689210000,BCA
INDOMARET KINCAN RAYA JL KINCAN RAYA NO 57 BEKASI,-6.250728000,106.943053000,BCA
APOTIK K-24 BINTANG FARM CRM 1 JL KINCAN RY NO17 JATI BENING II PD GEDE BKSI,-6.250728000,106.943053000,BCA
ALFAMART ARINDA PERMAI PERUM ARINDA PERMAI BLOK B/2 RT004 RW004 PONDOK AREN / KEC.PONDOK,-6.261068900,106.708167500,BCA
INDOMARET PULO GEBANG 25 JL ANCOL I NO 9-10 PULO GEBANG JAKTIM,-6.199000000,106.956600000,BCA
INDOMARET PULO GEBANG 25 2 JL ANCOL I NO 9-10 PULO GEBANG JAKTIM,-6.199000000,106.956600000,BCA
"ALFAMIDI CITRA GARDEN CRM JL PETA BARAT RT 004/07 NO A1,A2,A3,A5,A6, KALIDERES, JAKBAR",-6.143300000,106.697800000,BCA
"INDOMARET HAJI HASAN JL H. HASAN NO. 6-B, CIJANTUNG, JAKARTA TIMUR",-6.323100000,106.849990000,BCA
"INDOMARET HAJI HASAN 2 JL H HASAN NO 6-B, CIJANTUNG, JAKARTA TIMUR",-6.323100000,106.849990000,BCA
SPBU BENZINE 34-11806 SATU MARET CRM 1 JL SATU MARET KALIDERES JAKARTA BARAT,-6.130476000,106.703446000,BCA
"ALFAMART PINANG RANTI III JL PINANG RANTI RT014 RW002 KEL MAKASAR, JAKARTA TIMUR",-6.195600000,106.956900000,BCA
ALFAMART PULO GEBANG IV JL RY PULO GEBANG NO 34 PULO GEBANG JAKTIM,-6.194711000,106.956926000,BCA
"INDOMARET PANGKALAN JATI RAYA DEPOK CRM 1 JL PANGKALAN JATI II RT004 RW02 CINERE, PANGKALAN",-6.322817000,106.793773000,BCA
"ALFAMART SPBU BP BINTARO SEKTOR 9 CRM JL BOULEVARD BINTARO JAYA BLOK CE/A-03, BINTARO SEKTOR 9",-6.275842900,106.718206900,BCA
"COURT MEGASTORE BINTARO 1 GEDUNG MARCELLA SQUARE, PUSAT KAWASAN NIAGA BINTARO JAYA SEKTOR 7 (BINTARO TRADE CENTER), PONDOK JAYA, PONDOK AREN, TANGSEL",-6.278600000,106.720400000,BCA
"ALFAMART CIREUNDEU JL. CIREUNDEU RAYA, CIPUTAT, TANGERANG",-6.315000000,106.769300000,BCA
ALFAMART LINGKUNGAN III JL LINGKUNGAN 3 NO 34 JAKARTA BARAT,-6.115000000,106.712300000,BCA
ALFAMART KEBAYORAN ARCADE CRM 1 RUKO KEBAYORAN ARCADE 2 BLOK B2-B9 RT 01 RW 02 JL,-6.273033000,106.715456000,BCA
"LIVING PLAZA BINTARO CRM 1 JL BINTARO UTAMA RAYA, TANGERANG",-6.278443000,106.719731000,BCA
"BINTARO TRADE CENTER 2 JL JEND SUDIRMAN PUSAT KAWASAN NIAGA, BINTARO",-6.279154000,106.720329000,BCA
"BINTARO TRADE CENTER JL JEND SUDIRMAN PUSAT KAWASAN NIAGA, BINTARO",-6.279154000,106.720329000,BCA
"ALFAMART TEGAL ROTAN CRM 1 JL TEGAL ROTAN RT 002/08, SAWAH BARU, CIPUTAT, TAN",-6.285079000,106.725648000,BCA
"INDOMARET JATI UTAMA BEKASI JL RAYA JATI UTAMA BLOK J, JATIBENING, BEKASI",-6.260890000,106.938450000,BCA
"INDOMARET KALIBARU CILINCING 2 JL KALIBARU BARAT VII RT012/05, KALIBARU, CILINCING, JAKARTA UTARA",-6.102300000,106.923700000,BCA
"INDOMARET KALIBARU CILINCING 1 JL KALIBARU BARAT VII RT012/05, KALIBARU, CILINCING, JAKARTA UTARA",-6.102300000,106.923700000,BCA
ALFAMIDI JAGAKARSA II CRM JL JAGAKARSA RT 05/02 KEL JAGAKARSA KEC JAGAKARSA,-6.326600000,106.820300000,BCA
"GREEN VILLAGE CRM 2 JL RUKAN GINZA BLOK A NO 16-17, TANGERANG",-6.203383000,106.688461000,BCA
"GREEN VILLAGE CRM JL RUKAN GINZA BLOK A NO 16-17, TANGERANG",-6.203383000,106.688461000,BCA
"ALFAMART JAGAKARSA II JALAN JAGAKARSA RAYA RT/ RW 02/ 07 KELURAHAN JAGAKARSA KECAMATAN JAGAKARSA, JAKARTA SELATAN",-6.326700000,106.821500000,BCA
"ALFAMART LINGKUNGAN III TEGAL ALUR JL LINGKUNGAN III NO 1, RT04/03, TEGAL ALUR, KALIDERES, JAKARTA BARAT",-6.114462000,106.712179000,BCA
CITRA GARDEN I CRM 1 PERUM CITRA GARDEN I BLOK I 1/4 - JAKARTA,-6.144278000,106.696479000,BCA
CITRA GARDEN I CRM 2 PERUM CITRA GARDEN I BLOK I 1/4 - JAKARTA,-6.144278000,106.696479000,BCA
CITRA GARDEN I CRM 3 PERUM CITRA GARDEN I BLOK I 1/4 - JAKARTA,-6.144278000,106.696479000,BCA
CITRA GARDEN I CRM 4 PERUM CITRA GARDEN I BLOK I 1/4 - JAKARTA,-6.144278000,106.696479000,BCA
CITRA GARDEN I CRM 5 PERUM CITRA GARDEN I BLOK I 1/4 - JAKARTA,-6.144278000,106.696479000,BCA
"INDOMARET PULO GEBANG RAYA II JL PULO GEBANG PERMAI, CAKUNG, JAKARTA TIMUR",-6.193608000,106.957740000,BCA
"INDOMARET PULO GEBANG RAYA II 2 JL PULO GEBANG PERMAI, CAKUNG, JAKARTA TIMUR",-6.193608000,106.957740000,BCA
ALFAMART KP SAWAH II CIPUTAT CRM 1 JL KI HAJAR DEWANTAR KAV 6 TANGERANG SELATAN,-6.295890000,106.736737000,BCA
ALFAMART RAWA KUNING JL RAWA KUNING CAKUNG JAKARTA TIMUR,-6.207290100,106.957043100,BCA
ALFAMIDI TEGAL ROTAN TANG SEL CRM 1 JL TEGAL ROTAN KEC PONDOK AREN TANGSEL,-6.286625000,106.726401000,BCA
"INDOMARET CITRA BARU PERUM CITRA GARDEN I, BLOK C11 NO  2, JAKARTA",-6.148107000,106.694785000,BCA
"INDOMARET CITRA BARU 2 PERUM CITRA GARDEN I, BLOK C11 NO  2, JAKARTA",-6.148079000,106.694769000,BCA
LOTTEMART TAMAN SURYA KOMP TAMAN SURYA V BLOK DD-1 JAKBAR,-6.129422000,106.702709000,BCA
"INDOMARET CITRA GARDEN I PERUM CITRA GARDEN BLOK L1 NO 9-10, KALIDERES, JAKARTA BARAT",-6.145100000,106.695800000,BCA
"INDOMARET PLUS JAGAKARSA (T8MA) JL RAYA JAGAKARSA, JAKARTA SELATAN",-6.327096400,106.821516000,BCA
"ALFAMART JAGAKARSA III JL JAGAKARSA RAYA NO 1A, RT 06/02, JAGAKARSA, JAKARTA SELATAN",-6.326982000,106.816708000,BCA
INDOMARET PORIS III CRM 1 JL PORIS INDAH BLOK E NO 865 RT 011/RW 05 PORIS INDAH CIPONDOH TANGERANG,-6.180377000,106.687940000,BCA
INDOMARET PORIS III CRM 2 JL PORIS INDAH BLOK E NO 865 RT 011/RW 05 PORIS IN,-6.180377000,106.687940000,BCA
INDOMARET PORIS III CRM 3 JL PORIS INDAH BLOK E NO 865 RT 011/RW 05 PORIS IN,-6.180377000,106.687940000,BCA
DAN DAN PORIS INDAH JL PORIS INDAH BLOK E11/233 RT 02/07 KEL CIPONDOH INDAH KEC CIPONDOH KODYA TANGERANG,-6.180800000,106.687900000,BCA
DAN DAN PORIS INDAH 2 JL PORIS INDAH BLOK E11/233 RT 02/07 KEL CIPONDOH INDAH KEC CIPONDOH KODYA TANGERANG,-6.180800000,106.687900000,BCA
JAGS ARENA JL JAGAKARSA KP KANDANG RT 006 RW 004 JAGAKARSA JAKSEL,-6.326908000,106.814560000,BCA
INDOMARET PINANG GRIYA PERUMPINANGGRIYA PERMAI RUKONO5-6-7CILEDUGTGR,-6.222100000,106.690900000,BCA
"ALFAMART PONDOK KACANG JL RAYA TAJUR, PONDOK KACANG, CILEDUG, TGR",-6.244600000,106.698100000,BCA
GREEN SEDAYU BIZ PARK JL DAAN MOGOT KM 12 JAKARTA,-6.159274000,106.691280000,BCA
"ALFAMART PORIS INDAH CRM 1 JL PERUM PORIS INDAH BLOK C NO 79, CIPONDOH",-6.176810000,106.688133000,BCA
ALFAMART KELAPA TIGA J KELAPA TIGA NO 49 KEC JAGAKARSA JAKSEL,-6.327167000,106.829233000,BCA
INDOMARET CIRENDEU II TANGSEL CRM 1 JL CIRENDEU RAYA RT 004 RW 003 KEL PISANGAN KEC CI,-6.316408000,106.769527000,BCA
"ALFAMART PORIS INDAH 2 JL PERUM PORIS INDAH BLOK C NO 79, CIPONDOH",-6.176700000,106.688000000,BCA
INDOMARET PONDOK KACANG JL RAYA PONDOK KACANG NO 25 TANGERANG,-6.244593000,106.697825000,BCA
INDOMARET RAYA JOMBANG TANGSEL CRM 1 JL RAYA JOMBANG NO78 RT04 RW05 KEL PONDOK KACANG T,-6.257818000,106.704269000,BCA
ALFAMIDI RAYA GOPLI CRM 1 JL JOMBANG CILEDUG RT 04 RW 05 KEL PONDOK AREN KEC,-6.257818000,106.704269000,BCA
INDOMARET SUMBER ARTHA KOMP RUKO SUMBER ARTHA BLOKA NO4-5 BEKASI,-6.249300000,106.945700000,BCA
"RS PURI CINERE CRM 1 JL MARIBAYA NO 1, PANGKALAN JATI, CINERE",-6.321620000,106.782980000,BCA
DAN DAN CITRA GARDEN I PERUM CITRA GARDEN I BLOK I KAVLING NO 1 RT 9/16,-6.145390000,106.695160000,BCA
ALFAMIDI CENDRAWASIH TANG SEL CRM 1 JL RAYA CENDRAWASIH CIPUTAT TANGSEL,-6.295029500,106.734591600,BCA
"ALFAMART PINUS RAYA JL PINUS RAYA BLOK E/601, CIPONDOJ INDAH, CIPONDOH, TANGERANG",-6.181962000,106.687150000,BCA
SUPERINDO KINCAN JL KINCAN RAYA NO 22 PONDOK GEDE BEKASI,-6.256406000,106.942526000,BCA
ALFAMART KAMPUNG PINANG JL HASYIM ASHARI KEL PINANG KEC PINANG TGR,-6.214051000,106.688389000,BCA
"ALFAMART PULO GEBANG JL PULO GEBANG PERMAI BLOK D 123 CAKUNG, JAK",-6.199708800,106.958834500,BCA
"GRAND CAKUNG CRM 1 JL RAYA BEKASI K 25 - CAKUNG, JAKARTA TIMUR",-6.186540000,106.959057000,BCA
"GRAND CAKUNG CRM 2 JL RAYA BEKASI K 25 - CAKUNG, JAKARTA TIMUR",-6.186540000,106.959057000,BCA
INDOMARET JUANDA II TANGSEL (T40J) CRM 1 JL H JUANDA NO 9-10 RT002 RW003 CEMPAKA PUTIH - CI,-6.310551000,106.755562000,BCA
"SPBU COCO 3417110 PONDOK UNGU BEKASI CRM 1 JL SULTAN AGUNG KM 28, PONDOK UNGU BEKASI",-6.201738000,106.958959000,BCA
"EBC MANGGA DUA SQUARE LG CRM 3 JL GUNUNG SAHARI RAYA NO 1, JAKARTA UTARA",-6.140708000,106.833161000,BCA
"EBC MANGGA DUA SQUARE LG CRM 4 JL GUNUNG SAHARI RAYA NO 1, JAKARTA UTARA",-6.140708000,106.833161000,BCA
"EBC MANGGA DUA SQUARE LG CRM 5 JL GUNUNG SAHARI RAYA NO 1, JAKARTA UTARA",-6.140708000,106.833161000,BCA
"EBC MANGGA DUA SQUARE LG CRM 6 JL GUNUNG SAHARI RAYA NO 1, JAKARTA UTARA",-6.140708000,106.833161000,BCA
"EBC MANGGA DUA SQUARE LG CRM 7 JL GUNUNG SAHARI RAYA NO 1, JAKARTA UTARA",-6.140708000,106.833161000,BCA
ALFAMART JATINEGARA BARAT II JL JATINEGARA BARAT NO 166 RT 01/03 KEL BIDARA CINA KEC JATINEGARA JAKTIM,-6.225231000,106.862600000,BCA
APARTEMEN BOTANICA JALAN TEUKU NYAK ARIEF NO 8 KEBAYORAN LAMA,-6.232679000,106.790612000,BCA
INDOMARET SERDANG II JAKARTA PUSAT JL SERDANG BARU I NO 2 RT05/05 SERDANG KEMAYORAN JAKPUS,-6.160800000,106.864800000,BCA
"RS MEDIKA PERMATA HIJAU JL. RAYA KEBAYORAN LAMA 64, JAKARTA",-6.218400000,106.778000000,BCA
"CARREFOUR MANGGA DUA SQUARE JL. MANGGA DUA RAYA, JAKARTA 14430",-6.140072000,106.830693000,BCA
ALFAMART RAWA SIMPRUG CRM 1 JL RAWA SIMPRUG III 14 A JAKARTA SELATAN,-6.228404000,106.785543000,BCA
ALFAMART RAWA SIMPRUG CRM 2 JL RAWA SIMPRUG III 14 A JAKARTA SELATAN,-6.228404000,106.785543000,BCA
PINANGSIA CRM 1 JL PINANGSIA II NO 3 & 3A - JAKARTA,-6.139967000,106.814679000,BCA
PINANGSIA CRM 2 JL PINANGSIA II NO 3 & 3A - JAKARTA,-6.139967000,106.814679000,BCA
"INDOMARET TAMAN HIDUP BARU JAKUT JL TAMAN HIDUP BARU NO I-G PADEMANGAN BARAT, PADEMANGAN, JAKUT",-6.141400000,106.837500000,BCA
MANGGA DUA SQUARE CRM 1 KOMPLEK MANGGA DUA SQUARE BLOK G NO8-9,-6.140185000,106.832452000,BCA
MANGGA DUA SQUARE CRM 2 KOMPLEK MANGGA DUA SQUARE BLOK G NO8-9,-6.140185000,106.832452000,BCA
MANGGA DUA SQUARE CRM 3 KOMPLEK MANGGA DUA SQUARE BLOK G NO8-9,-6.140185000,106.832452000,BCA
MANGGA DUA SQUARE CRM 4 KOMPLEK MANGGA DUA SQUARE BLOK G NO8-9,-6.140185000,106.832452000,BCA
MANGGA DUA SQUARE CRM 5 KOMPLEK MANGGA DUA SQUARE BLOK G NO8-9,-6.140185000,106.832452000,BCA
GEDUNG BINASENTRA CRM JL JEND GATOT SUBROTO KAV 71-73 JAKARTA,-6.240830000,106.841210000,BCA
INDOMARET FRESH CEMPAKA PUTIH RAYA 100 CRM JL CEMPAKA PUTIH TENGAH 27 NO 55 KEL CEMPAKA PUTIH,-6.174017000,106.872218000,BCA
BIDAKARA CRM 3 JL GATOT SUBROTO KAV 71 - 73 - JAKARTA,-6.241756900,106.838821100,BCA
"JATINEGARA TIMUR CRM 1 JL JATINEGARA TIMUR NO39, JAKARTA TIMUR",-6.220350900,106.866846400,BCA
"JATINEGARA TIMUR CRM 2 JL JATINEGARA TIMUR NO39, JAKARTA TIMUR",-6.220350900,106.866846400,BCA
"HARCO MANGGA DUA 1 JL. MANGGA DUA RAYA, JAKARTA",-6.139514000,106.829028000,BCA
"HARCO MANGGA DUA 2 JL. MANGGA DUA RAYA, JAKARTA",-6.139514000,106.829028000,BCA
PERTOKOAN MANGGA DUA 2-1 PS PAGI MANGGA DUALT3 JL ARTERI MANGGA DUAJKT,-6.139052000,106.824214000,BCA
PERTOKOAN MANGGA DUA 2-2 PSPAGI MANGGADUALTDSR JL ARTERI MANGGA DUAJKT,-6.139052000,106.824214000,BCA
"TUBAGUS ANGKE CRM 1 JL TUBAGUS ANGKE RAYA, JAKARTA 11460",-6.142001800,106.805187100,BCA
"TUBAGUS ANGKE CRM 2 JL TUBAGUS ANGKE RAYA, JAKARTA 11460",-6.142001800,106.805187100,BCA
"CIRCLE K CIKAJANG II JAKSEL 1 JL CIKAJANG NO54 RT013RW06 PETOGOGAN, KEBBARU, JAKSEL",-6.242259900,106.807621200,BCA
LATUMENTEN CRM 1 JL PROF DR LATUMENTEN 28 - JAKARTA,-6.147527000,106.793767000,BCA
