address,latitude,longitude,Bank
"TIBI SQUARE 2 JL. TANJUNG BARAT NO.85,  JAKARTA SELATAN",-6.296900000,106.841000000,BCA
"ELANG LAUT CRM 1 RUKO ELANG LAUT BOULEVARD PANTAI INDAH KAPUK, JL PANTAI INDAH SELATAN I BLOK A 28 JAKUT",-6.113042300,106.750690300,BCA
"ELANG LAUT CRM 2 RUKO ELANG LAUT BOULEVARD PANTAI INDAH KAPUK, JL PANTAI INDAH SELATAN I BLOK A 28 JAKUT",-6.113042300,106.750690300,BCA
"ELANG LAUT CRM 3 RUKO ELANG LAUT BOULEVARD PANTAI INDAH KAPUK, JL PANTAI INDAH SELATAN I BLOK A 28 JAKUT",-6.113042300,106.750690300,BCA
"ELANG LAUT CRM 4 RUKO ELANG LAUT BOULEVARD PANTAI INDAH KAPUK, JL PANTAI INDAH SELATAN I BLOK A 28 JAKUT",-6.113042300,106.750690300,BCA
"ELANG LAUT CRM 5 RUKO ELANG LAUT BOULEVARD PANTAI INDAH KAPUK, JL PANTAI INDAH SELATAN I BLOK A 28 JAKUT",-6.113042300,106.750690300,BCA
PLAZA OLEOS CRM 1 JL TB SIMATUPANG KAV 53A JAKARTA,-6.298250000,106.829660000,BCA
"CARREFOUR PONDOK INDAH 2 JL TB. SIMATUPANG NO 1, LEBAK BULUS, JAKSEL",-6.288073000,106.776855000,BCA
"CARREFOUR PONDOK INDAH JL TB. SIMATUPANG NO 1, LEBAK BULUS, JAKSEL",-6.288073000,106.776855000,BCA
INDOMARET CITY RESORT I (T2LZ) 2 JL CITY RESORT BLOK D 3/5 RT 07/14 CENGKARENG TIMUR JAKARTA BARAT,-6.136647000,106.731392000,BCA
"ALFAMART POLTANGAN (EH18) CRM JL POLTANGAN RT01 RW04, TANJUNG BARAT",-6.296741300,106.842048300,BCA
INDOMARET CITY RESORT II CRM 1 KOMP CITY RESORT RESIDENCE BLOK D/8-8A JAKBAR,-6.136779000,106.731295000,BCA
INDOMARET CITY RESORT II CRM 2 KOMP CITY RESORT RESIDENCE BLOK D/8-8A JAKBAR,-6.136779000,106.731295000,BCA
INDOMARET WALANG BARU 7 JAKUT JL WALANGBARU VII A BLOK E KAVNO10 RT001/07 KEL TUGUUTARA KEC KOJA JAKUT,-6.124700000,106.905900000,BCA
"ALFAMART CEGER RAYA V (1M35) CRM JL CEGER RAYA NO 1, PONDOK AREN",-6.260070000,106.740670000,BCA
ALFAMART RENGAS RAYA CRM 1 JL RENGAS RAYA PESANGGRAHAN JAKARTA SELATAN,-6.274468000,106.755068000,BCA
ALFAMART RENGAS RAYA CRM 2 JL RENGAS RAYA PESANGGRAHAN JAKARTA SELATAN,-6.274468000,106.755068000,BCA
EBC CONDET CRM 2 JL RAYA CONDET 1-I RT 005/03 JAKARTA TIMUR,-6.293495000,106.855850000,BCA
EBC CONDET CRM 4 JL RAYA CONDET 1-I RT 005/03 JAKARTA TIMUR,-6.293495000,106.855850000,BCA
APOTIK TANIA PONDOK KOPI 2 JL ROBUSTA RAYA NO 9 PONDOK KOPI JAKTIM,-6.253836700,106.909899700,BCA
APOTIK TANIA PONDOK KOPI JL ROBUSTA RAYA NO 9 PONDOK KOPI JAKTIM,-6.253836700,106.909899700,BCA
"INDOMARET CONDET BATU AMPAR JL RAYA CONDET RUKO NO 30A & 30 B, BATU AMPAR, KRAMAT JATI, JAKARTA TIMUR",-6.293601000,106.855765000,BCA
ALFAMART RENGAS RAYA JL RENGAS RAYA PESANGGRAHAN JAKARTA SELATAN,-6.274535000,106.754890000,BCA
ALFAMART RENGAS RAYA 2 JL RENGAS RAYA PESANGGRAHAN JAKARTA SELATAN,-6.274535000,106.754890000,BCA
INDOMARET BEA CUKAI CILINCING JL MANUNGGAL JUANG Q5 / 2 KEL SUKAPURA KEC CILINCING JAKARTA UTARA,-6.155379000,106.923626000,BCA
INDOMARET BEA CUKAI CILINCING 2 JL MANUNGGAL JUANG Q5 / 2 KEL SUKAPURA KEC CILINCING JAKARTA UTARA,-6.155379000,106.923626000,BCA
"INDOMARET MARZUKI JAKARTA TIMUR JL MARZUKI 4 NO 23, PENGGILINGAN, CAKUNG, JAKARTA TIMUR",-6.213000000,106.927900000,BCA
ALFAMIDI KARANG MULYA CRM 1 JL RADEN SALEH ( KP KARANG MULYA ) NO 30 TGR,-6.203929000,106.716257000,BCA
INDOMARET GARDEN BOULEVARD 2 GARDEN BOULEVARD F1 & F2 JAKARTA BARAT,-6.129397000,106.735476000,BCA
ALFAMART RUKO ELANG LAUT II JL RUKO ELANG LAUT BOULEVARD BLOK D NO 6-7 KEL KAMAL MUARA KEC PENJARINGAN JAKARTA UTARA,-6.123496000,106.739974000,BCA
OMI KARISTRA GED GRAHAGARDAOTTO JL TB SMTPANG KAV15 JAKSEL,-6.291800000,106.783800000,BCA
YEFTA MART JL. CENDRAWASIH RAYA NO. 28 JAKARTA BARAT,-6.144539000,106.726320000,BCA
INDOMARET GARDEN BOULEVARD GARDEN BOULEVARD F1 & F2 JAKARTA BARAT,-6.129459000,106.735106000,BCA
INDOMARET GRIYA PERMATA TANGERANG 2 JL GRIYA PERMATA CIPONDOH A1/1RT1/9 -1 TGR,-6.186996000,106.715371000,BCA
ALFAMART SWADAYA DUREN SAWIT JL SWADAYA RAYA DUREN SAWIT JAKARTA TIMUR,-6.238632000,106.919600000,BCA
"GREEN SEDAYU MALL CRM 1 JL LINGKAR LUAR BARAT, KOMPLEK TAMAN LESTARI, CENGKARENG,JAKBAR",-6.139446000,106.728624000,BCA
"RSIA GRAND FAMILY 1 JL PANTAI INDAH SELATAN, KOMPLEK ELANG LAUT BOULEVARD KAV 1, PENJARINGAN, JAKUT",-6.123900000,106.739100000,BCA
INDOMARET PLUS ELANG LAUT C5-6 RUKO ELANG LAUT BOULEVARD PIK BLOK C BO 5 & 6 JL PANTAI INDAH SELATAN KAMAL MUARA PENJARINGAN JAKARTA UTARA,-6.123551000,106.739369000,BCA
INDOMARET GRIYA PERMATA TANGERANG JL GRIYA PERMATA CIPONDOH A1/1RT1/9 -1 TGR,-6.187038000,106.715196000,BCA
"INDOMARET BINTARO SEKTOR 4 TANGSEL CRM JL PONDOK BETUNG RAYA RT002 RW005, PONDOK BETUNG,",-6.263445800,106.742355400,BCA
"ALFAMART INPRES LARANGAN II JL INPRES RAYA RT 001/009, LARANGAN UTARA, LARANGAN, TANGERANG",-6.236759000,106.724882000,BCA
"18 OFFICE PARK 1 JL TB SIMATUPANG KAV 18, PASAR MINGGU, JAKARTA SELATAN",-6.299294000,106.831875000,BCA
INDOMARET PLUMPANG SEMPER JL PLUMPANG SEMPER NO 10 JAKARTA UTARA,-6.130539000,106.911748000,BCA
"INDOMARET SPBU SHELL PLUMPANG CRM JL PLUMPANG SEMPER NO 16, RT 4/RW 4, TUGU UTARA, KOJA, JAKARTA UTARA",-6.131056200,106.912204200,BCA
"EBC POINS SQUARE CRM 3 JL LINGKAR LUAR SELATAN, JAKARTA SELATAN",-6.290097000,106.778025000,BCA
"EBC POINS SQUARE CRM 4 JL LINGKAR LUAR SELATAN, JAKARTA SELATAN",-6.290097000,106.778025000,BCA
"EBC POINS SQUARE CRM 1 JL LINGKAR LUAR SELATAN, JAKARTA SELATAN",-6.290097000,106.778025000,BCA
"EBC POINS SQUARE CRM 2 JL LINGKAR LUAR SELATAN, JAKARTA SELATAN",-6.290097000,106.778025000,BCA
"ALFAMART DELIMA RAYA JAKTIM JL DELIMA RAYA NO 11, RT02/06, MALAKASARI, DUREN SAWIT, JAKARTA TIMUR",-6.220833000,106.926839000,BCA
"INDOMARET BUARAN REGENCY JL TAMAN MALAKA SELATAN RT12/6 PONDOK KELAPA, DUREN SAWIT, JAKARTA TIMUR",-6.230600000,106.923700000,BCA
"INDOMARET KAYU BESAR DALAM CRM 1 JL KAYU BESAR DALAM CENGKARENG TIMUR, CENGKARENG,",-6.127212000,106.735987000,BCA
SEMPER CRM 1 JL PLUMPANG SEMPER NO 02  RT 010/002 JAKARTA,-6.131319000,106.912521000,BCA
"INDOMARET HOS COKROAMINOTO III JL HDS COKROAMINOTO SUDIMARA TIMUR, TANGERANG",-6.229600000,106.721400000,BCA
KANTOR SEKRETARIAT RW 09 JL ANGSANA UTAMAIIBLOKFVIIKELD.KOSAMBIJAKBAR,-6.172478000,106.716263000,BCA
INDOMARET PLUS FATMAWATI CILANDAK JL RS FATMAWATI KEC CILANDAK JAKARTA SELATAN,-6.296372000,106.794802000,BCA
"SUPERINDO REMPOA CRM 1 JL PAHLAWAN RAYA NO 9, REMPOA, CIPUTAT TIMUR, TANG",-6.281270000,106.761820000,BCA
"HERO BINTARO JL. BINTARO UTAMA RAYA SEKTOR 2, JAKARTA",-6.272399000,106.750462000,BCA
"ALFAMART BUKIT GOLF MEDITERANIA RUKAN EKSLUSIF BLOK C NO8, PANTAI INDAH KAPUK",-6.112707000,106.748554000,BCA
"ALFAMART DR HAMKA V JL PROF DR HAMKA (LARANGAN SELATAN) RT04/01, GAGA, LARANGAN, TANGERANG",-6.241700000,106.726600000,BCA
INDOMARET RC VETERAN III CRM JL REMPOA RAYA NO 57 BINTARO JAKSEL,-6.281480000,106.761783000,BCA
"SOUTH QUARTER CRM 2 JALAN RA KARTINI KAV 8, CILANDAK - JAKARTA SELATAN",-6.293610100,106.785225000,BCA
"MRT LEBAK BULUS 1 PD PINANG KBY LAMA, JAKARTA SELATAN",-6.289197000,106.774712000,BCA
"INDOMARET CIPADU RAYA CRM 1 JL KH WAHID HASYIM, JURANG MANGU TIMUR, PONDOK ARE",-6.258040000,106.736694000,BCA
INDOMARET RUKO GALAXY JL LINGKAR LUAR CENGKARENG BARAT JAKBAR,-6.135301000,106.729908000,BCA
METROPOLITAN TOWER 1 METROPOLITAN TOWER LANTAI BASEMENT,-6.292808300,106.782555000,BCA
ALFAMART TUGU PERMAI JL TUGU PERMAI BLOK B NO 4 TUGU UTARA JAKUT,-6.126500000,106.909900000,BCA
SPBU 34-15201 PONDOK KARYA CRM 1 JL RAYA CEGER RT 002 RW 03 PONDOK KARYA PONDOK ARE,-6.261474500,106.739265500,BCA
ALFAMIDI KAPUK CENGKARENG JL KAPUK CENGKARENG JAKARTA BARAT,-6.132875000,106.731238000,BCA
"ALFAMART LEBAK BULUS RAYA JL. LEBAK BULUS RAYA RT 9 RW 7 , PD PINANG, KBY LAMA",-6.289010000,106.773760000,BCA
"INDOMARET INPRES 8 JL INPRES NO 8, LARANGAN, TANGERANG",-6.236780000,106.723650000,BCA
"GEDUNG SMU II 1 KAWASAN PERLUASAN UTARA PT JIEP (CAKUNG DRAIN), JL TIPAR CAKUNG K AV F 57, JAKARTA TIMUR",-6.148277200,106.922682800,BCA
LAWSON TAMAN MALAKA JL TAMAN MALAKA SELATAN PONDOK KELAPA JAKTIM,-6.230703000,106.924513000,BCA
"METRO PERMATA CRM 1 KOMP METRO PERMATA, JL RADEN SALEH BLOK A2/1",-6.203221000,106.714377000,BCA
"METRO PERMATA CRM 2 KOMP METRO PERMATA, JL RADEN SALEH BLOK A2/1",-6.203221000,106.714377000,BCA
"METRO PERMATA CRM 3 KOMP METRO PERMATA, JL RADEN SALEH BLOK A2/1",-6.203221000,106.714377000,BCA
INDOMARET BUKIT GOLF MEDITERANIA RUKO EXCLUSIF BLOK B8 BUKIT GOLF MEDITERANIA,-6.112787000,106.747511000,BCA
INDOMARET RUKO GALAXY 2 JL LINGKAR LUAR CENGKARENG BARAT JAKBAR,-6.135333000,106.729447000,BCA
ALFAMIDI REMPOA CRM 2 JL RAYA REMPOA KEC CIPUTAT TIMUR TANGSEL,-6.282160000,106.761540000,BCA
"ALFAMART PETERNAKAN CRM JL RAYA INPRES NO 13, RT05/01, TENGAH, KRAMAT JATI",-6.290300000,106.870000000,BCA
"TRANSMART CILANDAK JL RAYA CILANDAK KKO NO 9, JAKARTA SELATAN",-6.300780000,106.814910000,BCA
"ALFAMART WAHID HASYIM II JL WAHID HASYIM, CIPADU JAYA, TANGERANG",-6.259000000,106.736600000,BCA
"PERKANTORAN HIJAU ARKADIA JL. TB SIMATUPANG KAV. 88, JAKARTA",-6.300570000,106.833690000,BCA
"ALFAMIDI TAMAN PALEM JL RUKO TAMAN PALEM LESTARI NO 19-21 BLOK G2, CENGKARENG, JAKBAR",-6.139632000,106.726663000,BCA
INDOMARET BLV SQUARE TMN PALEM LESTARI CRM JL BOULEVARDTMNLSTRI BLOKG-2NO9-10CNGKRENGTGR,-6.139632000,106.726663000,BCA
"ALFAMIDI REMPOA CRM 1 JL RAYA REMPOA,  KEL REMPOA, KEC CIPUTAT TIMUR, TANGSEL",-6.282232000,106.761159000,BCA
INDOMARET BONA INDAH II JL LEBAK BULUS I RT 03 RW 04 CILANDAK JAKSEL,-6.296183000,106.789666000,BCA
SPBU 34-13419 RADEN INTEN CRM 1 JL RADEN INTAN II NO 60 DUREN SAWIT JAK TIM,-6.242000000,106.920200000,BCA
SPBU 34-13419 RADEN INTEN CRM 2 JL RADEN INTAN II NO 60 DUREN SAWIT JAK TIM,-6.242000000,106.920200000,BCA
ALFAMIDI HAJI MENCONG II JL H MENCONG RT 002/01 TANGERANG,-6.231100000,106.720500000,BCA
"INDOFOOD DAAN MOGOT 1 JL DAAN MOGOT KM 19 BATU CEPER, TANGERANG",-6.155616000,106.719277000,BCA
INDOMARET KOSAMBI I 2 JL TAMAN KOSAMBI BARAT BLOK C 14 / 21 JAKBAR,-6.173712000,106.714601000,BCA
INDOMARET GADING GRIYA 2 PERUM GRIYA GADING LESTARI RUKO BLOK F-1 JAKARTA UTARA,-6.141400000,106.920300000,BCA
GREEN PARK VIEW JL DAAN MOGOT KM 14 CENGKARENG JAKARTA,-6.155605000,106.719181000,BCA
GREEN PARK VIEW 2 JL DAAN MOGOT KM 14 CENGKARENG JAKARTA,-6.155605000,106.719181000,BCA
ALFAMIDI PASAR REBO JL RYGONGSENGNO7RT011RW01CIJTUNG PSREBOJAKTIM,-6.291553000,106.868731000,BCA
"ALFAMART PRIMKOPAD DENMA KOPASUS JL. RS FADILAH CIJANTUNG 3,  JAKARTA TIMUR",-6.291553000,106.868731000,BCA
ALFAMART PERTENGAHAN JL PERTENGAHAN KEC PASAR REBO JAKARTA TIMUR,-6.291553000,106.868731000,BCA
"ALFAMIDI PERTENGAHAN CRM JL RAYA PERTENGAHAN NO 22, RT 03/07, CIJANTUNG, PASAR REBO, JAKARTA TIMUR",-6.291553000,106.868731000,BCA
ALFAMIDI JATI WARINGIN JL RAYA JATIWARINGIN NO 5 BEKASI,-6.258405000,106.910119000,BCA
SPBU 34-13419 RADEN INTEN CRM 3 JL RADEN INTAN II NO 60 DUREN SAWIT JAK TIM,-6.241576000,106.920787000,BCA
SPBU 34-13419 RADEN INTEN CRM 4 JL RADEN INTAN II NO 60 DUREN SAWIT JAK TIM,-6.241776000,106.920691000,BCA
SPBU 34-13419 RADEN INTEN CRM 5 JL RADEN INTAN II NO 60 DUREN SAWIT JAK TIM,-6.241776000,106.920691000,BCA
"GOLF LAKE RESIDENCE 1 JL LINGKAR LUAR BARAT RT 12/ RW 11, KELURAHAN CENGKARENG TIMUR, KECAMATAN CENGKARENG, JAKBAR",-6.128400000,106.732800000,BCA
ALFAMIDI KARANG MULYA 2 JL RADEN SALEH ( KP KARANG MULYA ) NO 30 TGR,-6.203984000,106.713441800,BCA
ALFAMIDI CISOKA JL KP CISOKA RT 003 RW 01 KEL CISOKA KEC CISOKA TANGERANG,-6.203984000,106.713441800,BCA
"PT GLOBAL TERMINAL MARUNDA 1 JL UJUNG PANDANG BLOK C KBN MARUNDA, CILINCING, JAKARTA UTARA",-6.098851500,106.944665700,BCA
"INDOMARET LAPANGAN BINTARA BEKASI CRM 1 JL BINTARA RAYA RT 02/08, KRANJI, BEKASI BARAT, BE",-6.234149000,106.970060000,BCA
"ALFAMART KOTA BARU CRM 1 JL KALIBARU BARAT NO 16, RT 003/RW 001, KEL KOTA B",-6.220629000,106.973319000,BCA
ALFAMIDI JOMBANG RAYA III CRM 1 JL RAYA JOMBANG NO 89 SEKTOR 9 NO A3 A5 & A6 PARIG,-6.287349000,106.702955000,BCA
ALFAMIDI JOMBANG RAYA III CRM 2 JL RAYA JOMBANG NO 89 SEKTOR 9 NO A3 A5 & A6 PARIG,-6.287349000,106.702955000,BCA
"CARREFOUR HARAPAN INDAH BEKASI PERUMAHAN TAMAN HARAPAN BARU, BEKASI",-6.184801000,106.975920000,BCA
DAN DAN GRAHA RAYA CRM 1 JL BOULEVARD GRAHA RAYA RUKO MELIA WALK BLOK MDA16,-6.238662000,106.676862200,BCA
INDOMARET STASIUN SUDIMARA TANGSEL CRM 1 JL JOMBANG RAYA RT 03/13 NO 48 JOMBANG CIPUTAT TAN,-6.298163000,106.712378000,BCA
"INDOMARET SRENGSENG JAGAKARSA NO23 JAKSEL JL SRENGSENGSAWAHNO23RT01 SRENGSENGSAWAH, JAGAKARSA, JAKSEL",-6.345100000,106.829400000,BCA
INDOMARET ASIA TROPIS BEKASI CRM 1 GRAND BOULEVARD RAYA RUKO ASIA TROPIS 16 NO 22 PUS,-6.171237000,106.974949000,BCA
INDOMARET SETU CIPAYUNG II JL SETU CIPAYUNG NO 84 JAKARTA TIMUR,-6.318851000,106.909183000,BCA
INDOMARET BRIGIF RAYA NO15 JL BRIGIF RAYA NO15 RT01 RW01 KEL CIPEDAK KEC JAGAKARSA JAKSEL,-6.344000000,106.801600000,BCA
INDOMARET PINANG KUNCIRAN TANGERANG JL NEAN SABA KUNCIRAN PINANG TANGERANG 15144,-6.217900000,106.671400000,BCA
ALFAMIDI KUNCIRAN JL KP KUNCIRAN RT 001/005 PINANG TANGERANG,-6.218200000,106.671400000,BCA
INDOMARET WARUNG SILA NO27 JAKSEL JL WARUNG SILA NO 27 RT02/05 CIGANJUR JAGAKARSA JAKSEL,-6.345000000,106.809000000,BCA
RS SARI ASIH CIPUTAT JL OTISTA SASAK TINGGI NO 3 TANGERANG SELATAN,-6.324900000,106.745700000,BCA
SPBU 34-15111 CIPONDOH CRM JL KH HASYIM ASHARI,-6.191350000,106.668940000,BCA
ALFAMART DUTA BINTARO JL KH MAS MANSYUR RUKO DUTA BINTARO BLOK AA 1,-6.232400000,106.674400000,BCA
HARAPAN INDAH SPORT CLUB KOMP. BULEVAR HIJAU KAV33-35 MDNSATRIABKSI,-6.184322000,106.976517000,BCA
"GIANT GRAHA RAYA CRM 1 JL BOULEVARD  GRAHA RAYA BLOK CP-01 , TGR",-6.239645000,106.676505000,BCA
SUPERINDO JATIKRAMAT JL JATIKRAMAT KEL JATIKRAMAT PDK GEDE BEKASI,-6.287191000,106.943660000,BCA
APOTIK SAUSAN NABILA CRM 1 JL MOH KAHFI I JAGAKARSA JAKARTA SELATAN,-6.344732000,106.804418000,BCA
ALFAMART WARUNG SILA JL. WARUNG SILA NO.261 JAKARTA,-6.344788000,106.804490000,BCA
"INDOMARET HARAPAN INDAH CRM 1 PERUM HARAPAN INDAH BLOK EA 19-20, BEKASI",-6.184705000,106.976763000,BCA
"INDOMARET HARAPAN INDAH CRM 2 PERUM HARAPAN INDAH BLOK EA 19-20, BEKASI",-6.184705000,106.976763000,BCA
ALFAMART HARAPAN INDAH II CRM 1 JL FLAMBOYAN RAYA BLOK K 1 NO 1 A & B BEKASI,-6.184705000,106.976763000,BCA
"RUKO GREEN HILL JL. ARIA PATUA NO. 89 CIPUTAT, TANGERANG",-6.311061000,106.725114000,BCA
HARAPAN INDAH CRM 2 SENTRA NIAGA HARAPAN INDAH KAV CP2 NO 1 BEKASI,-6.167670000,106.975080000,BCA
HARAPAN INDAH CRM 1 SENTRA NIAGA HARAPAN INDAH KAV CP2 NO 1 BEKASI,-6.167670000,106.975080000,BCA
HARAPAN INDAH CRM 4 SENTRA NIAGA HARAPAN INDAH KAV CP2 NO 1 BEKASI,-6.167670000,106.975080000,BCA
HARAPAN INDAH CRM 3 SENTRA NIAGA HARAPAN INDAH KAV CP2 NO 1 BEKASI,-6.167670000,106.975080000,BCA
INDOMARET RAWA BOKOR (T3CP) JL HUSEIN SASTRA NEGARA BENDA TANGERANG,-6.114700000,106.689200000,BCA
RS IMC BINTARO JL JOMBANG RAYA NO 56 SEKTOR IX TANGERANG,-6.291927000,106.705523000,BCA
ALFAMART KALISARI III JL KALISARI RAYA NO 5/6 RT 013/001 JAKTIM,-6.342100000,106.857700000,BCA
ALFAMART KALISARI III 2 JL KALISARI RAYA NO 5/6 RT 013/001 JAKTIM,-6.342088000,106.857765000,BCA
"ALFAMART RAWA BOKOR JL. HUSEIN SASTRANEGARA NO.16, KEC.BENDA, TGR",-6.114700000,106.689000000,BCA
ALFAMART KALISARI LAPAN JL KALISARI -LAPAN RT 05/01 PEKAYON JAKTIM,-6.340200000,106.865500000,BCA
ALFAMART SULTAN AGUNG BEKASI CRM 1 JL SULTAN AGUNG RAYA NO 66 RT 01/22 KEL KALIBARU K,-6.215498000,106.975492000,BCA
SPBU 34-15206 GRAHA BINTARO CRM JL GRAHA RAYA BINTARO,-6.275708500,106.693010400,BCA
INDOMARET BOULEVARD HIJAU II BEKASI CRM 1 RUKO BLOK SN 1 NO 11-12 KOTA HARAPAN INDAH BEKASI,-6.185729000,106.977390000,BCA
INDOMARET BOULEVARD HIJAU II BEKASI CRM 2 RUKO BLOK SN 1 NO 11-12 KOTA HARAPAN INDAH BEKASI,-6.185729000,106.977390000,BCA
"INDOMARET PARIOT III BEKASI CRM 1 JL PARIOT III BLK EZ NO 3 RT12/5 JAKASAMPURNA, BEK",-6.241550100,106.969296500,BCA
"INDOMARET HALIM PERDANA KUSUMA TANGERANG JL HALIM PERDANA KUSUMA RT03/01, JURUMUDI BARU, BENDA KOTA, TANGERANG",-6.148000000,106.674300000,BCA
"SPBU 34.15145 JURUMUDI CRM 1 JL HALIM PERDANA KUSUMA NO10, RT5/RW1, JURUMUDI BARU, BENDA, TANGERANG",-6.148996700,106.673991000,BCA
SPBU 34-15415 CIPAYUNG CIPUTAT CRM 1 JL RE MARTADINATA RT/RW 001/005 CIPAYUNG CIPUTAT T,-6.327316000,106.747853000,BCA
"CRM INDOMARET REGIA BOULEVARD KOMPLEK RUKO REGIA 1 BLOK RB NO 16-17,PD KACANG BARAT, PD AREN,TA NGSEL",-6.260922300,106.683996200,BCA
"INDOMARET OTISTA CIPUTAT JL OTISTA RAYA NO38, CIPUTAT, TANGERANG SELATAN",-6.324945900,106.743195700,BCA
ALFAMIDI RAYA CIPAYUNG CRM JL RAYA CIPAYUNG KAV DKI KEC CIPAYUNG JAK TIM,-6.332100000,106.889000000,BCA
TRANSMART BINTARO CRM 1 JL GRAHA RAYA BOULEVARD,-6.240302000,106.675455000,BCA
TRANSMART BINTARO CRM 2 JL GRAHA RAYA BOULEVARD,-6.240302000,106.675455000,BCA
INDOMARET ARYA PUTRA JOMBANG CRM JL ARIA PUTRA RT003 RW005 SERUA INDAH CIPUTAT TANGSEL,-6.307500000,106.719200000,BCA
ALFAMART KODAU BEKASI CRM 1 JL KODAU KEC PONDOK MELATI BEKASI,-6.295016000,106.938894000,BCA
ALFAMIDI OTISTA CIPUTAT CRM 1 JL OTISTA PAMULANG NO 27  TANGSEL,-6.325171000,106.743022000,BCA
INDOMARET HARAPAN INDAH IV BEKASI CRM 1 JL HARAPAN INDAH RUKO BLOK AA NO 6 RT10/19 PEJUANG,-6.181059000,106.977861000,BCA
INDOMARET JATIKRAMAT RAYA II BEKASI CRM 1 JL RAYA JATIKRAMAT JATIKRAMAT JATIASIH BKS,-6.286702000,106.945938000,BCA
INDOMARET JATIKRAMAT RAYA II BEKASI CRM 2 JL RAYA JATIKRAMAT JATIKRAMAT JATIASIH BKS,-6.286702000,106.945938000,BCA
INDOMARET SULTAN AGUNG BEKASI CRM 1 JL RAYA SULTAN AGUNG KEL MEDAN SATRIA BEKASI,-6.207055000,106.977774000,BCA
INDOMARET SULTAN AGUNG BEKASI CRM 2 JL RAYA SULTAN AGUNG KEL MEDAN SATRIA BEKASI,-6.207055000,106.977774000,BCA
ALFAMIDI M KAHFI IV CRM JL M KAHFI 1 NO 60 JAGAKARSA,-6.346061100,106.800951900,BCA
INDOMARET RE MARTADINATA TANGSEL CRM 1 JL R E MARTADINATA RAYA RT001 RW05 CIPAYUNG - CIPU,-6.328016000,106.747051000,BCA
INDOMARET KRAMAT CIPAYUNG JAKTIM KP KRAMAT RT007 / RW004 JAKARTA TIMUR,-6.316100000,106.917000000,BCA
ALFAMART RE MARTADINATA CIPUTAT CRM 1 JL RE MARTADINATA NO 70 CIPUTAT TANGSEL,-6.328337000,106.747365000,BCA
INDOMARET PLUS GRAND BOULEVARD BEKASI CRM 1 JL BOULEVARD ( RUKB )BLOK AT15-01RT01/08BKS,-6.170130000,106.977277000,BCA
INDOMARET PLUS GRAND BOULEVARD BEKASI CRM 2 JL BOULEVARD ( RUKB )BLOK AT15-01RT01/08BKS,-6.170130000,106.977277000,BCA
"MINEX LOGISTICS 1 JL CIKUNIR RAYA NO 17 JAKAMULYA, BEKASI SELATAN, BEKASI",-6.263400000,106.961500000,BCA
"ALFAMART DADAP II CRM 1 JL RAYA DADAP NO. 23 DADAP, KEC KOSAMBI, TGR",-6.089213000,106.704963000,BCA
"ALFAMART JL SUMATERA CRM 1 JL SUMATERA RT 004/002, KEL JOMBANG, KEC CIPUTAT,",-6.296145000,106.706411000,BCA
INDOMARET PERTIGAN SERUA TANGSEL CRM 1 JL ARYA PUTRA RAYA RT01 RW05 SERUA TANGSEL,-6.311088000,106.721717000,BCA
"ALFAMART GRAHA RAYA JL GRAHA RAYA UTAMA BLOK G1/7, KEL PAKU JAYA",-6.242400000,106.674800000,BCA
"BCA SYARIAH PASAR KRANJI CRM JL RAYA PEMUDA NO 7 RT001 RW014 KRANJI, BEKASI BARAT",-6.233533000,106.973773000,BCA
ALFAMART AKSES TOL JATIWARNA CRM 1 JL BUNGA MATAHARI UTAMA BLOK C22  BEKASI,-6.310358000,106.925309000,BCA
"CINERE CORNER CRM 1 JL CINERE RAYA, LIMO, DEPOK",-6.341811600,106.777148600,BCA
INDOMARET ATANG SANJAYA CRM JL ATANG SANJAYA KP RAWA BOKOR RT/RW 001/003,-6.114800000,106.686100000,BCA
INDOMARET PLUS CIPONDOH RAYA TANGERANG JL KH HASYIM ASHARI RT 002 RW 03 PORIS PLAWAD UTARA CIPONDOH TANGERANG,-6.189568000,106.665727000,BCA
INDOMARET PLUS CIPONDOH RAYA TANGERANG 2 JL KH HASYIM ASHARI RT 002 RW 03 PORIS PLAWAD UTARA CIPONDOH TANGERANG,-6.189568000,106.665727000,BCA
"EBC BULEVAR HIJAU BEKASI CRM 7 RUKO BULEVAR HIJAU BLOK B8/28, JL BULEVAR HIJAU, K",-6.186100000,106.979800000,BCA
"EBC BULEVAR HIJAU BEKASI CRM 8 RUKO BULEVAR HIJAU BLOK B8/28, JL BULEVAR HIJAU, K",-6.186100000,106.979800000,BCA
"EBC BULEVAR HIJAU BEKASI CRM 4 RUKO BULEVAR HIJAU BLOK B8/28, JL BULEVAR HIJAU, KOTA HARAPAN INDAH BEKASI",-6.186100000,106.979800000,BCA
"EBC BULEVAR HIJAU BEKASI CRM 5 RUKO BULEVAR HIJAU BLOK B8/28, JL BULEVAR HIJAU, KOTA HARAPAN INDAH BEKASI",-6.186100000,106.979800000,BCA
"EBC BULEVAR HIJAU BEKASI CRM 6 RUKO BULEVAR HIJAU BLOK B8/28, JL BULEVAR HIJAU, KOTA HARAPAN INDAH BEKASI",-6.186100000,106.979800000,BCA
"EBC BULEVAR HIJAU BEKASI CRM 1 RUKO BULEVAR HIJAU BLOK B8/28, JL BULEVAR HIJAU, KOTA HARAPAN INDAH BEKASI",-6.186100000,106.979800000,BCA
"EBC BULEVAR HIJAU BEKASI CRM 2 RUKO BULEVAR HIJAU BLOK B8/28, JL BULEVAR HIJAU, KOTA HARAPAN INDAH BEKASI",-6.186100000,106.979800000,BCA
"EBC BULEVAR HIJAU BEKASI CRM 3 RUKO BULEVAR HIJAU BLOK B8/28, JL BULEVAR HIJAU, KOTA HARAPAN INDAH BEKASI",-6.186100000,106.979800000,BCA
"ALFAMART PASAR KECAPI CRM 1 JL PASAR KECAPI NO 8, JATIWARNA, PD GEDE",-6.304360000,106.932440000,BCA
"ALFAMART BOULEVARD HIJAU BEKASI CRM 1 JL RAYA BOULEVARD HIJAU RT08/30, PEJUANG, MEDAN SA",-6.186494000,106.979872000,BCA
INDOMARET JATIWARNA CRM 1 JL RYHANKAM NO33-34 JATIWARNAPONDOKGD BEKASI,-6.311886000,106.924310000,BCA
"ALFAMIDI RAYA HANKAM CRM 1 JL RAYA HANKAM NO 38 , KEL JATIMURNI, KEC PONDOK M",-6.311886000,106.924310000,BCA
"ALFAMIDI RAYA HANKAM CRM 2 JL RAYA HANKAM NO 38 , KEL JATIMURNI, KEC PONDOK M",-6.311886000,106.924310000,BCA
INDOMARET PLUS CIPAYUNG II ( TVCQ ) JKT CRM 1 JL RAYA CIPAYUNG NO 56 CIPAYUNG JAKARTA,-6.333100000,106.891900000,BCA
INDOMARET PLUS CIPAYUNG II ( TVCQ ) JKT CRM 2 JL RAYA CIPAYUNG NO 56 CIPAYUNG JAKARTA,-6.333100000,106.891900000,BCA
INDOMARET PLUS CIPAYUNG II ( TVCQ ) JKT CRM 3 JL RAYA CIPAYUNG NO 56 CIPAYUNG JAKARTA,-6.333100000,106.891900000,BCA
"ALFAMART KRAMAT SETU JL SWADAYA KRAMAT SETU RT 02/04, SETU, CIPAYUNG, JAKTIM",-6.317277000,106.917685000,BCA
ALFAMART HARAPAN INDAH JL HARAPAN INDAH BLOK EA RT 008 RW 017 BEKASI,-6.186349000,106.980015000,BCA
ALFAMART AKSES GALAXY CRM 1 JL RY GALAXY RT 07/09 KEC BEKASI BARAT BEKASI,-6.250317000,106.968844000,BCA
ALFAMART AKSES GALAXY CRM 2 JL RY GALAXY RT 07/09 KEC BEKASI BARAT BEKASI,-6.250317000,106.968844000,BCA
"ALFAMIDI MATAHARI JL MATAHARI RAYA NO 1 BLOK 417/418, JAKASETIA, BEKASI SELATAN, BEKASI",-6.255914000,106.966695000,BCA
"SUPERINDO CIPONDOH JL KH HASYIM ASHARI RT 006/RW 003 PORIS PLAWAD UTARA, KEC CIPONDOH, KOTA TANGERANG",-6.188890000,106.665192000,BCA
ALFAMIDI PKP JAKTIM CRM 1 JL RAYA PKP CIBUBUR RT 04/12 CIBUBUR CIRACAS JAKARTA TIMUR,-6.340800000,106.874600000,BCA
TRANSERA WATERPARK BEKASI KOMPLEK TAMAN HARAPAN INDAH BEKASI,-6.154116000,106.976180000,BCA
"INDOMARET POINT DUTA PERMAI BEKASI CRM 1 KOMP RUKO DUTA PERMAI, JAKAPERMAI, BEKASI",-6.249236000,106.970162000,BCA
"ALFAMART RAYA BOGOR KM 27 JL RAYA BOGOR KM 27, JAKTIM",-6.343200000,106.869000000,BCA
ALFAMART RAYA PKP JL RAYA PKP KEC CIRACAS JAKARTA TIMUR,-6.339700000,106.879300000,BCA
"ALFAMART PISANGAN LAMA 2 CRM JL PISANGAN LAMA III NO 1 PISANGAN TIMUR, JAK",-6.339700000,106.879300000,BCA
INDOMARET GANDARIA II JL GANDARIA II PEKAYON PASAR REBO JAKTIM,-6.344400000,106.865100000,BCA
INDOMARET GRAHA RAYA BINTARO V SERPONG CRM 1 JL GRAHA RAYA BINTARO CENDANA LOKA BLK P1/1 RT2/9,-6.245221700,106.673625000,BCA
INDOMARET ALAM RAYA CRM JL JURU MUDIRUKO AA3&5KELBEKEDUNGKECBENDA TGR,-6.141700000,106.672400000,BCA
PERUMAHAN BATU CEPER PERMAI JL MARGA WARTA PERUMAHAN BATU CEPER PERMAI,-6.162600000,106.667000000,BCA
ALFAMART GRAHA RAYA BINTARO III CRM 1 JL GRAHA RAYA BINTARO JAYA P-3 TANGSEL,-6.245232000,106.673583000,BCA
"INDOMARET POINT AIRPORT HUB BANDARA SOETTA JL HUSEIN  SASTRANEGARA AIRPORT HUB NO1B RT 2/3, BENDA, TANGERANG",-6.113529900,106.684874000,BCA
"INDOMARET CINERE RAYA CRM JL CINERE RAYA NO 10A, CINERE, DEPOK",-6.343448400,106.776476400,BCA
INDOMARET HARAPAN INDAH RAYA CRM 1 JL HARAPAN INDAH RAYA SATRIA BEKASI,-6.181290000,106.981083000,BCA
INDOMARET BOULEVARD HIJAU RAYA BKS CRM 1 JL BOULEVARD RAYA PEJUANG MEDAN SATRIA BEKASI,-6.186339000,106.981470000,BCA
"INDOMARET RAWA JERUK JL RAWA BENDA, KAMPUNG RAWA JERUK, TANGERANG",-6.112900000,106.684900000,BCA
ALFAMART TAMAN VILLA BANDARA 2 TAMAN VILLA BANDARA A7 NO 13-14 KOSAMBI TGR,-6.092295000,106.698621000,BCA
ALFAMART TAMAN VILLA BANDARA TAMAN VILLA BANDARA A7 NO 13-14 KOSAMBI TGR,-6.092295000,106.698621000,BCA
INDOMARET SETU CIPAYUNG JL CIPAYUNG RAYA CIPAYUNG JAKARTA TIMUR,-6.331022000,106.900089000,BCA
"ALFAMART LENTENG AGUNG TIMUR CRM JL LENTENG AGUNG TIMUR NO 1, SRENGSENG SAWAH, JAGA",-6.350800000,106.832600000,BCA
SPBU 34-12611 JAGAKARSA 2 JL M KAHFI I NO 51 JAGAKARSA JAKARTA SELATAN,-6.349803000,106.802232000,BCA
SPBU 34-12611 JAGAKARSA JL M KAHFI I NO 51 JAGAKARSA JAKARTA SELATAN,-6.349803000,106.802232000,BCA
ALFAMART SADEWA CRM 1 JL SADEWA RAYA NO 317 BEKASI,-6.260925400,106.966317000,BCA
INDOMARET KAHFI 4 JAKSEL JL RMKAHFI I (PERTIGAANTIMBUL) RT 006 RW 01 JAGAKARSA JAKSEL,-6.350100000,106.801800000,BCA
"ALFAMART PAKU JAYA CRM JL BHAYANGKARA RAYA NO 138, KEC SERPONG",-6.241600000,106.671100000,BCA
"INDOMARET ALEXINDO V CRM 1 JL ALEXINDO, HARAPAN JAYA, BEKASI UTARA, BEKASI",-6.211050000,106.981385000,BCA
ALFAMIDI LENTENG AGUNG TIMUR JL LENTENG AGUNG TIMUR JAGAKARSA JAKSEL,-6.351300000,106.832700000,BCA
TAMAN GALAXY CRM 1 JL RAYA TAMAN GALAXI BLOK A/31 BEKASI,-6.257528000,106.968451000,BCA
TAMAN GALAXY CRM 2 JL RAYA TAMAN GALAXI BLOK A/31 BEKASI,-6.257528000,106.968451000,BCA
TAMAN GALAXY CRM 3 JL RAYA TAMAN GALAXI BLOK A/31 BEKASI,-6.257528000,106.968451000,BCA
TAMAN GALAXY CRM 4 JL RAYA TAMAN GALAXI BLOK A/31 BEKASI,-6.257528000,106.968451000,BCA
TAMAN GALAXY CRM 5 JL RAYA TAMAN GALAXI BLOK A/31 BEKASI,-6.257528000,106.968451000,BCA
INDOMARET BUKIT NUSA INDAH TANGSEL CRM 1 JL PERUMBUKITNUSAINDAH KAV1985-1986 SARUA CIPUTAT,-6.309026000,106.713818000,BCA
INDOMARET BUKIT NUSA INDAH TANGSEL CRM 2 JL PERUMBUKITNUSAINDAH KAV1985-1986 SARUA CIPUTAT,-6.309026000,106.713818000,BCA
"PASAR SEGAR GRAHA RAYA BINTARO CRM 1 JL GRAHA BUNGA RAYA M9 NO 1, TANGERANG",-6.249200000,106.673400000,BCA
"PASAR SEGAR GRAHA RAYA BINTARO CRM 2 JL GRAHA BUNGA RAYA M9 NO 1, TANGERANG",-6.249200000,106.673400000,BCA
"PASAR SEGAR GRAHA RAYA BINTARO CRM 3 JL GRAHA BUNGA RAYA M9 NO 1, TANGERANG",-6.249200000,106.673400000,BCA
