address,city,province,latitude,longitude
"Jl. Firdaus 2 No.76, Pasiran, Singkawang Bar., Kota Singkawang, Kalimantan Barat 79122, Indonesia",Kota Samarinda,Kalimantan Timur,0.9056799999999999,108.9742972
"Jl. Firdaus 2 No.76, Pasiran, Singkawang Bar., Kota Singkawang, Kalimantan Barat 79122, Indonesia",Kota Samarinda,Kalimantan Timur,0.9056799999999999,108.9742972
"Jl. R. Suprapto No 28 E-F, Sampit, Delta Pawan, Kabupaten Ketapang, Kalimantan Barat 78811, Indonesia",Kota Samarinda,Kalimantan Timur,-1.8435334,109.9701771
"Jl. Ahmad Yani, Mabuun, Murung Pudak, Kabupaten Tabalong, Kalimantan Selatan 71571, Indonesia",Kabupaten Kutai Kartanegara,Kalimantan Timur,-1.8873813,113.313739
"Jl. Mulawarman No.23, Pelabuhan, Kec. Samarinda Kota, Kota Samarinda, Kalimantan Timur 75242, Indonesia",Kota Samarinda,Kalimantan Timur,-0.5040456,117.1541496
"Kota Samarinda, Kalimantan Timur, Kota Samarinda, Kalimantan Timur",Kota Samarinda,Kalimantan Timur,-0.5016166,117.1264753
"Jl. Kapten Soedjono.Aj, Simpang Pasir, Kec. Palaran, Kota Samarinda, Kalimantan Timur 75251, Indonesia",Kota Samarinda,Kalimantan Timur,-0.5338729,117.1575783
"Jl. Mulawarman No.23, Pelabuhan, Kec. Samarinda Kota, Kota Samarinda, Kalimantan Timur 75242, Indonesia",Kota Samarinda,Kalimantan Timur,-0.5040456,117.1541496
"Jl. Kapten Soedjono.Aj, Simpang Pasir, Kec. Palaran, Kota Samarinda, Kalimantan Timur 75251, Indonesia",Kota Samarinda,Kalimantan Timur,-0.5338729,117.1575783
"Jl. K. Haji Ahmad Mukhsin No. 36, Timbau, Tenggarong, Timbau, Kec. Tenggarong, Kabupaten Kutai Kartanegara, Kalimantan Timur 75513, Indonesia",Kota Samarinda,Kalimantan Timur,-0.4358065,116.9967145
Jl. Kh Akhmad Mukhsin No. 36 Tenggarong Kalimantan Timur,Kabupaten Kutai Kartanegara,Kalimantan Timur,-0.4358065,116.9967145
"Jembayan Dalam, Kec. Loa Kulu, Kabupaten Kutai Kartanegara, Kalimantan Timur 75571, Indonesia",Kabupaten Kutai Kartanegara,Kalimantan Timur,-0.5742566,116.9322553
"Jl. P. AntasariTenggarong, Sempaja Utara, Kec. Samarinda Utara, Kota Samarinda, Kalimantan Timur 75127, Indonesia",Kota Samarinda,Kalimantan Timur,-0.4924882,117.1272335
"Jl. K. Haji Ahmad Mukhsin No. 36, Timbau, Tenggarong, Timbau, Kec. Tenggarong, Kabupaten Kutai Kartanegara, Kalimantan Timur 75513, Indonesia",Kabupaten Kutai Kartanegara,Kalimantan Timur,-0.4358065,116.9967145
"Jl. Yos Sudarso Ii No. 17 B-C, Sangatta, Kalimantan Timur",Kabupaten Kutai Timur,Kalimantan Timur,0.4973494,117.5307579
"Jl. Jend. Ahmad Yani, Sangatta Utara, Kabupaten Kutai Timur, Kalimantan Timur",Kabupaten Kutai Timur,Kalimantan Timur,0.5512075,117.5610408
"Jl. Yos Sudarso 2 No.36, Sangatta Utara, Kabupaten Kutai Timur, Kalimantan Timur 75683, Indonesia",Kabupaten Kutai Timur,Kalimantan Timur,0.4962069,117.5310554
"Jl. Yos Sudarso Ii No. 17 B-C, Sangatta, Kalimantan Timur",Kabupaten Kutai Timur,Kalimantan Timur,0.4973494,117.5307579
"Jl. Letjend S.Parman No.24, Temindung Permai, Kec. Sungai Pinang, Kota Samarinda, Kalimantan Timur 75242, Indonesia",Kota Samarinda,Kalimantan Timur,-0.4794543,117.1547734
"Jl. Hasan Basri No.1, Temindung Permai, Kec. Sungai Pinang, Kota Samarinda, Kalimantan Timur 75242, Indonesia",Kota Samarinda,Kalimantan Timur,-0.4810438999999999,117.1516831
"Jl. Ir. Soekarno Hatta Rt. 18 Handil, Kabupaten Kutai Kartanegara, Kalimantan Timur",Kabupaten Kutai Kartanegara,Kalimantan Timur,-0.8094704,117.2299602
"Jl. Ir Soekarno , Handil - Muara Jawa, Kabupaten Kutai Kartanegara, Kalimantan Timur",Kabupaten Kutai Kartanegara,Kalimantan Timur,-0.8094704,117.2299602
"Jl. Bung Tomo No. 1 Samarinda Seberang, Sungai Keledang",Kota Samarinda,Kalimantan Timur,-0.5152629,117.1285684
"Jl. Sultan Hasanuddin No.19 Samarinda Seberang, Kalimantan Timur",Kota Samarinda,Kalimantan Timur,-0.5113613,117.1394993
"Jl. Wahid Hasyim I No.5, Sempaja Sel., Kec. Samarinda Utara, Kota Samarinda, Kalimantan Timur 75119, Indonesia",Kota Samarinda,Kalimantan Timur,-0.4532013,117.1529608
"South Sangatta, East Kutai Regency, East Kalimantan, Indonesia",Kota Samarinda,Kalimantan Timur,0.4335827,117.3146351
"Jl. Donald Isaac Panjaitan No.31, Sungai Pinang Dalam, Kec. Samarinda Utara, Kota Samarinda, Kalimantan Timur 75117, Indonesia",Kota Samarinda,Kalimantan Timur,-0.4616502999999999,117.1779541
"Jl. Donald Isaac Panjaitan No.31, Sungai Pinang Dalam, Kec. Samarinda Utara, Kota Samarinda, Kalimantan Timur 75117, Indonesia",Kota Samarinda,Kalimantan Timur,-0.4616502999999999,117.1779541
"Jl. Donald Isaac Panjaitan No.31, Sungai Pinang Dalam, Kec. Samarinda Utara, Kota Samarinda, Kalimantan Timur 75117, Indonesia",Kabupaten Kutai Timur,Kalimantan Timur,-0.4616502999999999,117.1779541
"Jl. Kesuma Bangsa No.76, Bugis, Kec. Samarinda Kota, Kota Samarinda, Kalimantan Timur 75121, Indonesia",Kota Samarinda,Kalimantan Timur,-0.4899268000000001,117.1465171
"Jl. Kesuma Bangsa No.76, Bugis, Kec. Samarinda Kota, Kota Samarinda, Kalimantan Timur 75121, Indonesia",Kota Samarinda,Kalimantan Timur,-0.4899268000000001,117.1465171
"Jl. Kesuma Bangsa No.76, Bugis, Kec. Samarinda Kota, Kota Samarinda, Kalimantan Timur 75121, Indonesia",Kota Samarinda,Kalimantan Timur,-0.4899268000000001,117.1465171
"Jl. Ir. H. Juanda, Air Hitam, Kec. Samarinda Ulu, Kota Samarinda, Kalimantan Timur 75124, Indonesia",Kota Samarinda,Kalimantan Timur,-0.4808948,117.1346032
"Jl. Juanda 2 No.8, Air Hitam, Kec. Samarinda Ulu, Kota Samarinda, Kalimantan Timur 75243, Indonesia",Kota Samarinda,Kalimantan Timur,-0.4833045,117.1329015
"Jl. Pahlawan No.6, Dadi Mulya, Kec. Samarinda Ulu, Kota Samarinda, Kalimantan Timur 75123, Indonesia",Kota Samarinda,Kalimantan Timur,-0.4842441,117.1487234
"Jl. Pahlawan No.6, Dadi Mulya, Kec. Samarinda Ulu, Kota Samarinda, Kalimantan Timur 75123, Indonesia",Kota Samarinda,Kalimantan Timur,-0.4842441,117.1487234
"Jl. Pahlawan No.6, Dadi Mulya, Kec. Samarinda Ulu, Kota Samarinda, Kalimantan Timur 75123, Indonesia",Kota Samarinda,Kalimantan Timur,-0.4842441,117.1487234
"Jl.Untung Suropati No.20, RT.29, Karang Asam Ulu, Kec. Sungai Kunjang, Kota Samarinda, Kalimantan Timur 75126, Indonesia",Kota Samarinda,Kalimantan Timur,-0.528886,117.111782
"Jl. Untung Suropati, Samarinda Big Mall, Kalimantan Timur",Kota Samarinda,Kalimantan Timur,-0.5262742,117.1159382
"Jl. Ir. Soekarno, Muara Jawa Ulu, Muara Jawa, Kabupaten Kutai Kartanegara, Kalimantan Timur 75263, Indonesia",Kabupaten Kutai Kartanegara,Kalimantan Timur,-0.8094704,117.2299602
"Jl. Jenderal Sudirman No.22, Ps. Pagi, Kec. Samarinda Kota, Kota Samarinda, Kalimantan Timur 75242, Indonesia",Kota Balikpapan,Kalimantan Timur,-0.5013318,117.1433823
"Jl. Trikora Rt.07 Kel. Rawa Makmur, Kec. Samarinda",Kota Samarinda,Kalimantan Timur,-0.5591975,117.1684329
"Jl.  Jendral Sudirman Rt 11, Loa Kulu, Kota Samarinda, Kalimantan Timur",Kota Samarinda,Kalimantan Timur,-0.5232346,117.0236372
"Jl. Pahlawan No.1, Sidodadi, Kec. Samarinda Ulu, Kota Samarinda, Kalimantan Timur 75123, Indonesia",Kota Samarinda,Kalimantan Timur,-0.4892649999999999,117.145823
"Jl. Awang Long Senopati Rt.08, Kp Barong Tongkok Kec. Barong Tongkok",Kabupaten Kutai Barat,Kalimantan Timur,-0.2357145,115.6815271
"Jl. Gajah Mada Rt. 004, Kp Barong Tongkok, Kalimantan Timur",Kabupaten Kutai Barat,Kalimantan Timur,-0.2258523,115.6973614
"Jl. Gajah Mada Rt.004 Kampung Barong Tongkok, Kalimantan Timur",Kabupaten Kutai Barat,Kalimantan Timur,-0.2258523,115.6973614
"Jl. P Antasari No.51, Tlk. Lerong Ulu, Kec. Sungai Kunjang, Kota Samarinda, Kalimantan Timur 75127, Indonesia",Kota Samarinda,Kalimantan Timur,-0.4953764,117.1268478
"Jl. Poros Samarinda Anggana, Sungai Meriam, Kec. Anggana, Kabupaten Kutai Kartanegara, Kalimantan Timur 75256, Indonesia",Kota Samarinda,Kalimantan Timur,-0.5676993,117.2517987
"Jl. Cipto Mangunkusumo, Simpang Tiga, Kec. Loa Janan, Kabupaten Kutai Kartanegara, Kalimantan Timur 75391, Indonesia",Kota Samarinda,Kalimantan Timur,-0.5568934,117.0864043
"Jl. Imam Bonjol No. 09 Samarinda, Kota Samarinda, Kalimantan Timur",Kota Samarinda,Kalimantan Timur,-0.4995175000000001,117.1529482
"simpang, Jl. Perintis Muara Badak, Gas Alam Badak I, Muara Badak, Kabupaten Kutai Kartanegara, Kalimantan Timur 75382, Indonesia",Kota Samarinda,Kalimantan Timur,-0.3263771,117.4194087
"simpang, Jl. Perintis Muara Badak, Gas Alam Badak I, Muara Badak, Kabupaten Kutai Kartanegara, Kalimantan Timur 75382, Indonesia",Kota Samarinda,Kalimantan Timur,-0.3263771,117.4194087
"Jl. Angkasa No. 1, Airport Road, Komp. Pt Badak, Kalimantan Timur",Kota Bontang,Kalimantan Timur,0.1191925,117.4727436
"Jl. Pesut No. 1B Timbau, Tenggarong, Kab. Kukar, Kalimantan Timur",Kabupaten Kutai Kartanegara,Kalimantan Timur,-0.443093,116.990657
"Jl. Sidomulyo, Kec. Kongbeng, Kabupaten Kutai Timur, Kalimantan Timur 75655",Kabupaten Kutai Timur,Kalimantan Timur,1.0557121,116.8556955
"Jl. P. Irian No.8, Karang Mumus, Kec. Samarinda Kota, Kota Samarinda, Kalimantan Timur 75242, Indonesia",Kota Samarinda,Kalimantan Timur,-0.50362,117.1555081
"Jl. P. Irian No.8, Karang Mumus, Kec. Samarinda Kota, Kota Samarinda, Kalimantan Timur 75242, Indonesia",Kota Samarinda,Kalimantan Timur,-0.50362,117.1555081
"Jl. Jend. Achmad Yani, Api-Api, Bontang Utara, Kalimantan Timur",Kota Bontang,Kalimantan Timur,0.1310337,117.4861447
"Jl. Ahmad Yani No.23, Api-Api, Bontang Utara, Kota Bontang, Kalimantan Timur 75325, Indonesia",Kota Bontang,Kalimantan Timur,0.1310415,117.4857769
"Jl. Ahmad Yani No.23, Api-Api, Bontang Utara, Kota Bontang, Kalimantan Timur 75325, Indonesia",Kota Bontang,Kalimantan Timur,0.1310415,117.4857769
"Jl. Ahmad Yani No.23, Api-Api, Bontang Utara, Kota Bontang, Kalimantan Timur 75325, Indonesia",Kota Bontang,Kalimantan Timur,0.1310415,117.4857769
Jl Propinsi Km 18 Penajam Paser Utara Penajam Kalimantan Timur,Kabupaten Penajam Paser Utara,Kalimantan Timur,-1.3563582,116.6635623
"Sotek, Penajam, North Penajam Paser Regency, East Kalimantan, Indonesia",Kabupaten Penajam Paser Utara,Kalimantan Timur,-1.2300682,116.6199587
"Jl. Propinsi Km 18 Petung, Giri Mukti, Penajam, Kabupaten Penajam Paser Utara, Kalimantan Timur 76143",Kabupaten Penajam Paser Utara,Kalimantan Timur,-1.3563582,116.6635623
"Jl. Jenderal Sudirman No.71, Klandasan Ilir, Balikpapan Kota, Kota Balikpapan, Kalimantan Timur 76112, Indonesia",Kota Samarinda,Kalimantan Timur,-1.2766699,116.8371084
"Jl. Jend. Sudirman No. 71 Balikpapan, Kota Balikpapan, Kalimantan Timur",Kota Balikpapan,Kalimantan Timur,-1.2766699,116.8371084
"Jl. Jenderal Sudirman No.71, Klandasan Ilir, Balikpapan Kota, Kota Balikpapan, Kalimantan Timur 76112, Indonesia",Kota Samarinda,Kalimantan Timur,-1.2766699,116.8371084
"JL. Jenderal Sudirman, Komplek Balikpapan Baru Blok E2 No. 19, Klandasan Ilir, Balikpapan Kota, Kota Balikpapan, Kalimantan Timur, Indonesia",Kota Balikpapan,Kalimantan Timur,-1.2440861,116.8667385
"Jl. Pulau Derawan No.RT.31, Tj. Redeb, Kabupaten Berau, Kalimantan Timur 77315, Indonesia",Kabupaten Berau,Kalimantan Timur,2.1540294,117.4911615
"Jl. Pulau Derawan No.RT.31, Tj. Redeb, Kabupaten Berau, Kalimantan Timur 77315, Indonesia",Kabupaten Berau,Kalimantan Timur,2.1540294,117.4911615
"Jl. Pulau Derawan No.RT.31, Tj. Redeb, Kabupaten Berau, Kalimantan Timur 77315, Indonesia",Kabupaten Berau,Kalimantan Timur,2.1540294,117.4911615
"Gg. Bersama, Rinding, Tlk. Bayur, Kabupaten Berau, Kalimantan Timur 77352, Indonesia",Kabupaten Berau,Kalimantan Timur,2.1648905,117.4430669
"RUMAH BIRU, Jl. Yos Sudarso No.76, Karang Balik, Tarakan Bar., Kota Tarakan, Kalimantan Utara, Indonesia",Kota Balikpapan,Kalimantan Timur,3.306352,117.5843147
"Jl.Letjend Suprapto No.1 Balikpapan Barat, Kalimantan Timur",Kota Balikpapan,Kalimantan Timur,-1.2350356,116.8237277
"Jl.Letjend Suprapto No.1 Balikpapan Barat, Kalimantan Timur",Kota Balikpapan,Kalimantan Timur,-1.2350356,116.8237277
"Jl. Semoi No.229, Tepian, Kec. Sembakung, Kabupaten Nunukan, Kalimantan Utara, Indonesia",Kota Balikpapan,Kalimantan Timur,3.7960392,117.4086488
"Jl. Semoi No.229, Tepian, Kec. Sembakung, Kabupaten Nunukan, Kalimantan Utara, Indonesia",Kota Balikpapan,Kalimantan Timur,3.7960392,117.4086488
"Jl. Semoi No.229, Tepian, Kec. Sembakung, Kabupaten Nunukan, Kalimantan Utara, Indonesia",Kota Balikpapan,Kalimantan Timur,3.7960392,117.4086488
"Jl. Letjend Suprapto No. 1 Balikpapan, Kota Balikpapan, Kalimantan Timur",Kota Balikpapan,Kalimantan Timur,-1.2341294,116.8203971
"Jl. Enggano No 98 Tanjung Priok, Kota Balikpapan, Kalimantan Timur",Kota Balikpapan,Kalimantan Timur,-1.2379274,116.8528526
"Jl. Semoi No.229, Tepian, Kec. Sembakung, Kabupaten Nunukan, Kalimantan Utara, Indonesia",Kota Balikpapan,Kalimantan Timur,3.7960392,117.4086488
"Jl. Borneo Paradiso No.5, Sepinggan, Kecamatan Balikpapan Selatan, Kota Balikpapan, Kalimantan Timur 76116, Indonesia",Kota Balikpapan,Kalimantan Timur,-1.247662,116.9261256
"Perum. Borneo Paradiso Blok A No. 11, Jl. Mulawarman",Kota Balikpapan,Kalimantan Timur,-1.2521563,116.9279721
"Jl.Jend.Sudirman No.2-3 Klandasan Balikpapan, Kalimantan Timur",Kota Balikpapan,Kalimantan Timur,-1.2775037,116.8256439
"Jl. Syarifudin Yoes Blok Ab-6 No. 6, Kota Balikpapan, Kalimantan Timur",Kota Balikpapan,Kalimantan Timur,-1.242274,116.8888189
"Jl. Belatuk II No.59, Gn. Bahagia, Kecamatan Balikpapan Selatan, Kota Balikpapan, Kalimantan Timur 76114, Indonesia",Kota Balikpapan,Kalimantan Timur,-1.2433091,116.8891192
"Jl. Belatuk II No.59, Gn. Bahagia, Kecamatan Balikpapan Selatan, Kota Balikpapan, Kalimantan Timur 76114, Indonesia",Kota Balikpapan,Kalimantan Timur,-1.2433091,116.8891192
"Jl. Ahmad Yani No.RT. 22 No.57, Karang Rejo, Kec. Balikpapan Tengah, Kota Balikpapan, Kalimantan Timur 76124, Indonesia",Kota Balikpapan,Kalimantan Timur,-1.2485465,116.8358635
"Lantai Mezzanine, Floor Sr-Mf-4, Jl. Marsma R. Iswahyudi",Kota Balikpapan,Kalimantan Timur,-1.2676825,116.8777484
"Jl. Ahmad Yani No.19, Klandasan Ilir, Kecamatan Balikpapan Selatan, Kota Balikpapan, Kalimantan Timur 76113, Indonesia",Kota Balikpapan,Kalimantan Timur,-1.2659412,116.8370683
"Jl. Ahmad Yani No.19, Klandasan Ilir, Kecamatan Balikpapan Selatan, Kota Balikpapan, Kalimantan Timur 76113, Indonesia",Kota Balikpapan,Kalimantan Timur,-1.2659412,116.8370683
"Jl. Jenderal Sudirman No.331-332, Klandasan Ilir, Balikpapan Kota, Kota Balikpapan, Kalimantan Timur, Indonesia",Kota Bontang,Kalimantan Timur,-1.2773349,116.8378562
"Jl. Ahmad Yani, Klandasan Ilir, Balikpapan Kota, Kota Balikpapan, Kalimantan Timur, Indonesia",Kota Balikpapan,Kalimantan Timur,-1.2695457,116.8377211
"Jl. Ahmad Yani No.19, Klandasan Ilir, Kecamatan Balikpapan Selatan, Kota Balikpapan, Kalimantan Timur 76113, Indonesia",Kota Balikpapan,Kalimantan Timur,-1.2659412,116.8370683
"Jl. Jend. A Yani No. 15 Balikpapan, Kota Balikpapan, Kalimantan Timur",Kota Balikpapan,Kalimantan Timur,-1.2757479,116.837978
"Jl. Bukit Niaga No.37, Klandasan Ilir, Balikpapan Kota, Kota Balikpapan, Kalimantan Timur 76113, Indonesia",Kota Balikpapan,Kalimantan Timur,-1.2740369,116.8403711
"Komplek Ruko Balikpapan Permai, Jl. Jend. Sudirman No. 642",Kota Balikpapan,Kalimantan Timur,-1.2739869,116.8739894
"Jl. Jend. Sudirman No. 65-67 Balikpapan, Kalimantan Timur",Kota Balikpapan,Kalimantan Timur,-1.2751962,116.8460906
"Jl. Negara Sukaraja Rt. 06, Sepaku, Kabupaten Penajam Paser Utara, Kalimantan Timur",Kabupaten Penajam Paser Utara,Kalimantan Timur,-0.9266845,116.7540609
Jl. Negara Rt.009 Kec. Batu Sopang Kab. Tana Paser,Kabupaten Paser,Kalimantan Timur,-1.8241504,115.8896612
"Jl. Borneo Paradiso No.5, Sepinggan, Kecamatan Balikpapan Selatan, Kota Balikpapan, Kalimantan Timur 76116, Indonesia",Kota Balikpapan,Kalimantan Timur,-1.247662,116.9261256
"Jl. Jenderal Sudirman No.86, Damai, Balikpapan Kota, Kota Balikpapan, Kalimantan Timur 76114, Indonesia",Kota Samarinda,Kalimantan Timur,-1.2745634,116.8511972
"Jl. Soekarno Hatta Km 4,5  No. 09  Balikpapan, Kalimantan Timur",Kota Balikpapan,Kalimantan Timur,-1.2129185,116.8532602
"Jl. Soekarno Hatta KM.4,5 No.9, Batu Ampar, Kec. Balikpapan Utara, Kota Balikpapan, Kalimantan Timur 76126, Indonesia",Kota Balikpapan,Kalimantan Timur,-1.2129185,116.8532602
"Jl. Negara Simpang Pait, Long Ikis, Kabupaten Paser, Kalimantan Timur",Kabupaten Paser,Kalimantan Timur,-1.6006978,116.1781025
"Jl. Negara No.RT.002, Babulu Darat, Babulu, Kabupaten Penajam Paser Utara, Kalimantan Timur 76285, Indonesia",Kabupaten Penajam Paser Utara,Kalimantan Timur,-1.5633026,116.2510984
"Ruko Taman Citra Blok A3 No.2-3, Jl. Soekarno Hatta",Kota Balikpapan,Kalimantan Timur,-6.9909593,110.4581491
"Jalan Soekarno Hatta KM 1/2 Ruko Taman, Jl. Citra No.C-59, Karang Rejo, Kec. Balikpapan Tengah, Kota Balikpapan, Kalimantan Timur 76124, Indonesia",Kota Balikpapan,Kalimantan Timur,-1.2418196,116.8369153
"Ruko Taman Citra Blok A3 No.2-3, Jl. Soekarno Hatta Km. 05, Kel. Muara Rapak, Balikpapan",Kota Balikpapan,Kalimantan Timur,-1.2417016,116.8372646
"No., Jl. Marsma R. Iswahyudi No.468, Sepinggan, Kecamatan Balikpapan Selatan, Kota Balikpapan, Kalimantan Timur 76116, Indonesia",Kota Balikpapan,Kalimantan Timur,-1.257727,116.9113357
"Jl. Mulawarman, Gn. Bahagia, Balikpapan, Kota Balikpapan, Kalimantan Timur 76115, Indonesia",Kota Balikpapan,Kalimantan Timur,-1.2481726,116.9359062
Jl. Mulawarman Kel. Manggar Baru Kec. Balikpapan Timur,Kota Balikpapan,Kalimantan Timur,-1.2142175,116.9723778
"Jl. Jenderal Gatot Subroto No.165, Rinding, Tlk. Bayur, Kabupaten Berau, Kalimantan Timur 77352, Indonesia",Kabupaten Berau,Kalimantan Timur,2.1560597,117.4649966
"Jl. Jenderal Gatot Subroto No.165, Rinding, Tlk. Bayur, Kabupaten Berau, Kalimantan Timur 77352, Indonesia",Kabupaten Berau,Kalimantan Timur,2.1560597,117.4649966
"Jl Pulau Derawan Rt 31 Tanjung Redeb, Kabupaten Berau, Kalimantan Timur",Kabupaten Berau,Kalimantan Timur,2.1546548,117.4920602
"Jl. Sengkawit, Tj. Selor Hilir, Tj. Selor, Kabupaten Bulungan, Kalimantan Utara 77216",Kota Balikpapan,Kalimantan Timur,2.8505323,117.3787606
"Jl. Gajah Mada No. 22, Tanah Grogot, Kabupaten Paser, Kalimantan Timur",Kabupaten Paser,Kalimantan Timur,-1.9100128,116.1897553
"Jl. Gajahmada No.22 Tanah Grogot, Kabupaten Paser, Kalimantan Timur",Kabupaten Paser,Kalimantan Timur,-1.9100128,116.1897553
"Jl. Gajah Mada No. 22, Tanah Grogot, Kota Balikpapan, Kalimantan Timur",Kota Balikpapan,Kalimantan Timur,-1.2728471,116.8465953
"Jl. Gajah Mada No. 12 Tanah Grogot, Kabupaten Paser, Kalimantan Timur",Kabupaten Paser,Kalimantan Timur,-1.9100128,116.1897553
"Komplek Ruko Balikpapan Baru Blok D 6 No.2, Kalimantan Timur",Kota Balikpapan,Kalimantan Timur,-1.2393745,116.8727817
"Jl. Mt Haryono No. 72 Ï¿½ 74 Rt. 13, Damai Baru, Kalimantan Timur",Kota Balikpapan,Kalimantan Timur,0.5386586,116.419389
"Jl. Mt Haryono, Komp. Balikpapan Baru, Kota Balikpapan, Kalimantan Timur",Kota Balikpapan,Kalimantan Timur,-1.2398858,116.8723598
"Jl. Mt. Haryono  No.   Balikpapan, Kota Balikpapan, Kalimantan Timur",Kota Balikpapan,Kalimantan Timur,-1.2533182,116.868946
"Jl. Moh. T. Haryono, Komp. Balikpapan Baru No.6, Gn. Bahagia, Kecamatan Balikpapan Selatan, Kota Balikpapan, Kalimantan Timur 76114, Indonesia",Kota Balikpapan,Kalimantan Timur,-1.2409934,116.8726798
"Jl. Jend. Ahmad Yani No.70, Langkai, Kec. Pahandut, Kota Palangka Raya, Kalimantan Tengah 73111, Indonesia",Kota Balikpapan,Kalimantan Timur,-2.2626262,113.91967
"Jalan RTA Milono KM 3,5, Langkai, Pahandut, Menteng, Palangka Raya, Kota Palangka Raya, Kalimantan Tengah 74874, Indonesia",Kota Samarinda,Kalimantan Timur,-2.2356344,113.9201532
"Rantau Sentosa, Kec. Busang, Kabupaten Kutai Timur, Kalimantan Timur 75656",Kabupaten Kutai Timur,Kalimantan Timur,0.784091,116.6199587
"Jl. Mulawarman Dalam No. 01, Balikpapan, Kalimantan Timur",Kota Balikpapan,Kalimantan Timur,-1.2481726,116.9359062
"Sultan Aji Muhammad Sulaiman Airport, Sepinggan, Balikpapan Selatan, Sepinggan, Kecamatan Balikpapan Selatan, Kota Balikpapan, Kalimantan Timur 76",Kota Balikpapan,Kalimantan Timur,-1.2658151,116.8977258
"Jl. Ir. H. Juanda No.220, Air Hitam, Kec. Samarinda Ulu, Kota Samarinda, Kalimantan Timur 75243, Indonesia",Kota Bontang,Kalimantan Timur,-0.4821054,117.1329418
"Jl. Mulawarman No.109, Sepinggan, Kecamatan Balikpapan Selatan, Kota Balikpapan, Kalimantan Timur, Indonesia",Kota Balikpapan,Kalimantan Timur,-1.2553808,116.9254258
"Jl. Jendral Sudirman No. 484, Balikpapan Timur, Gn. Bahagia, Kecamatan Balikpapan Selatan, Kota Balikpapan, Kalimantan Timur 76114, Indonesia",Kota Balikpapan,Kalimantan Timur,-1.2739888,116.8739775
"Komp Perkantoran Swarga Bara Sanggata, Kota Samarinda, Kalimantan Timur",Kota Samarinda,Kalimantan Timur,0.5788546999999999,117.496301
"Jl. Pangeran Diponegoro No.27, Pelabuhan, Kec. Samarinda Kota, Kota Samarinda, Kalimantan Timur 75112, Indonesia",Kota Samarinda,Kalimantan Timur,-0.5000371,117.1493942
"Jl. Soekarno Hatta KM.1 No.5, Muara Rapak, Kec. Balikpapan Utara, Kota Balikpapan, Kalimantan Timur 76125, Indonesia",Kota Balikpapan,Kalimantan Timur,-1.2342734,116.8411534
Jl. Propinsi No.1 Kampung Kajang Anggana Kutai Kartanegara,Kota Samarinda,Kalimantan Timur,-0.5662737999999999,117.2435651
"Jl. Bontang - Samarinda, Perangat Sel., Kec. Marang Kayu, Kabupaten Kutai Kartanegara, Kalimantan Timur 75385, Indonesia",Kota Samarinda,Kalimantan Timur,-0.1699191,117.3227369
"Jl. Jend. Sudirman No. 81 Rt 28 Balikpapan, Kalimantan Timur",Kabupaten Berau,Kalimantan Timur,-1.2698747,116.8578928
"Telaga Sari, Kecamatan Balikpapan Selatan, Kota Balikpapan, Kalimantan Timur 76112, Indonesia",Kota Balikpapan,Kalimantan Timur,-1.26874,116.8291877
"Perusahaan Rea Kaltim Kecamatan Kembang Janggut, Kalimantan Timur",Kabupaten Kutai Kartanegara,Kalimantan Timur,0.2655183,116.2667039
"Jl. Mayor Jendral S. Parman, Sidodadi, Samarinda Ulu, Kota Samarinda, Kalimantan Timur 75123",Kota Samarinda,Kalimantan Timur,-0.4765114,117.1489418
"Jl Yos Sudarso I, No. 79, Sangaatta, Kabupaten Kutai Timur",Kabupaten Kutai Timur,Kalimantan Timur,0.4849986,117.5313802
"Sumber Kalimantan Abadi, JL. Mulawarman, No. 99, Manggar, Kec. Balikpapan Tim., Kota Balikpapan, Kalimantan Timur, Indonesia",Kota Balikpapan,Kalimantan Timur,-1.237825,116.949903
"Mal samarinda square, Gunung Kelua, Samarinda Ulu, Samarinda City, East Kalimantan 75243, Indonesia",Kota Samarinda,Kalimantan Timur,-0.4699725,117.1474004
"Jl. Raya Kutai Komp. Pt. Badak, Bontang, Kalimantan Timur",Kota Bontang,Kalimantan Timur,0.1147168,117.4660095
"Maluang, Kec. Gn. Tabur, Kabupaten Berau, Kalimantan Timur 77352, Indonesia",Kabupaten Berau,Kalimantan Timur,2.365594,117.5848025
"Jl. R. Suprapto No.10kel, Bontang Baru, Bontang Utara, Kota Bontang, Kalimantan Timur 75311, Indonesia",Kota Samarinda,Kalimantan Timur,0.1352769,117.4889916
"Kelekat, Kec. Kembang Janggut, Kabupaten Kutai Kartanegara, Kalimantan Timur 75557",Kabupaten Kutai Kartanegara,Kalimantan Timur,0.2432742,116.3131356
"Jl. Penegak No.RT.08 No.50, Damai, Balikpapan Kota, Kota Balikpapan, Kalimantan Timur 76114, Indonesia",Kota Balikpapan,Kalimantan Timur,-1.26478,116.8621715
"Jl Tanjung Pura Iii Telaga Sari, Balikpapan Kota, Kota Balikpapan, Kalimantan Timur 76112",Kota Balikpapan,Kalimantan Timur,-1.2762436,116.8232415
"Jl. Pandan Arum No.78, Mekar Sari, Kec. Balikpapan Tengah, Kota Balikpapan, Kalimantan Timur 76123, Indonesia",Kota Balikpapan,Kalimantan Timur,-1.241112,116.8242747
"Jl. Mayjend Sutoyo No.27, Gunungsari Ulu, Kec. Balikpapan Tengah, Kota Balikpapan, Kalimantan Timur 76113, Indonesia",Kota Balikpapan,Kalimantan Timur,-1.2637304,116.8468933
"Jl. Awang Long No.2, Bontang Baru, Bontang Utara, Kota Bontang, Kalimantan Timur 75325, Indonesia",Kota Bontang,Kalimantan Timur,0.1382892,117.4983693
"Jl. Soekarno Hatta.Km. 2 Rt. 8 No. 3 Loa Janan, Kalimantan Timur",Kota Samarinda,Kalimantan Timur,-0.7380637,117.0583013
"Jl. Provinsi Rt 04 Makroman Samarinda, Kota Samarinda, Kalimantan Timur",Kota Samarinda,Kalimantan Timur,-0.5305695,117.2382163
"Makroman, Kec. Sambutan, Kota Samarinda, Kalimantan Timur 75115",Kota Samarinda,Kalimantan Timur,-0.4547816,117.2617329
"Long Temuyat, Kayan Hulu, Malinau Regency, North Kalimantan, Indonesia",Kota Samarinda,Kalimantan Timur,1.7157045,114.8330094
"Gg. Atletik VI No.15, Api-Api, Bontang Utara, Kota Bontang, Kalimantan Timur 75313, Indonesia",Kota Bontang,Kalimantan Timur,0.1305254,117.4980187
"Gg. 2, Simpang Pasir, Kec. Palaran, Kota Samarinda, Kalimantan Timur 75251, Indonesia",Kota Samarinda,Kalimantan Timur,-0.546155,117.157436
"Jl. Soekarno Hatta No.63, Batu Ampar, Kec. Balikpapan Utara, Kota Balikpapan, Kalimantan Timur 76127, Indonesia",Kota Balikpapan,Kalimantan Timur,-1.2200696,116.8484289
"Bontang Lestari, Bontang Sel., Kota Bontang, Kalimantan Timur, Indonesia",Kota Bontang,Kalimantan Timur,0.0496978,117.4321452
"Jl. Pupuk Raya, Bontang, Bontang Baru, Bontang Utara, Kota Bontang, Kalimantan Timur 75321",Kota Samarinda,Kalimantan Timur,0.1777176,117.4683943
"Jl. Pelita, Mugirejo, Sei/Sungai Pinang Dalam, Samarinda Utara, Samarinda 75117",Kota Samarinda,Kalimantan Timur,-0.4838694,117.1638983
"Jl. MT Haryono No.7, RW.no 85, Damai, Kecamatan Balikpapan Selatan, Kota Balikpapan, Kalimantan Timur 76114, Indonesia",Kota Balikpapan,Kalimantan Timur,-1.2470434,116.8709383
"Jl. Mt Haryono Komp. Balikpapan Baru, Kota Balikpapan, Kalimantan Timur",Kota Balikpapan,Kalimantan Timur,-1.2398858,116.8723598
"Jl. ARS Moh. No.7, Klandasan Ulu, Balikpapan Kota, Kota Balikpapan, Kalimantan Timur 76112, Indonesia",Kota Balikpapan,Kalimantan Timur,-1.273166,116.833167
"Jl. Pramuka No.3, Sempaja Sel., Kec. Samarinda Ulu, Kota Samarinda, Kalimantan Timur 75243, Indonesia",Kota Samarinda,Kalimantan Timur,-0.4639778000000001,117.1532904
"Jl. Kh Wahid Hasyim 2 Rt.31 Sempaja, Kota Samarinda, Kalimantan Timur",Kota Samarinda,Kalimantan Timur,-0.441446,117.154559
"Jl. Gerbang Dayaku Rt.02, Loa Duri, Kota Samarinda, Kalimantan Timur",Kota Samarinda,Kalimantan Timur,-0.5852866,117.0862115
"Jl. P. Suryanata No.4, Bukit Pinang, Kec. Samarinda Ulu, Kota Samarinda, Kalimantan Timur 75124, Indonesia",Kota Samarinda,Kalimantan Timur,-0.4739305,117.1228215
