"Jl. Gotong Royong, Larangan Ciledug, Tangerang, Banten",Kota Tangerang,Banten
"Komp. Villa Taman Bandara Blok J No. 22 Tangerang, Banten",Kota Tangerang,Banten
"Komplek Gajah Tunggal, Jatake, Tangerang, Banten",Kota Tangerang,Banten
"Jl Raya Labuan Cipacung Pandeglang, Kabupaten Pandeglang, Banten",Kabupaten Pandeglang,Banten
"Q Big Mall Blok A, Kulon, Jl. Bsd Raya Utama, Lengkong Kulon, Kec. Pagedangan, Tangerang",Kabupaten Tangerang,Banten
"Jl. Raya Cadas - Kukun, Pangadegan, Kec. Ps. Kemis, Tangerang, Banten 15560, Indonesia",Kabupaten Tangerang,Banten
"Jl Raya Bojongnangka, Medang Pagedangan Tangerang, Banten",Kabupaten Tangerang,Banten
"Perum Talaga Bestari Plaza D Captiva Kel Wanakerta Kec Sindang Jaya, Kab Tangerang",Kabupaten Tangerang,Banten
"Jl. Kh Agus Salim, Tanah Tinggi, Tangerang, Banten",Kota Tangerang,Banten
"Jl. Raya Legoso No. 20 Rt 01 Rw 07, Kota Tangerang Selatan, Banten",Kota Tangerang Selatan,Banten
"Jl.Raya Serpong Priyang Rt07/Rw02,Pondok Jagung Serpong Utara Tangsel",Kota Tangerang Selatan,Banten
Jl. Serpong Raya No. 92-93 Serpong Tangerang Selatan 15311,Kota Tangerang Selatan,Banten
Jl. Raya Puspitek Rt 015 Rw 04 Setu Tangerang Selatan 15314,Kota Tangerang Selatan,Banten
Jl. Taip Raya Rt 008 Rw 09 No. 67 Kedaung Pamulang Tangerang Selatan,Kota Tangerang Selatan,Banten
"Jl. Graha Bintaro, Paku Jaya, Kec. Serpong Utara, Kota Tangerang Selatan",Kota Tangerang Selatan,Banten
"Jl. Pd. Betung Raya No.13A, Pd. Karya, Kec. Pd. Aren, Kota Tangerang Selatan",Kota Tangerang Selatan,Banten
Jl. Pahlawan Rempoa No. 35 Rt 04 Rw 09 Kel. Rempoa Kec Ciputat Timur Tangerang Selatan,Kota Tangerang Selatan,Banten
"Jl. Griya Loka Raya, Rw. Buntu, Kec. Serpong, Kota Tangerang Selatan",Kota Tangerang Selatan,Banten
"Jl. Lengkong Gudang Timur Tangerang Selatan, Banten",Kota Tangerang Selatan,Banten
"Indomaret, Jalan Utama Purati, Gembor, Periuk, RT.003/RW.004, Gembor, Kec. Periuk, Kota Tangerang, Banten 15133, Indonesia",Kota Tangerang,Banten
Jl. Kayu Putih Pondok Cabe Udik Pamulang Tangerang Selatan 15418,Kota Tangerang Selatan,Banten
"Jl. Cabe V Blok Kubis Iv No.27, Pd. Cabe Ilir, Kec. Pamulang, Kota Tangerang Selatan",Kota Tangerang Selatan,Banten
Jl. Ciputat-Bsd No 44 Kelurahan Serua Kecamatan Ciputat,Kota Tangerang Selatan,Banten
Jl Raya Kelapa Dua No 38 Rt 003/004 Kel Kelapa Dua Kec Kelapa Dua,Kabupaten Tangerang,Banten
"Jl Citra Raya Utama Barat No 29 Griya Harsa Ii Blok I 10 Citra Raya, Cikupa, Tangerang",Kabupaten Tangerang,Banten
"Jl. Menteng Raya Blok C2 No.8, Pamulang Bar., Pamulang, Kota Tangerang Selatan, Banten 15417",Kota Tangerang Selatan,Banten
"Gondrong, Cipondoh, Tangerang City, Banten 15147, Banten",Kota Tangerang,Banten
"Jl. DR. Sitanala No.99, RT.002/RW.003, Karang Sari, Kec. Neglasari, Kota Tangerang, Banten 15121",Kota Tangerang,Banten
"Jl. Wisma Tajur 17, Rt.002/Rw.002, Tajur, Kec. Ciledug, Kota Tangerang",Kota Tangerang,Banten
Jl Tekno Widya Pertokoan Taman Tekno Blok G 11-12 Ds Setu Kec Setu,Kota Tangerang Selatan,Banten
"Jl.Boulevard Bintaro Sektor 7,Kav B7/A6 Cbd Bintaro Jata. Tangerang 15224",Kota Tangerang Selatan,Banten
"Ruko Perum Duta Bintaro Blok Aa. 6/3 & 5 Rt. 001 /, Paku Jaya, Bumi Serpong Damai, Paku Jaya, Tangerang, Kota Tangerang Selatan",Kota Tangerang Selatan,Banten
"Jl Villa Pamulang Mas, Ruko Puri Angkasa Residence 1 No, 123 Kel Bambu Apus, Kec Pamulang",Kota Tangerang Selatan,Banten
Kp. Pondok Aren Rt 002 Rw 05 Pondok Kacang Timur Pondok Aren Tangerang Selatan 15226,Kota Tangerang Selatan,Banten
"Jl. Kademangan Curug No.999, Kademangan, Setu, Kota Tangerang Selatan, Banten 15314",Kota Tangerang Selatan,Banten
"Jl. Serpong Raya - Pakulonan, Rawa Mekar Jaya, Serpong, Bsd Sektor Xii Blok B4, No. 20, Rt. 02 Rw. 10, Pakulonan, Tangerang, Kota Tangerang Selatan,",Kota Tangerang Selatan,Banten
"Jl. Raya PLP Curug No. 88, Kadu Jaya, Curug, Tangerang Banten 15810",Kabupaten Tangerang,Banten
"Jl. Bsd Raya Utama, Desa Sampora, Kec. Cisauk, Kec. Tangerang, Banten",Kabupaten Tangerang,Banten
"Jl. Bsd Raya Utama, Desa Sampora, Kec. Cisauk, Kec. Tangerang, Banten",Kabupaten Tangerang,Banten
"Jl. Perintis Kemerdekaan No.33, Rt.007/Rw.003, Babakan, Kec. Tangerang, Kota Tangerang, Banten 15118",Kota Tangerang,Banten
Jl. Legoso Raya No 40 Pisangan Ciputat Timur Tangerang Selatan 15419,Kota Tangerang Selatan,Banten
"Jl. Roda Hias No.30, Serpong, Kota Tangerang Selatan, Banten 15310",Kota Tangerang Selatan,Banten
"Pasir Muncang, Jayanti, Tangerang, Banten, Banten",Kabupaten Tangerang,Banten
"Jl. Raya Serang, Jayanti Balaraja Tangerang, Banten",Kabupaten Tangerang,Banten
"Jl. Jalur Sutera Boulevard Alam No.45, RT.002/RW.002, Kunciran, Sutera, Kota Tangerang, Banten",Kota Tangerang,Banten
"Jl. Maleo Raya, Pd. Pucung, Kec. Pd. Aren, Kota Tangerang Selatan, Banten 15229",Kota Tangerang Selatan,Banten
"Jl. Beceng Rt 006 Rw 010 No. 78 Kel, RT.8/RW.10, Petukangan Utara, Kec. Pesanggrahan, Kota Jakarta Selatan, Daerah Khusus Ibukota Jakarta 12260, In",Kota Tangerang,Banten
"Jl. Raya Waringin Kurung, Margatani, Kec. Kramatwatu, Serang, Banten",Kabupaten Serang,Banten
"Jl. Bojonegara Polo Ampel Cilegon, Kota Cilegon, Banten",Kota Cilegon,Banten
Jalan Raya Labuan Km 13 Cisantri Desa Curug Barang Kecamatan Cipeucanng Kabupaten Pandeglang 42271,Kabupaten Pandeglang,Banten
"Jl. Sultan Ageng Tirtayasa No.2, Kunciran Jaya, Pinang, Kota Tangerang, Banten 15144",Kota Tangerang,Banten
"Jl. Garuda Operation Center, Rt.001/Rw.010, Pajang, Benda, Kota Tangerang, Banten",Kota Tangerang,Banten
"Jl. Raya Serpong, Pd. Jagung, Serpong Utara, Tangerang, Banten 15326",Kota Tangerang,Banten
"Jl. Bandara Mas Blok A8 No.16, Selapajang Jaya, Neglasari, Kota Tangerang, Banten 15127",Kota Tangerang,Banten
"Jalan Kh. Hasyim Ashari, Poris Plawad Indah, Cipondoh, Poris Plawad Indah, Cipondoh, Tangerang Selatan, Banten 15145",Kota Tangerang,Banten
"Jalan Kh. Hasyim Ashari, Poris Plawad Indah, Cipondoh, Poris Plawad Indah, Cipondoh, Tangerang Selatan, Banten 15145",Kota Tangerang,Banten
"Jl. Mangga Besar VII No.63, RT.6/RW.2, Tangki, Kec. Taman Sari, Kota Jakarta Barat, Daerah Khusus Ibukota Jakarta 11170, Indonesia",Kota Cilegon,Banten
"Jalan Raya Cisauk Sampora, Rt. 01 Rw. 03, Sampora, Cisauk, Sampora, Cisauk, Tangerang, Banten 15345",Kabupaten Tangerang,Banten
"Eco Plaza Jl. Citra Raya Boulevard. Perum Citra Rraya. Kec. Cikupa, Tangerang",Kabupaten Tangerang,Banten
"Jl. Raya Legok Parung Panjang. Ds Caringintangerang, Banten, Indonesia",Kabupaten Tangerang,Banten
"Jl. Raya Puspiptek No.27, Rt.1/Rw.1, Buaran, Kec. Serpong, Kota Tangerang Selatan",Kota Tangerang Selatan,Banten
"Jl. Ceger Raya, Pd. Karya, Pd. Aren, Kota Tangerang Selatan, Banten 15225",Kota Tangerang Selatan,Banten
"Jl. Raya Puspitek, Buaran, Pamulang, Kota Tangerang Selatan, Banten 15310",Kota Tangerang Selatan,Banten
"Jl Raya Puspitek No 46 , Buaran, Serpong, Tangerang Selatan, 15310",Kota Tangerang Selatan,Banten
"Jl. Graha Raya No. 01/29 Paku Jaya Serpong Utara, Banten",Kota Tangerang Selatan,Banten
"Jl. Raya Hos. Cokroaminoto Tangerang, Kota Tangerang, Banten",Kota Tangerang,Banten
"Jalan Utama Purati, Alam Jaya, Jatiuwung, Kota Tangerang, Banten",Kota Tangerang,Banten
"Jl. Bintaro Utama 9 Blok Hb1 No.19, Pd. Pucung, Kec. Pd. Aren, Kota Tangerang Selatan",Kota Tangerang Selatan,Banten
"Jl. Pajajaran No.46, Pamulang Bar., Kec. Pamulang, Kota Tangerang Selatan, Banten 15417",Kota Tangerang,Banten
"kuta jaya,kec ps kemis tangerang banten , Banten",Kabupaten Tangerang,Banten
"Jl. Prof. Dr. Hamka, Larangan, Ciledug, Tangerang, Banten",Kota Tangerang,Banten
"Komplek Villa Garuda, Sangiang Kota Tangerang, Banten",Kota Tangerang,Banten
"Jl. Puloampel argawana puloampel -  Serang, Banten",Kota Serang,Banten
Jl. Raya Palka Sindangsari Kec. Sindangsari Pabuaran Serang - Banten,Kota Serang,Banten
"Rest Area Jalan Tol Tangerang Jakarta Km. 13.5, Banten",Kota Tangerang,Banten
"Jl. W R Supratman No.15, Cemp. Putih, Kec. Ciputat Tim., Kota Tangerang Selatan, Banten 15412",Kota Tangerang Selatan,Banten
"Jl. Palapa Raya Rt. 02/ Rw. 18, Sarua, Pamulang, Serua, Ciputat, Kota Tangerang Selatan, Banten 15414",Kota Tangerang Selatan,Banten
"Jl. Raya Serang Jakarta Kp. Ranjeng Serang Banten, Banten",Kabupaten Lebak,Banten
"Jln. K.H. Wasyid Rt 04/04 Kel. Jombang Wetan, Cilegon",Kota Cilegon,Banten
"Jln. Raya Serang Timur Penancangan Serang, Banten",Kota Serang,Banten
Jl. Asia Raya Kav 03 Kawasan Industri Kec. Purwakarta Kota Cilegon,Kota Cilegon,Banten
"Jl. Aria Putra Rt 06 /15 Nomer Rumah 120 Kedaung Ciputat Selatan, Kota Tangerang Selatan",Kota Tangerang Selatan,Banten
"Jl. Raden Fatah, Sudimara Barat, Ciledug, Banten",Kota Tangerang,Banten
"Jl. Raya Pasar Kemis, Kutajaya, Tangerang, Banten",Kabupaten Tangerang,Banten
"Jl. Raya Kp. Melayu, Bojong Renget, Tangerang, Banten",Kota Tangerang,Banten
"Jl. Kampus Stan No.12, Jurang Manggu Tim., Kec. Pd. Aren, Kota Tangerang Selatan",Kota Tangerang Selatan,Banten
"Jl. Raya Cikande Rangkas Km 4.5, Tegal, RT.005/RW.001, Kareo, Kec. Jawilan, Serang, Banten 42177, Indonesia",Kabupaten Serang,Banten
Ruko Business Park Tangerang City Blok A.8? Jl. Jend. Sudirman No. 1,Kota Tangerang,Banten
"Jl. Jend. Sudirman No. 1, Cikokol, Kecamatan Tangerang, Rt.001/Rw.005, Babakan, Kec. Tangerang, Kota Tangerang, Banten",Kota Tangerang,Banten
"Jl. Ariawangsakara Pasar Tigaraksa Pinang, Tangerang  (Pic : 021-5990694)",Kabupaten Tangerang,Banten
"Jl. Raya Sepatan, Pertigaan Tanah Merah, Tangerang",Kabupaten Tangerang,Banten
"RT.004/RW.004, Kedaung Wetan, Kec. Neglasari, Kota Tangerang, Banten 15128",Kota Tangerang,Banten
"Jl. Panti Asuhan No.62, Rt.3/Rw.5, Jurang Mangu Barat, Kec. Pd. Aren, Kota Tangerang Selatan",Kota Tangerang Selatan,Banten
"Pertokoan Cikupa Blok B No.3, Jl. Raya Serang Km. 14,8",Kabupaten Tangerang,Banten
"Pertokoan Cikupa, Blok. B, Jalan Raya Serang, Km 14.8, No. 3, Pasir Gadung, Kec. Cikupa, Tangerang , Banten 15710",Kabupaten Tangerang,Banten
"Pertokoan Cikupa, Blok. B, Jalan Raya Serang, Km 14.8, No. 3, Pasir Gadung, Kec. Cikupa, Tangerang , Banten 15710",Kabupaten Tangerang,Banten
"Jl. Raya Bojonegara 103-107, Masigit, Kec. Jombang, Kota Cilegon,",Kota Cilegon,Banten
"Jl. Mawar 3, RT.003/RW.005, Neglasari, Kec. Neglasari, Kota Tangerang, Banten 15129",Kota Tangerang,Banten
"Jl. Cabe Raya, Pd. Cabe Ilir, Kec. Pamulang, Banten",Kota Tangerang Selatan,Banten
"Jl. Raya Tanjung Lesung, Panimbang Jaya, 42281, Banten",Kabupaten Pandeglang,Banten
"Kawasan Industri Jatake No. D, Pasir Jaya, Jatiuwung",Kota Tangerang,Banten
"Jl. Raya Cilegon, Pelamunan, Kec. Kramatwatu, Serang, Km 07",Kabupaten Serang,Banten
"Jl. MH. Thamrin No.3, RT.003/RW.001, Cikokol, Kec. Pinang, Kota Tangerang, Banten 15143, Indonesia",Kota Tangerang,Banten
"Jl. Taman Palem Raya, Wana Kerta, Kec. Sindang Jaya, Tangerang, Banten 15560, Indonesia",Kabupaten Tangerang,Banten
"Jl. Beringin Raya 189, Perumnas I, Tgr, Kota Tangerang, Banten",Kota Tangerang,Banten
"Jl Diklat Pemda, Rt 3 Rw 3, Bojong Nagka, Tangerang, Banten 15810",Kabupaten Tangerang,Banten
"Jalan Raya Serpong Km. 2, Pakulonan, Serpong Utara, Pakulonan, Serpong Utara, Kota Tangerang Selatan, Banten 15325",Kota Tangerang Selatan,Banten
"Kp. Begog, RT.10/RW.02, Singarajan, Pontang, Serang, Banten 42192",Kabupaten Serang,Banten
"Jl. Bsd Raya Utama, Lengkong Kulon, Pagedangan, Tangerang, Banten 15331",Kabupaten Tangerang,Banten
Kawasan Q-Big Bsd. Jl. Bsd Raya Utama. Pagedangan. Tangerang Bantem,Kabupaten Tangerang,Banten
"Jelupang, Bumi Serpong Damai, Jelupang, Tangerang Selatan, Banten",Kota Tangerang Selatan,Banten
"Jl. Letjen Sutopo Bsd Tangerang, Kota Tangerang Selatan, Banten",Kota Tangerang Selatan,Banten
"Jalan Marsekal Suryadarma Raya Rt. 02 Rw. 07, Neglasari, Jl. Marsekal Surya Darma No.2, RT.003/RW.007, Neglasari, Kec. Neglasari, Kota Tangerang, B",Kota Tangerang,Banten
"Jl. F1, Bandara Soekarno Hatta, Cengkareng, Banten",Kota Tangerang,Banten
"Jl. Gerbang Perum Persada Banten, Kepuren, Kec. Walantaka, Kota Serang, Banten",Kota Serang,Banten
"Jl Boulevard Citra Raya, Cikupa, Kec. Cikupa, Tangerang, Banten 15710",Kabupaten Tangerang,Banten
"Jl. Pajajaran Gandasari, Jatiuwung, Kota Tangerang, Banten",Kota Tangerang,Banten
"Jl. Kh. Hasyim Ashari No. 77 Cipondoh - Tangerang, Banten",Kota Tangerang,Banten
"Ruko Cendana Loka Blok.G1/6A, Paku Jaya, Bumi Serpong Damai, Paku Jaya, Tangerang, Kota Tangerang Selatan",Kota Tangerang Selatan,Banten
"Jl. Dayung Raya, Klp Dua, Kec Kelapa Dua - Tangerang",Kabupaten Tangerang,Banten
"Jl. Kota Sari, Kotabumi, Kec. Purwakarta, Kota Cilegon, Banten",Kota Cilegon,Banten
"Gedung Kemenhub Bandara Soekarno Hatta, Kota Tangerang Banten",Kota Tangerang,Banten
"Jl. Raya Binong, RT.01/09 Binong Curug, Binong, Kec. Curug, Tangerang  Banten 15810",Kabupaten Tangerang,Banten
Jl. Raya Tobat Rt 002 Rw 001. Kec. Balaraja Kab.Tangerang,Kabupaten Tangerang,Banten
"Jl. Kesehatan V No.62, Cipayung, Kec. Ciputat, Kota Tangerang Selatan, Banten 15411, Indonesia",Kota Tangerang Selatan,Banten
"Jl. Raya Plp Curug | Banten | Kabupaten Tangerang, Banten",Kabupaten Tangerang,Banten
"Jl. Raya Merdeka, Pabuaran, Karawaci, Kota Tangerang, Banten 15114",Kota Tangerang,Banten
"Jl. Raya Cisoka, Kp. Pesanggarahan, Desa Solear, Banten",Kabupaten Tangerang,Banten
"Jl Daan Mogot Km 23 Tanah Tinggi Tangerangkota Tangerang, Banten - 15119",Kota Tangerang,Banten
"Kedaton, Jl. Raya Pasar Kemis, Pasir Gadung, Kec Cikupa, Tangerang, Banten 15710",Kabupaten Tangerang,Banten
"Jl. Jenderal Sudirman No.58, RT.005/RW.005, Babakan, Kec. Tangerang, Kota Tangerang, Banten 15118, Indonesia",Kota Tangerang,Banten
"Jl. Paradise Serpong City, Babakan, Kec. Setu, Kota Tangerang Selatan",Kota Tangerang Selatan,Banten
"L. W R Supratman No.18A, Rt.2/Rw.5, Cemp. Putih, Kec. Ciputat Tim., Kota Tangerang Selatan",Kota Tangerang Selatan,Banten
"Jalan Raya Pamulang Permai Ii, Pondok Benda, Pamulang, Pd. Benda, Kec. Pamulang, Kota Tangerang Selatan, Banten 15416",Kota Tangerang Selatan,Banten
"Jl. Tegal Rotan Raya, Pd. Jaya, Kec. Pd. Aren, Kota Tangerang Selatan",Kota Tangerang Selatan,Banten
"Jl. Raya Labuan-Panimbang, Panimbang Jaya, Banten, Pasar Panimbang",Kabupaten Pandeglang,Banten
Kav Komersial Taman Tekno Blok B No 1 Sektor Xi Bsd Tangerang,Kota Tangerang Selatan,Banten
"Patrasana , Kec Kresek, Tangerang Banten 15620, Banten",Kabupaten Tangerang,Banten
"Jl. Raya Serang Km 9 Rt 4/2 Citeureup Ciruas, Banten",Kota Serang,Banten
"Jl. Cemara Raya No. 69 Rt 04/19 Cibodas, Banten",Kota Tangerang,Banten
"Jl. Gading Serpong Boulevard, Curug Sangereng, Kec. Klp. Dua, Tangerang, Banten 15810",Kabupaten Tangerang,Banten
"Sme'Sco Mart, Jl. Mauk Raya Km.11, Rt.01/ Rw.02, Sepatan, Tangerang, Banten 15520",Kabupaten Tangerang,Banten
"Jl. Kh. Hasyim Asyhari No. 1 Cipondoh, Kota Tangerang, Banten",Kota Tangerang,Banten
"Jl. Raden Fatah, Dian Plaza 2, Sudimara, Ciledug, Tangerang",Kota Tangerang,Banten
"Jl. MH. Thamrin No.3, RT.003/RW.001, Cikokol, Kec. Pinang, Kota Tangerang, Banten",Kota Tangerang,Banten
"Jl. Raya Rawa Buntu No.1, Rw. Buntu, Kec. Serpong, Kota Tangerang Selatan",Kota Tangerang Selatan,Banten
"Jl. H.Mencong No.13, RT.003/RW.004, Sudimara Tim., Kec. Ciledug, Kota Tangerang, Banten 15151, Indonesia",Kota Tangerang,Banten
"Jl. Link Solokan & Sukalila, Panggung Rawi, Kec. Jombang, Kota Cilegon",Kota Cilegon,Banten
"Jl. Akses Tol Serang Tim., Rt.01/Rw.01, Panancangan, Kec. Cipocok Jaya, Kota Serang, Banten",Kota Serang,Banten
"Jl Bhayangkara No.6 Sumur Pecung Serang, Banten",Kota Serang,Banten
"Jl. Veteran No.94, RT.3/RW.8, Kotabaru, Kec. Serang, Kota Serang, Banten 42112, Indonesia",Kota Serang,Banten
"Jl. Raya Rangkasbitung Km.9 Jawilan Serang, Banten",Kabupaten Serang,Banten
Jl. Perum Bukit Nusa Indah Kav 1985-1986  Serua Pondok Aren Tangerang Selatan 15414,Kota Tangerang Selatan,Banten
"Jl. Hos Cokroaminoto, Rt.003/Rw.001, Kreo, Kec. Larangan, Kota Tangerang, Banten",Kota Tangerang,Banten
"Rest Area Terminal Kargo , Bandara Soekarno -Hatta",Kota Tangerang,Banten
"Rest Area Terminal Kargo , Bandara Soekarno -Hatta",Kota Tangerang,Banten
"Jl. Kampung Cengkong, Belombing, Kosambi, Banten",Kota Tangerang,Banten
"Pajang, Benda, Tangerang City, Banten 15126, Banten",Kota Tangerang,Banten
"Jl. Kh Hasyim Ashari No.28, Rt.2/Rw.5, Pinang, Kec. Pinang, Kota Tangerang, Banten 15145",Kota Tangerang,Banten
"Jl. Surya Kencana No.79, Pamulang Bar., Kec. Pamulang, Kota Tangerang Selatan, Banten",Kota Tangerang Selatan,Banten
"Jl. Pluit Selatan Raya, Rt.23/Rw.8, Penjaringan, Kota Jkt Utara, Daerah Khusus Ibukota Jakarta 14440",Kabupaten Serang,Banten
"Jl. Pluit Selatan Raya, Rt.23/Rw.8, Penjaringan, Kota Jkt Utara, Daerah Khusus Ibukota Jakarta 14440",Kabupaten Serang,Banten
"Jl. Raya Serang, Cikande, Jayanti, Tangerang, Banten 42186",Kabupaten Serang,Banten
"Jl. Ir. Juanda No. 1, Desa Karang Anyar, Neglasari, Kec. Tangerang, Banten 15121",Kota Tangerang,Banten
"Jl. Setasiun Pd. Ranji, Rengas, Kec. Ciputat Tim., Kota Tangerang Selatan",Kota Tangerang Selatan,Banten
"Jalan Raya Serang Cilegon Km.5, Wanayasa, Kec. Kramatwatu, Serang, Banten",Kabupaten Serang,Banten
"Jl. Garuda No.999 Batu Ceper, Tangerang, Banten",Kota Tangerang,Banten
"Jl. Aria Putra, Kedaung, Pamulang, Kota Tangerang Selatan, Banten 15415",Kota Tangerang Selatan,Banten
"Jalan Raya Serang Km 10, Pos Bitung, Kecamatan Curug, Kabupaten, Kadu, Kec. Curug, Tangerang, Banten 15810",Kabupaten Tangerang,Banten
Jl.KH Yasin Beji No.4 Kebondalem Kec Purwakarta Cilegon,Kota Cilegon,Banten
"Komp. Pergudangan Bandara Mas, Tangerang, Banten",Kota Tangerang,Banten
"Jl Raya Labuan Km 01, Ciekek Krkaton Majasari Pandeglang",Kabupaten Pandeglang,Banten
"Jalan Cinangka Raya Blok Nangka No.1, RT.1/RW.3, Kedaung, Kec. Sawangan, Kota Depok, Jawa Barat 16517, Indonesia",Kota Tangerang Selatan,Banten
"Jl Ir Sutami Link Cimerak Rt 13 / Rw 04, Banten",Kota Cilegon,Banten
"Jl. Raya Cukang Galih, Cukang Galih, Kec. Curug, Tangerang, Banten 15810",Kabupaten Tangerang,Banten
"Kp. Ciater Rt 03 Rw 01 Rawa Mekar Jaya, Tangerang Selatan 15311",Kota Tangerang Selatan,Banten
"Kencana Loka Sektor Xii, Blok D, Jl. Buana Kencana, Bumi Serpong Damai, Rw. Buntu, Tangerang Selatan, Kota Tangerang Selatan, Banten 15318",Kota Tangerang Selatan,Banten
"Jl. Raya Mauk No.KM.11, RW.No.181, Sepatan, Kec. Sepatan, Kota Tangerang, Banten 15520, Indonesia",Kota Tangerang,Banten
"Jl. KH. Wahid Hasyim, RT.002/RW.008, Kreo Selatan, Kec. Larangan, Kota Tangerang, Banten 15155, Indonesia",Kota Tangerang,Banten
"Ruko Beranda Serpong No 1- No.1, Serua,, Jl. Ciater Raya No.2, Serua, Kec. Ciputat, Kota Tangerang Selatan, Banten 15414",Kota Tangerang Selatan,Banten
"Jalan Kh Hasyim Ashari No.18, Sudimara Pinang, Pinang, Kota Tangerang, Banten 15145",Kota Tangerang,Banten
"Jl. Ceger Raya No.62, Jurang Manggu Tim., Kec. Pd. Aren, Kota Tangerang Selatan",Kota Tangerang Selatan,Banten
"Jalan Marsekal Suryadarma Rt 01 Rw 01, Selapajang, Neglasari, Selapajang Jaya, Neglasari, Kota Tangerang, Banten 15127",Kota Tangerang,Banten
"Bandar Udara Internasional Soekarno-Hatta Terminal 3, Pajang, Benda, Kota Tangerang, Banten 15126",Kota Tangerang,Banten
"Soekarno-Hatta International Airport (Cgk), Pajang, Benda, Tangerang City, Banten 15126",Kota Tangerang,Banten
"Jl. Gading Serpong Boulevard, Pakulonan Bar., Kec. Klp. Dua, Tangerang, Banten 15810, Indonesia",Kota Tangerang,Banten
"Supermall Karawaci, Jl. Boulevard diponegoro No. 105, Klp. Dua Kec. Klp Dua Tangerang Banten 15810",Kabupaten Tangerang,Banten
Jl. 105 Boulevard Diponegoro 00-00- Lippo Karawaci 1200-Tangerang,Kabupaten Tangerang,Banten
"Jalan Ahmad Yani No. 33 Kelurahan Cimuncang, Kecamatan Serang",Kota Serang,Banten
"Jl. Wachid Hasyim No. 8, Cipadu, Kota Tangerang, Banten",Kota Tangerang,Banten
"Jl. Raya Anyer, Cigading Cilegon, Kota Cilegon, Banten",Kota Cilegon,Banten
"Jl. Pahlawan Seribu No.1, Lengkong Wetan, Kec. Serpong, Kota Tangerang Selatan",Kota Tangerang Selatan,Banten
"Jl. W R Supratman Blok Mangga 1 No.16, Rt.2/Rw.5, Cemp. Putih, Kec. Ciputat Tim., Kota Tangerang Selatan",Kota Tangerang Selatan,Banten
"Jl. Raya Serang Km. 24, Balaraja Tangerang, Banten",Kabupaten Tangerang,Banten
"Jln. Raya Rangkasbitung Kp. Pengkolan Asem, Cikande-Serang",Kabupaten Serang,Banten
"Jl. Moch. Toha Km. 1, Tangerang, Kota Tangerang, Banten",Kota Tangerang,Banten
"Jl. Moch. Toha Km. 1, Tangerang, Kota Tangerang, Banten",Kota Tangerang,Banten
"Jl. Jombang Baru Blok A1 No.1, Jombang, Kec. Ciputat, Kota Tangerang Selatan",Kabupaten Lebak,Banten
"Bandara Soekarno Hatta Terminal 1A, Tangerang, Pajang, Benda, Kota Tangerang, Banten 15126",Kota Tangerang,Banten
"Bandar Udara Internasional Soekarno-Hatta Terminal 3, Pajang, Benda, Kota Tangerang, Banten 15126",Kota Tangerang,Banten
"Jl. Raya Serang Km,15 Pasar Cikupa, Kabupaten Tangerang, Banten",Kabupaten Tangerang,Banten
"SoekarnoHatta International Airport, Kota Tangerang, Banten",Kota Tangerang,Banten
"Ruko Versailes Sektor 1.6 Blok Sb No.20 &21 Bsd Eks Rest Area Serpong, Tol Serpong - Ulujami Ruas Serpong, Pondok Aren Km 7+200, Tangerang Selata",Kota Tangerang Selatan,Banten
"Pd. Jaya, Kec. Pd. Aren, Kota Tangerang Selatan, Banten 15220",Kota Tangerang Selatan,Banten
"Boulevard Bintaro Jaya Blok. O-2, Bintaro Jaya Sektor Vii, Pondok Jaya, Pondok Aren, Tangerang, Banten 15224",Kota Tangerang Selatan,Banten
"Boulevard Bintaro Jaya Blok. O-2, Bintaro Jaya Sektor Vii, Pondok Jaya, Pondok Aren, Tangerang, Banten 15224",Kota Tangerang Selatan,Banten
"Boulevard Bintaro Jaya Blok. O-2, Bintaro Jaya Sektor Vii, Pondok Jaya, Pondok Aren, Pd. Jaya, Pd. Aren, Tangerang, Banten 15227",Kota Tangerang Selatan,Banten
"Boulevard Bintaro Jaya Blok. O-2, Bintaro Jaya Sektor Vii, Pondok Jaya, Pondok Aren, Pd. Jaya, Pd. Aren, Tangerang, Banten 15227",Kota Tangerang Selatan,Banten
"Boulevard Bintaro Jaya Blok. O-2, Bintaro Jaya Sektor Vii, Pondok Jaya, Pondok Aren, Pd. Jaya, Pd. Aren, Tangerang, Banten 15227",Kota Tangerang Selatan,Banten
"Boulevard Bintaro Jaya Blok. O-2, Bintaro Jaya Sektor Vii, Pondok Jaya, Pondok Aren, Pd. Jaya, Pd. Aren, Tangerang, Banten 15227",Kota Tangerang Selatan,Banten
"Boulevard Bintaro Jaya, Jl. Sektor Vii No.2, Pd. Jaya, Kec. Pd. Aren",Kota Tangerang Selatan,Banten
"Boulevard Bintaro Jaya, Jl. Sektor Vii No.2, Pd. Jaya, Kec. Pd. Aren",Kota Tangerang Selatan,Banten
"Jl Raya Serang, Cikupa - Tangerang, Kabupaten Tangerang, Banten",Kabupaten Tangerang,Banten
"Ruko Premier Park No. C1-C3, Tangerang, Kota Tangerang, Banten",Kota Tangerang,Banten
"Jl Husein Sastranegara Kavling 1, Bandara Soekarno Hatta, Benda",Kota Tangerang,Banten
"Bandar Udara Internasional Soekarno-Hatta Terminal 3, Pajang, Benda, Kota Tangerang, Banten 15126",Kota Tangerang,Banten
"Jl. Boulevard Palem Raya N0. 7, Bencongan Kec. Kelapa Dua, Tangerang, Banten 15810",Kabupaten Tangerang,Banten
"Bandar Udara Internasional Soekarno-Hatta Terminal 3, Pajang, Benda, Kota Tangerang, Banten 15126",Kota Tangerang,Banten
"Soekarno-Hatta International Airport (Cgk), Pajang, Benda, Tangerang City, Banten 15126",Kota Tangerang,Banten
"Jl. Mh. Thamrin No.Km. 2, Rt.003/Rw.002, Panunggangan Utara, Kec. Pinang, Kota Tangerang, Banten 15143",Kota Tangerang,Banten
"Soekarno-Hatta International Airport (Cgk), Pajang, Benda, Tangerang City, Banten 15126",Kota Tangerang,Banten
"Terminal 3 Bandara Soekarno Hatta, Kota Tangerang, Banten",Kota Tangerang,Banten
"Jl. Pd. Cabe Raya No.16, Pd. Cabe Udik, Kec. Pamulang, Kota Tangerang Selatan",Kota Tangerang Selatan,Banten
"Jl. Imam Bonjol No. 38, Tangerang, Kota Tangerang, Banten",Kota Tangerang,Banten
"Tangerang, Tangerang City, Banten, Indonesia",Kota Tangerang,Banten
"Jl. Daan Mogot No.62C, Sukarasa, Kec. Tangerang, Kota Tangerang, Banten 15111",Kota Tangerang,Banten
"Jl. Raya Lanud Gorda, Kibin, Kec. Kibin, Serang, Banten 42185, Indonesia",Kabupaten Serang,Banten
"Jl Raya Bojonegara, Bojonegara Kabupaten/KotaCilegonKode Pos 42454",Kota Cilegon,Banten
"Jl. Raya Serang - Pandeglang, Cigadung, Kec. Karang Tj., Kabupaten Pandeglang, Banten 42251",Kabupaten Pandeglang,Banten
"Jalan Tol Merak Cikuasa Pantai, Gerem, Kec. Gerogol, Kota Cilegon, Banten 42438",Kota Cilegon,Banten
"Jl Raya Bojonegara, Bojonegara Kabupaten/KotaCilegonKode Pos 42454",Kota Cilegon,Banten
"Jl. Pd. Cabe Raya No.16, Pd. Cabe Udik, Kec. Pamulang, Kota Tangerang Selatan",Kota Tangerang Selatan,Banten
"Jl. Raya Lengkong Gudangtimur, Lengkong Gudang Tim., Kec. Serpong, Kota Tangerang Selatan",Kota Tangerang Selatan,Banten
"Lower Ground Unit Lg 05-06, Jl. Sutera Barat Kav. 16 Alam Sutera, Tangerang 15143",Kota Tangerang,Banten
"Jl. Bojonegara, Kertasana, Bojonegara, Serang, Banten",Kota Cilegon,Banten
"Jl. Bojonegara-Serdang, Serdang, Kec. Kramatwatu, Serang, Banten",Kota Cilegon,Banten
"Jl. Ruko Pinangsia Blok L No. 7, Lippo Karawaci, Banten",Kota Tangerang,Banten
"Jl. Asrama Polri, Ciputat, Kec. Ciputat, Kota Tangerang Selatan, Banten 15411",Kota Tangerang Selatan,Banten
Jl. H. Najih No. 3 Larangan Ciledug Kota Tangerang,Kota Tangerang,Banten
"Jl. Gatot Subroto KM 35 Jatiuwung, Kota Tangerang, Banten",Kota Tangerang,Banten
"Jl. Raya Curug Rt 02/04, Kel. Curug Kulo | Banten | Kabupaten Tangerang",Kabupaten Tangerang,Banten
"Jl. Raya Pasar Kemis Rajeg Sindang Sari, Pasar Kemis",Kabupaten Tangerang,Banten
"Kp. Pabuaran , Desa Cibodas, Rumpin, Bogor, Banten",Kabupaten Tangerang,Banten
"Jl. Raden Saleh No. 10 Karang Tengah, Kota Tangerang, Banten",Kota Tangerang,Banten
"Perumahan Taman Asri, Larangan Ciledug, Kota Tangerang, Banten",Kota Tangerang,Banten
"Jl. Raya Cilegon No.27, Pelamunan, Kec. Kramatwatu, Serang, Banten 42616, Indonesia",Kabupaten Serang,Banten
"Jl. Brigadir Jenderal Katamso, Gunungsugih, Kec. Ciwandan, Kota Cilegon, Banten 42447, Indonesia",Kota Cilegon,Banten
