"Jl. Raya Kukun Pasar Kemis, Tangerang, Kabupaten Tangerang, Banten",Kabupaten Tangerang,Banten
"Talagasari, Cikupa, Tangerang, Banten 15560, Banten",Kabupaten Tangerang,Banten
"Jl. Raya Mauk No.73, RW.6, Karet, Kec. Sepatan, Tangerang, Banten 15520, Indonesia",Kota Tangerang,Banten
"Ruko Dormitorio Blok A No 1, Jl Raya Gading Serpong",Kabupaten Tangerang,Banten
"Jl. Serpong No.2, Serpong, Kota Tangerang Selatan, Banten 15310",Kota Tangerang Selatan,Banten
"Jl. Bukit Golf I No.Bsd, Sektor Vi, Kec. Serpong Utara, Kota Tangerang Selatan",Kota Tangerang Selatan,Banten
"Jl. Bukit Raya No.2, Pisangan, Kec. Ciputat Tim., Kota Tangerang Selatan",Kota Tangerang Selatan,Banten
"Jl. Bukit Raya No.2, Pisangan, Kec. Ciputat Tim., Kota Tangerang Selatan",Kota Tangerang Selatan,Banten
"Jl. Borobudur Raya No.45 Roro Jonggrang Komplek Harapan Kita Perumnas Ii , Bencongan, Kelapa Dua, Tangerang",Kabupaten Tangerang,Banten
"Jl. Bojonegara Pulo Ampel, Margariri, Serang Banten",Kota Cilegon,Banten
"Jl. Surya Kencana, Pamulang Bar., Kec. Pamulang, Kota Tangerang Selatan",Kota Tangerang Selatan,Banten
"Jl. Veteran No.49, Kotabaru, Kec. Serang, Kota Serang, Banten 42112, Indonesia",Kota Cilegon,Banten
"Jl. Raya Ciptayasa Ciruas No.16, Singamerta, Kec. Ciruas, Serang, Banten 42182, Indonesia",Kabupaten Serang,Banten
"Jl. Swadaya Raya No.52-46, RT.005/RW.005, Larangan Indah, Kec. Larangan, Kota Tangerang, Banten",Kota Tangerang,Banten
"Jl. Raden Patah Blok Saman No.53, RT.6/RW.003, Parung Serab, Kec. Ciledug, Kota Tangerang, Banten",Kota Tangerang,Banten
"Indomaret Bioskop Sentausa, Jalan Kp. Gembor 02, Periuk",Kota Tangerang,Banten
"Jl. Kyai A. Dahlan Petir Cipondoh, Tangerang, Banten 15147",Kota Tangerang,Banten
"Gg Ledug Asem No 178, Alam Jaya Jatiuwung Kota Tangerang 15133",Kota Tangerang,Banten
"Jl. Tawes No.17, RT.6/RW.1, Tj. Priok, Kota Jkt Utara, Daerah Khusus Ibukota Jakarta 14310, Indonesia",Kabupaten Tangerang,Banten
"Jl. Raya Pondok Kacang, Ciledug, Kota Tangerang, Banten",Kota Tangerang,Banten
"Jalan Pondok Kacang, Parung Serab, Ciledug, Pd. Kacang Tim., Pd. Aren, Kota Tangerang, Banten 15226",Kota Tangerang,Banten
"Jl. Raya Plp Curug, Kp. Candu Rt.04/01, Serdang Wetan, Legok",Kabupaten Tangerang,Banten
"Jl. Raya Serang Km 68, Nambo Ilir, Kibin, Cikande, Banten",Kabupaten Serang,Banten
"Jl. Raya Pandeglang - Rangkasbitung, Kabupaten Lebak, Banten",Kabupaten Lebak,Banten
"Kepuren, Walantaka, Serang City, Banten, Banten",Kabupaten Serang,Banten
"Serang, Lontarbaru, Serang, Serang City, Banten, Banten",Kota Serang,Banten
"Jl. Sasak Tinggi No. 3, Otista Ciputat, Ciputat, Kec. Ciputat, Kota Tangerang Selatan",Kota Tangerang Selatan,Banten
"Jl. Pajajaran No.41, Pamulang Bar., Kec. Pamulang, Kota Tangerang Selatan, Banten 15417",Kota Tangerang Selatan,Banten
"Jl. Aria Putra No.399, Serua Indah, Kec. Ciputat, Kota Tangerang Selatan, Banten 15414",Kota Tangerang Selatan,Banten
"Jl. Qadr Raya No.3 Rt.001/014 Kelapa Dua, Banten",Kabupaten Tangerang,Banten
"Jl. Raya Cilegon No.37, Pagebangan, Sukmajaya, Kec. Jombang, Kota Cilegon, Banten 42416, Indonesia",Kota Cilegon,Banten
"Gading Serpong, Tangerang Selatan, Kabupaten Tangerang, Banten",Kabupaten Tangerang,Banten
"Jl. Aria Putera Sarua Indah Ciputat, Tangerang, Banten",Kota Tangerang Selatan,Banten
"Kawasan Industrial Estate, Jalan Eropa 1, Warnasari, Citangkil, Kota Cilegon, Banten 42442",Kota Cilegon,Banten
Jl. Boulevard Raya Gading Serpong - Summarecon. Pakulonan Barat. Kelapa Dua. Tangerang,Kabupaten Tangerang,Banten
"Jl. Arya Santika N0. 72 Tiga Raksa - Tangerang, Banten",Kabupaten Tangerang,Banten
"Jl. Kh Mas Mansyur No.2, Rt.005/Rw.007, Kunciran Indah, Kec. Pinang, Kota Tangerang",Kota Tangerang Selatan,Banten
"Jl. Raya Cisauk-Legok, Cibogo, Cisauk, Tangerang, Banten 15341",Kabupaten Tangerang,Banten
"Jl. Ki Hajar Dewantoro No.13, Sawah Lama, Kec. Ciputat, Kota Tangerang Selatan, Banten 15411",Kota Tangerang Selatan,Banten
"Jl. Prabu Kian Santang No.96, RT.001/RW.001, Keroncong, Kec. Jatiuwung, Kota Tangerang, Banten 15134, Indonesia",Kota Tangerang,Banten
"Jl. Sultan Ageng Tirtayasa, Rt.005/Rw.013, Kunciran Indah, Kec. Pinang, Kota Tangerang, Banten",Kota Tangerang,Banten
"Jalan Raya Serang - Jakarta KM. 65, Julang, Serang, Julang, Kec. Cikande, Serang, Banten 42185, Indonesia",Kabupaten Serang,Banten
"Stasiun Pintu Tengah, Jl. Kiasnawi, Sukarasa, Kec. Tangerang, Kota Tangerang, Banten 15111",Kota Tangerang,Banten
"Jl. Arya Santika N0. 72 Tiga Raksa - Tangerang, Banten",Kabupaten Tangerang,Banten
"Jl. Raya Serpong, Cilenggang, Kec. Serpong, Kota Tangerang Selatan",Kota Tangerang Selatan,Banten
"Jl. Pondok Ranji Raya Blok Ap, No 30 Rt.03 Rw 04 Pondok Betung, Pd. Betung, Kec. Pd. Aren, Kota Tangerang Selatan",Kota Tangerang Selatan,Banten
"Jl Lingkar Selatan Cilegon Desa Waringin Kurung, Kabupaten Serang",Kabupaten Serang,Banten
"Jl. Inpres Raya No. 16, Kelurahan Larangan Selatan Kecamatan Larangan",Kota Tangerang,Banten
"Jalan Griya Asri Blok C1 Cikande, Kecamatan Cikande, Kab Serang 42186",Kabupaten Serang,Banten
"Jalan Gajah Tunggal, Pasir Jaya, Jatiuwung, Pasir Jaya, Jatiuwung, Kota Tangerang, Banten 15135",Kota Tangerang,Banten
"Jl. Pembangunan Iii, Rt.01/03, Karang Anyar, Neglasari, Tangerang",Kota Tangerang,Banten
Jl. P. Merah Raya Bencongan Indah Kec. Klp Dua Taangerang banten 15810,Kabupaten Tangerang,Banten
"Ruko Paramount Gading Serpong - Tangerang, Banten",Kabupaten Tangerang,Banten
"Jl Cukang Galih, Rt. 05 Rw. 01, Cikupa, Kec. Tangerang",Kabupaten Tangerang,Banten
"Komplek Permata Regency, Pasar Kemis, Tangerang, Banten",Kota Tangerang,Banten
"Jl Raya Curug Parigi No 109, Suka Bakti, Kec. Curug, Tangerang, Banten",Kota Tangerang,Banten
"Jl. Rajawali No.1, Sukamanah, Kec. Rajeg, Tangerang, Banten 15540, Indonesia",Kabupaten Tangerang,Banten
"Jl. Husein Sastranegara No.72, RT.002/RW.004, Jurumudi, Benda, Kota Tangerang, Banten 15124",Kota Tangerang,Banten
"Jl. Raya Jakarta  Pakupatan Serang, Kota Serang, Banten",Kota Serang,Banten
"Jl. Rumah Sakit No. 88, Tobat, Balaraja, Tobat, Tangerang, Banten 15126",Kabupaten Tangerang,Banten
"Distrik Tivoli No.1, Paramont Serpong, Jl. Boulevard Gading Serpong, Tangerang",Kabupaten Tangerang,Banten
"Jl. Sultan Ageng Tirtayasa Rt.01/03 No.44, Pasar Bengkok, Pinang - Tangerang",Kota Tangerang,Banten
"Jl. Raya Ceger No,35 Rt. 013 Rw. 07 Jurangmangu Timur Pondok Aren Tangerang 15222",Kota Tangerang Selatan,Banten
"Jl. Astek Jombang Rt. 03 Rw. 10 Rawa Lele , Jombang, Pamulang, Kabupaten Tangerang.15414",Kota Tangerang Selatan,Banten
"Perumahan Villa Pamulang Blok Ch8 No.22 & 23, Pondok Benda, Pamulang, Tangerang Selatan.15416",Kota Tangerang Selatan,Banten
"Jl. Sekneg Raya, RT.006/RW.001, Panunggangan Utara, Kec. Pinang, Kota Tangerang, Banten 15143",Kota Tangerang,Banten
"Jl. Maleo Raya No.22, Pd. Pucung, Kec. Pd. Aren, Kota Tangerang Selatan",Kota Tangerang Selatan,Banten
"Jl. Kh Mushinif Km. 2 Kampung Besar, Kota Tangerang, Banten",Kota Tangerang,Banten
"Kencana Loka Sektor Xii 4, Blok P-1 No. 35, Rt 03 / Rw 12, Jl. Wana Kencana, Bumi Serpong Damai, Serpong, Ciater, Serpong, Kota Tangerang Selatan, B",Kota Tangerang Selatan,Banten
"Jl. Cikande - Rangkasbitung, Junti, Jawilan, Serang, Banten 42177",Kabupaten Serang,Banten
"Jalan Raya Legok Karawaci, Medang, Tangerang, Banten 15820",Kabupaten Tangerang,Banten
"Jl. Cikande Rangkas Rt 02 Rw 02 Cikande, Banten",Kabupaten Serang,Banten
"Citerep, Kec. Ciruas, Serang, Banten, Kabupaten Serang, Banten",Kabupaten Serang,Banten
"Jl. Rangkas Cikande Lembur Sawah Rt 03 Rw 05, Banten",Kabupaten Lebak,Banten
"Jl. Raya Serang, Ciapus Balaraja Tangerang, Banten",Kota Tangerang,Banten
"Jl. Lanud Gorda Desa Julang, Kec Kibin, Kota Cilegon, Banten",Kota Cilegon,Banten
"Jl. Raya Serang Km. 68, Nambo Ilir, Nambo Ilir, Serang, Banten 42185",Kabupaten Serang,Banten
"Warnasari, Citangkil, Cilegon City, Banten 42442, Indonesia",Kota Cilegon,Banten
"Jl Raya Paku Haji, Rt 003 Rw 01, Duri, Pakualam, Pakuhaji, Tangerang",Kabupaten Tangerang,Banten
"Jl. Irigasi, Rt.002/Rw.001, Kenanga, Kec. Cipondoh, Kota Tangerang, Banten 15146",Kota Tangerang,Banten
"Jl. Moh. Husni Thamrin No.1, Pd. Jaya, Kec. Pd. Aren, Kota Tangerang Selatan",Kota Tangerang Selatan,Banten
"Jl. Rest Area KM VII No.19, Jombang, Kec. Ciputat, Kota Tangerang Selatan, Banten 15414, Indonesia",Kabupaten Tangerang,Banten
"Ruko Permata Niaga I, No. 61-62, Taman Royal, Tanah Tinggi, Tanah Tinggi, Kec. Tangerang, Kota Tangerang, Banten 15124",Kota Tangerang,Banten
"Jl Puri Beta Town Center, Lot 2 No. 27, Larangan Utara, Ciledug, Larangan Utara, Larangan, Kota Tangerang, Banten 15154",Kota Tangerang,Banten
"RT.003/RW.006, Babakan, Kec. Tangerang, Kota Tangerang, Banten 15117, Indonesia",Kota Tangerang,Banten
"Jl. Raya Mauk No.181, Sepatan, Kec. Sepatan, Tangerang, Banten 15520",Kabupaten Tangerang,Banten
"Jl. Binong Permai, Binong, Kec. Curug, Tangerang, Banten 15810",Kabupaten Tangerang,Banten
"Jl. Ceger Raya No.11, Rt.1/Rw.2, Jurang Manggu Tim., Kec. Pd. Aren, Kota Tangerang Selatan",Kota Tangerang Selatan,Banten
"Jalan Raya Serang Gorda Km 69 Kelurahan Nambo Ilir, Kecamatan Kibin, Kabupaten Serang 42185",Kabupaten Serang,Banten
"Gg. Swadaya Jl. Pahlawan No.9, Rempoa, Ciputat Tim., Kota Tangerang Selatan, Banten 15412",Kota Tangerang Selatan,Banten
"Jl. Blossom Citra Raya Rt.06 Rw.04 Mekarbakti, Cikupa, Tangerang, Banten 15710",Kabupaten Tangerang,Banten
"Jl. Pajajaran Raya, Cibodas Baru, Kec. Cibodas, Kota Tangerang, Banten, Indonesia",Kabupaten Tangerang,Banten
"Jl. Jenderal Sudirman Tanah Tinggitangerang, Banten, Indonesia",Kota Tangerang,Banten
"Jl. Moch.Toha Pondok Arum No.7, Bugel, Karawaci, RT.001/RW.008, Bugel, Tangerang, Tangerang City, Banten 15113",Kota Tangerang,Banten
"Jl. Raya Serang Km.16.5, Tangerang, Kabupaten Tangerang, Banten",Kabupaten Tangerang,Banten
"Perumahan Griya Cisoka, Tangerang, Kabupaten Tangerang, Banten",Kabupaten Tangerang,Banten
"Jl. Taman Makam Pahlawan Taruna, Sukasari, Kec. Tangerang, Kota Tangerang, Banten 15118",Kota Tangerang,Banten
"Kp. Kosambi Barat Rt.004/002, Kosambi, Tangerang, Banten",Kota Tangerang,Banten
"Jl. Raya Daan Mogot, Batu Ceper, Tangerang, Banten",Kota Tangerang,Banten
"Jl. Lengkong Wetan No.6, Lengkong Karya, Kec. Serpong Utara, Kota Tangerang Selatan",Kota Tangerang Selatan,Banten
"Jl. Halim Perdana Kusuma No 144, Kota Tangerang, Banten",Kota Tangerang,Banten
"Jl. Gatot Subroto KM 3.5  Cibodas Tangerang , Banten",Kota Tangerang,Banten
"Jl. Hasyim Ashari, Pinang, Cipondoh, Tangerang, Banten",Kota Tangerang,Banten
"Jl. Raya Cisoka, Perempatan Pasar Cisoka, Tangerang",Kabupaten Tangerang,Banten
"Jl. Raya Hos. Cokroaminoto Tangerang, Kota Tangerang, Banten",Kota Tangerang,Banten
"Jl. Inpres 6 No.31, RT.006/RW.001, Gaga, Kec. Larangan, Kota Tangerang, Banten 15154, Indonesia",Kota Cilegon,Banten
"Jalan Raya Tigaraksa - Tangerang, Kabupaten Tangerang, Banten",Kabupaten Tangerang,Banten
Jl. Raya Padjajaran Kel. Pamulang Barat Kec Pamulang,Kota Tangerang Selatan,Banten
"Jl. Kh.Wahid Hasyim Pd. Karya, Jurang Manggu Tim., Kec. Pd. Aren, Kota Tangerang Selatan",Kota Tangerang Selatan,Banten
Jl. Otista Cimanggis Rt 01/10 Kel Ciputat Kec Ciputat Tangerang Selatan,Kota Tangerang Selatan,Banten
"Jl. Bintaro Utama 3A, Pondok Ranji, Ciputat Timur, Pd. Ranji, Kec. Ciputat Tim., Kota Tangerang Selatan",Kota Tangerang Selatan,Banten
Jl Kh Dewantoro Rt 002 Rw 004 Sawah Ciputat Tangerang,Kota Tangerang Selatan,Banten
"Jl. Siliwangi No.50, Pondok Benda, Pamulang, Pd. Benda, Kec. Pamulang, Kota Tangerang Selatan",Kota Tangerang Selatan,Banten
Ruko The Icon Horison Broadway Blok M.2 No.27 Eks Ruko The Icon Horizon Broadway Blok M. 3 No. 2 Ds. Sampora Kec. Cisauk Kab. Tangerang,Kota Tangerang Selatan,Banten
Jl. Graha Raya Bintaro Jaya Blok GR. 9 Kav No. 37 Rt 11 Rw 07 Kel. Pdk Kacang Barat Kec. Pondok Aren,Kota Tangerang Selatan,Banten
"Jl. Lingkar Simpang 3 Jambe Rt01/02, Jambe, Pasar Bar, Jambe - Tangerang",Kabupaten Tangerang,Banten
Arjuna Df.01 No.1 Villa Pamulang Rt.6/19 Eks Jl. Kavling Keuangan Rt.05 Kedaung Pamulang,Kota Tangerang Selatan,Banten
Ruko Golden Boulevard Blok Q No. 50 Bsd City Tangerang,Kabupaten Tangerang,Banten
"Jl. Raya Cisauk, Cisauk, Kec. Cisauk, Tangerang, Banten",Kabupaten Lebak,Banten
"Jl. Raya Ps. Jengkol No.24, Rt.4/Rw.1, Babakan, Kec. Setu, Kota Tangerang Selatan",Kota Tangerang Selatan,Banten
"Bona Raya, Panunggangan Utara, Pinang, Kota Tangerang, Banten 15143",Kota Tangerang Selatan,Banten
"Jl. Merpati Raya No.87, Sawah Lama, Kec. Ciputat, Kota Tangerang Selatan",Kota Tangerang Selatan,Banten
Jl Australia II Warnasari Kec Citangkil Kota Cilegon - Banten,Kota Cilegon,Banten
"Jl Raya Cikande Rangkas Km 5, Kp Paarakan Rt 05 Rw 02, Kel Parakan Kec Jawlan, Kab Serang 42177",Kabupaten Serang,Banten
"Jl. Ciater Raya Bsd Tangerang Selatan, Rw. Mekar Jaya, Kec. Serpong, Kota Tangerang Selatan",Kota Tangerang Selatan,Banten
"Bintaro Sektor 3, Blok B3/Aq-01 Kel. Pondok Betung Kec. Pondok Aren",Kota Tangerang Selatan,Banten
"Jl. Raya Cisauk Lapan Kp.Rancamas Rt.002 Rw.004, Banten",Kota Tangerang Selatan,Banten
"Jl. Merpati Raya No.65, Rt.4/Rw.3, Sawah Lama, Kec. Ciputat, Kota Tangerang Selatan",Kota Tangerang Selatan,Banten
"Jl. Pondok Benda Raya Blok F8 No:18 Tangerang, Banten",Kota Tangerang Selatan,Banten
"Jl. Kebayoran Residences, Bintaro Jaya Sektor 7, Pondok Jaya, Pondok Aren Tagerang Selatan",Kota Tangerang Selatan,Banten
"Jl Raya Pandeglang, Sempu, Cipare, Cipare, Kec. Serang, Kota Serang, Banten",Kota Serang,Banten
Jl. Pulorida No.1 RT 03 RW 01 Lebak gede Pulomerak,Kota Cilegon,Banten
"Jl. Raya Siliwangi No.1A Pondok Benda, Benda Baru, Kec. Pamulang, Kota Tangerang Selatan, Banten",Kota Tangerang Selatan,Banten
"Blok R 01, Jl. Citra Raya Boulevard No. 01, Ciakar Citraraya, Tangerang banten 15710",Kabupaten Tangerang,Banten
"Bintaro Jaya Cbd, Jl. HR Rasuna Said No.A5-08, Pd. Jaya, Kec. Pd. Aren, Kota Tangerang Selatan",Kota Tangerang Selatan,Banten
Jl. Kampung leles Rt.004.Rw 006 kel. Sindang sari kec. Pasar kemis Tangerang,Kabupaten Tangerang,Banten
JL. BENTENG BETAWI RT. 04 RW. 03 KEL. PORIS PLAWAD KEC. CIPONDOH KOTA TANGERANG,Kota Tangerang,Banten
"Cbd Emerald Blok Ce/C, Jl. Boulevard Bintaro Jaya No.1, Parigi, Kec. Pd. Aren, Kota Tangerang Selatan, Banten 15227",Kota Tangerang Selatan,Banten
"Perum Keroncong, Jl. Prabu Kian Santang, Rt.001/Rw.003, Keroncong, Kec. Jatiuwung",Kota Tangerang,Banten
"Perum Keroncong, Jl. Prabu Kian Santang, Keroncong, Jatiuwung, Kota Tangerang, Banten 15134",Kota Tangerang,Banten
Kompleks Bandara Soekarno-Hatta Cengkareng Jakarta,Kota Tangerang,Banten
"Jl. Mutiara Pluit Utama Blok E1 No.4, Periuk, Tangerang City, Banten 15131",Kota Tangerang,Banten
"Jl. Raden Saleh No. 37, Karang Tengah, Ciledug, Banten",Kota Tangerang,Banten
"Jl. Surya Kencana No.1, Pamulang Bar., Kec. Pamulang, Kota Tangerang Selatan",Kota Tangerang Selatan,Banten
"Rest Area Jl Tol Jakarta - Merak Km 68 Tangerang, Banten",Kota Serang,Banten
"rtc, Cimuncang, Kec. Serang, Kota Serang, Banten 42111, Indonesia",Kota Serang,Banten
"Jl. Raya jakarta Nambo ilir Kec. Kibin Serang, Banten",Kota Serang,Banten
"Jl. Raya Serang - Jkt No.16, Panancangan, Cipocok Jaya, Kota Serang, Banten 42124",Kota Serang,Banten
"Jalan Jend. Sudirman No. 1, Babakan, Tangerang, Babakan, Kec. Tangerang, Kota Tangerang, Banten 15117",Kota Tangerang,Banten
"Jalan Cengkareng Golf Club, Pajang, Benda, Pajang, Benda, Kota Tangerang, Banten 15126",Kota Tangerang,Banten
"Kp. Pasir Rt. 01/02 Kel. Pasir Jaya Kec. Jatiuwung, Pasir Jaya, Tangerang, Tangerang City, Banten 15135",Kota Tangerang,Banten
"Jl. Mohammad Toha Km. 5,6 No.14 Pasar Kemis Periuk Kota Tangerang",Kota Tangerang,Banten
"Jl. Pondok Kacang Rt. 003/003 Tajur Ciledug, Banten",Kota Tangerang,Banten
"Jl. Oscar Raya Blok Bl19/F No.1, Rt.5/Rw.2, Bambu Apus, Pamulang, Kota Tangerang Selatan, Banten 15415",Kota Tangerang Selatan,Banten
"Jl Boulevard Graha Raya ( Ruko Valencia Arcade ) Kel Paku Jaya, Kec Serpong Utara, Tangerang Selatan, 15324",Kota Tangerang Selatan,Banten
Komplek Ruko Regia 1 Blok Rb No 16-17 Kec Pondok Aren,Kota Tangerang Selatan,Banten
"Jl. Ciledug Raya No. 77, Kav. 1-2, Ciledug, Kreo, Larangan",Kota Tangerang,Banten
"Jl. Cendrawasih Raya No.78, Sawah Baru, Kec. Ciputat, Kota Tangerang Selatan",Kota Tangerang Selatan,Banten
"Jl. Kh Hasyim Anshari No 18 Ciledug, Kota Tangerang, Banten",Kota Tangerang,Banten
"Jl. Bsd Raya Utama, Desa Sampora, Kec. Cisauk, Kec. Tangerang, Banten",Kabupaten Tangerang,Banten
"Jl. Jalur Sutera Bar. No.3, Panunggangan Tim., Pinang",Kota Tangerang Selatan,Banten
Jl. Kby Utama No.13B Rt.02/09 Paku Jaya Kec. Serpong Utara,Kota Tangerang Selatan,Banten
"Jl. Raden Saleh No.5C, Rt.8/Rw.10, Karang Tengah, Kec. Karang Tengah, Kota Tangerang",Kota Tangerang,Banten
"Jl. Sayabulu No.15, Serang, Kec. Serang, Kota Serang, Banten",Kota Serang,Banten
"Pasar Tambak Jaya, Kibin, Tambak, Kec. Kibin, Serang, Banten",Kabupaten Serang,Banten
"Susukan, Tirtayasa, Serang, Banten 42193, Indonesia",Kota Cilegon,Banten
"Jl. Raya Prabu Siliwangi Km.1,1, Pasar Kemis, Tangerang",Kota Tangerang,Banten
"Jl. Prabu Siliwangi Desa No.Km, Rt.002/Rw.1, Alam Jaya, Kec. Jatiuwung, Kota Tangerang, Banten",Kota Tangerang,Banten
"Jl.kh soleh ali no:03 rt 002/009, RT.003/RW.002, Sukasari, Kec. Tangerang, Kota Tangerang, Banten 15118, Indonesia",Kota Tangerang,Banten
"RT.003/RW.017, Cibodasari, Cibodas, Tangerang City, Banten",Kota Tangerang,Banten
"Jl. Aria Putra No.30, Serua Indah, Kec. Ciputat, Kota Tangerang Selatan",Kota Tangerang Selatan,Banten
"Cilegon, Ramanuju, Purwakarta, Cilegon City, Banten",Kota Cilegon,Banten
"Jl. Jombang Raya No.37, Jombang, Kec. Ciputat, Kota Tangerang Selatan",Kabupaten Lebak,Banten
"Talagasari, Kec. Balaraja Tangerang Banten 15610, Banten",Kabupaten Tangerang,Banten
"Jl. Raya Legok - Karawaci No.20, Medang, Pagedangan, Tangerang, Banten 15810",Kabupaten Tangerang,Banten
"Komplek Grand Catania, Citra Raya, Tangerang, Banten",Kabupaten Tangerang,Banten
"Kp. Sindang Sari Pasar Kemis Jl. Raya Cadas, Banten",Kabupaten Tangerang,Banten
"Jl. Beringin 4 21-20, RT.003/RW.005, Periuk Jaya, Kec. Periuk, Kota Tangerang, Banten 15131",Kota Tangerang,Banten
"Jl. Barata Raya No.3, RT.004/RW.007, Karang Tengah, Kec. Karang Tengah, Kota Tangerang, Banten 15157",Kota Tangerang,Banten
"Kronjo  Tugu Pulo Cangkir , Kabupaten Tangerang, Banten",Kabupaten Tangerang,Banten
"Jl. Ceger Raya - Pondok Aren Rw 01 Pondok Karya Kec. Pondok Aren, Tangerang Selatan",Kota Tangerang Selatan,Banten
"Ruko Arinda Permai I B.5, Pondok Aren, Pondok Aren, Pd. Aren, Tangerang, Kota Tangerang Selatan",Kota Tangerang Selatan,Banten
"Jl. Ceger Raya No.48, Rt. 01/Rw.011, Jurangmangu Baru, Pondok Aren, Tangerang.15224",Kota Tangerang Selatan,Banten
"Jl. Buaran-Bsd, Buaran, Serpong, Kota Tangerang Selatan, Banten 15310",Kota Tangerang Selatan,Banten
JL. Raya Curug Rt002/004 Curug Kulon Suka Bakti Tangerang Banten 15810,Kabupaten Tangerang,Banten
"Jl. Industri Raya II, RT.005/RW.004, Pasir Jaya, Kec. Jatiuwung, Kota Tangerang, Banten 15135",Kota Tangerang,Banten
"Jl. Maulana Yusuf Rt. 03 Rw. 02 Tegal Cabe, Taman Baru, Kec. Cilegon, Kota Cilegon, Banten 42441",Kota Cilegon,Banten
"Jl. Puri Citra, Pipitan, Kec. Walantaka, Kota Serang, Banten 42183, Indonesia",Kabupaten Serang,Banten
"Kibin, Kec. Kibin, Serang, Banten 42185, Indonesia",Kota Tangerang,Banten
"Jl. Raya Rangkasbitung Pandeglang No.10, Cibuah, Kec. Warunggunung, Kabupaten Lebak, Banten 42352, Indonesia",Kabupaten Pandeglang,Banten
Jl. Raya Serang Kel Tambak (  Halaman Utama Pt Nikkomas),Kabupaten Serang,Banten
"Jl. Raya Karangantu Km 5 Kasemen Serang, Banten",Kota Serang,Banten
"Jl. Raya Bintaro Sektor 9, Pondok Pucung, Pondok Aren, Pd. Pucung, Kec. Pd. Aren, Kota Tangerang Selatan",Kota Tangerang Selatan,Banten
"Jl. R.E. Martadinata No.30, Ciputat, Kota Tangerang Selatan, Banten 15411",Kota Tangerang Selatan,Banten
"Jl. Raya Anyer, Ciwandan Cilegon, Kota Serang, Banten",Kota Serang,Banten
"Komplek Perum Kelapa Dua, Tangerang, Kabupaten Tangerang, Banten",Kabupaten Tangerang,Banten
"Jl. Prof. Dr. Hamka No.24, Rt.005/Rw.001, Larangan Sel., Kec. Larangan, Kota Tangerang, Banten 15154",Kota Tangerang,Banten
"Jl. Kyai Maja, Samping Tifico, Cipete, Tangerang, Banten",Kota Tangerang,Banten
"Jl. Chairil Anwar, Ciledug, Tangerang, Kota Tangerang, Banten",Kota Tangerang,Banten
"Jl. Raya Kresek Balaraja, Ds. Caringin, Balaraja, Tangerang",Kabupaten Tangerang,Banten
"JL Curug Wetan No. 10 Suka Bakti, Kec. Curug, Tangerang, Banten",Kota Tangerang,Banten
"Jl. Mt Haryono Rt.03/02, Tangerang, Kabupaten Tangerang, Banten",Kabupaten Tangerang,Banten
"Terminal Kedatangan 1A Bandara Soekarno Hatta, Pajang, Tangerang, Tangerang City, Banten 19120",Kota Tangerang,Banten
"Kampung Rawa Rumpang Rt.002/001, Salembaran Jati, Banten",Kota Tangerang,Banten
"Kampung Kedaung Barat Rt.03/02 Pertigaan Kedaung, Sepatan Timur, Tangerang",Kabupaten Tangerang,Banten
"Jalan Garuda Blok F 9 No. 12 A  14 Perum Bumi Cibeber Kencana, Cilegon 42423",Kota Cilegon,Banten
"Jl. Sunan Kalijaga No.229, Muara Ciujung Tim., Kec. Rangkasbitung, Kabupaten Lebak, Banten",Kabupaten Lebak,Banten
"Warung Jaud, Rt. 01, Rw. 01, Desa Kaligandu, Kec. Serang, Serang",Kabupaten Serang,Banten
"Jl. Raya Taktakan, Panggungjati, Kec. Taktakan, Kota Serang, Banten",Kota Serang,Banten
"Jl. Dr Sutomo Ciledug, Tangerang, Kota Tangerang, Banten",Kota Tangerang,Banten
"Jl. Aria Santika Tigaraksa, Tangerang, Kabupaten Tangerang, Banten",Kabupaten Tangerang,Banten
"Jl Raya Cadas, Rt 01Rw 01, Pisangan Jaya, Sepatan, Karet, Tangerang, Banten",Kota Tangerang,Banten
"Jl. Palem Raya, Perumnas, Tangerang, Kota Tangerang, Banten",Kota Tangerang,Banten
"Jl. Raya Serang Balaraja, Tangerang, Kabupaten Tangerang, Banten",Kabupaten Tangerang,Banten
"Jl. Yos Sudarso, Batuceper, Tangerang, Kota Tangerang, Banten",Kota Tangerang,Banten
"Jl. Raya Mauk Km.10 Kp. Sepatan Sulang, Ds. Pondok Jaya, Tangerang",Kabupaten Tangerang,Banten
Jl. Ciater Raya Rt 04/09 Serpong Tangerang Selatan,Kota Tangerang Selatan,Banten
"Apartement City Light, Jl. Ir H. Juanda, Cemp. Putih, Kec. Ciputat Tim., Kota Tangerang Selatan, Banten 15412",Kota Tangerang Selatan,Banten
"Jl. Kav. Keuangan I A No.99, Kedaung, Kec. Pamulang, Kota Tangerang Selatan, Banten 15415",Kota Tangerang Selatan,Banten
Jl. Sukakarya Kp. Buaran Rt. 007 Rw. 002 Sarua Ciputat,Kota Tangerang Selatan,Banten
"Jl. Pahlawan Seribu, Lengkong Gudang, Serpong Tangerang Selatan",Kota Tangerang Selatan,Banten
"Jl Jombang Raya No 5-6 Rt 04/02 Jombang Ciputat, Tangerang Selatan",Kota Tangerang Selatan,Banten
Jl. Kalimantan Raya Blok D1 No. 12 Eks Jl. Taman Makam Bahagia Abri Rt.001 Rw007,Kota Tangerang Selatan,Banten
"Jl. Merpati Raya No.2, Rt.3/Rw.1, Sawah Baru, Kec. Ciputat, Kota Tangerang Selatan",Kota Tangerang Selatan,Banten
"Jl. Jelupang, Bumi Serpong Damai, Jelupang, Tangerang Selatan, Banten",Kota Tangerang Selatan,Banten
"Jl. Ombang No.58-60, Pondok Aren, Pd. Pucung, Kec. Pd. Aren, Kota Tangerang Selatan",Kota Tangerang Selatan,Banten
"Kav Commercial International School Ii No 8 Bsd City, Jalan Sekolah Foresta, Bsd City, Lengkong Kulon, Pagedangan, Lengkong Kulon, Pagedangan, Tang",Kabupaten Tangerang,Banten
Jl. Raya Anyar Km 121 Ciwandan Kota Cilegon - Banten,Kota Cilegon,Banten
"Jl. Moh. Toha 10, Pondok Cabe Udik, Tangerang, Banten",Kota Tangerang Selatan,Banten
"Jl. Bhayangkara, Paku Jaya, Serpong, Tangerang, Banten",Kota Tangerang Selatan,Banten
"Jl. Dr. Prof. Ir. Sutami Kampung Malangnengah, Cijoro Pasir, Rangkas Bitung, Mekarsari, Maja, Lebak Regency, Banten 42381, Indonesia",Kabupaten Lebak,Banten
"Jl. C3 No.601, RT.001/RW.010, Pajang, Benda, Kota Tangerang, Banten 15126, Indonesia",Kota Tangerang,Banten
"Jl. Pahlawan Seribu No.2, Rt.6/Rw.4, Lengkong Gudang, Kec. Serpong, Kota Tangerang Selatan",Kota Tangerang Selatan,Banten
Perumahan The Green Bsd Blok B7 No. 7 Eks Lawson Sektor 5,Kota Tangerang Selatan,Banten
"Jl. Bintaro Permai No.5, Rt.7/Rw.3, Pesanggrahan, Kota Jakarta Selatan, Dki Jakarta 12320",Kota Tangerang Selatan,Banten
Jl. Rawa Lele Rt 003 Rw06 Kel. Jombang Tangerang Selatan,Kota Tangerang Selatan,Banten
Jl. Jombang Raya Rt 03 Rw 13 No. 48 Ciputat Tangerang 15414,Kota Tangerang Selatan,Banten
"Jalan Graha Bintaro, GR 9 NO 37, Pd. Kacang Bar., Kec. Pd. Aren, Kota Tangerang Selatan, Banten 15226, Indonesia",Kota Tangerang Selatan,Banten
Jl. Panti Asuhan No. 120 Kel. Jurang Mangu Timur Kec Pd. Aren Tangerang Selatan,Kota Tangerang Selatan,Banten
"Jl. Boulevard Bsd Tim., Rw. Buntu, Kec. Serpong, Kota Tangerang Selatan",Kota Tangerang Selatan,Banten
"Jl. Ki Ajurum 29, Cipocok Jaya, Kec. Cipocok Jaya, Kota Serang, Banten",Kabupaten Serang,Banten
"Jalan Pahlawan Raya No. 11 Rt. 5 / Rw. 3, Rempoa, Ciputat Timur, Rempoa, Kec. Ciputat Tim., Kota Tangerang Selatan, Banten 15412",Kota Tangerang Selatan,Banten
"Tng Ml Galri Pl Ps Modrn - Tangerang, Kabupaten Tangerang, Banten",Kabupaten Tangerang,Banten
"Perum Persada Raya Gembor Periuk Jayatangerang, Banten - 15133",Kota Tangerang,Banten
"Jalan Raya Serang - Jakarta KM. 65, Julang, Serang, Julang, Kec. Cikande, Serang, Banten 42185, Indonesia",Kabupaten Serang,Banten
"Jl Rumah Sakit, Desa Tobat, Balaraja, Banten, Banten",Kabupaten Tangerang,Banten
"JL. SERANG - JAKARTA KM. 65, JULANG, SERANG, JULANG, KEC. CIKANDE",Kabupaten Serang,Banten
"Jl Raya Pasar Kemis Km 6 - Tangerang, Kabupaten Tangerang, Banten",Kabupaten Tangerang,Banten
"Jl. Nanas Raya Perumnas 1, Tangerang, Kota Tangerang, Banten",Kota Tangerang,Banten
"Jalan Cilegon - Serang, Taktakan, Taman Baru, Kec. Serang, Banten, 42162",Kota Serang,Banten
"Jl. Raya Regency, Rt.005/Rw.006, Gembor, Kec. Periuk, Kota Tangerang, Banten",Kota Tangerang,Banten
