"Jl. Cirendeu Raya, Pertokoan Prima Indah No. 10, Banten",Kota Tangerang Selatan,Banten
"Ruko Itc Bsd No.17, Jl. Pahlawan Seribu, Serpong 15322",Kota Tangerang Selatan,Banten
"Ruko Itc Bsd No.17, Jl. Pahlawan Seribu, Serpong, Banten",Kota Tangerang Selatan,Banten
"Ruko Itc Bsd No 17-18 Bsd Tangerang Selatan, Banten",Kota Tangerang Selatan,Banten
"Jl. Kisamaun No..214, Rt.004/Rw.001, Babakan, Kec. Tangerang, Kota Tangerang, Banten 15118",Kota Tangerang,Banten
"Jl. Kisamaun No..214, RT.004/RW.001, Babakan, Kec. Tangerang, Kota Tangerang, Banten 15118, Indonesia",Kota Tangerang,Banten
"Jl. Kisamaun No..214, RT.004/RW.001, Babakan, Kec. Tangerang, Kota Tangerang, Banten 15118, Indonesia",Kota Tangerang,Banten
"Jl. Perintis Kemerdekaan No.36, RT.004/RW.001, Babakan, Kec. Tangerang, Kota Tangerang, Banten 15118, Indonesia",Kota Tangerang,Banten
"Jl. Ruko Pinangsia Blok L No. 7, Lippo Karawaci, Banten",Kota Tangerang,Banten
"Ruko Pinangsia Blok A No. 39, Lippo Karawaci, Tangerang, Panunggangan Barat, Cibodas, Rt.001/Rw.009, Panunggangan Bar., Kec. Cibodas,",Kota Tangerang,Banten
"Tangerang, Rt.005/Rw.005, Babakan, Tangerang, Tangerang City, Banten",Kota Tangerang,Banten
"Jl. Jend. Sudirman, Ruko Tangerang City Blok A-8 Cikokol",Kota Tangerang,Banten
"Ruko Business Park Tangerang City Blok A.8, Jl. Jenderal Sudirman No.1, Rt.005/Rw.005, Babakan, Kec. Tangerang, Kota Tangerang, Banten",Kota Tangerang,Banten
"Jl. Daan Mogot No.32D, RT.003/RW.004, Sukarasa, Kec. Tangerang, Kota Tangerang, Banten 15111, Indonesia",Kota Tangerang,Banten
"Jl. Daan Mogot, Wijaya Kusuma, Grogol Petamburan, Banten",Kota Tangerang,Banten
"Jl. Daan Mogot No.32D, RT.003/RW.004, Sukarasa, Kec. Tangerang, Kota Tangerang, Banten 15111, Indonesia",Kota Tangerang,Banten
"Ruko Duta Garden Blok A1 No 7A, Jl Husin Sastranegara",Kota Tangerang,Banten
"Ruko Duta Garden, Jl. Husen Sastra Negara, Rt.001/Rw.008, Jurumudi Baru, Benda, Kota Tangerang, Banten",Kota Tangerang,Banten
"Komp. Cbd Ciledug Ruko D2 No 6-7 Jl. Hos Cokroaminoto No. 93, Ciledug",Kota Tangerang,Banten
"Komp. Cbd Ciledug Ruko D2 No 6-7 Jl. Hos Cokroaminoto No. 93, Ciledug",Kota Tangerang,Banten
"Jl. Hos Cokroaminoto No. 93, Ciledug, Komp. Cbd Ciledug Ruko D2 No 6-7, Rt.001/Rw.001, Karang Tengah, Tangerang, Kota Tangerang, Banten",Kota Tangerang,Banten
"Pertokoan Bumi Permata Indah Blok R 1 No. 23, Jl. Raden Saleh, Karang Tengah, Ciledug",Kota Tangerang,Banten
Jl. Raden Saleh Ruko Bumi Permata Indah Blok R1 No. 23 Karang Tengah - Tangerang,Kota Tangerang,Banten
"Jl. Poris Paradise Eksklusif No.C7/15, Rt.003/Rw.003, Poris Gaga, Kec. Batuceper, Kota Tangerang",Kota Tangerang,Banten
"Jl. Poris Paradise Exclusive Blok C2 No. 1, Banten",Kota Tangerang,Banten
"JL.KH.HASYIM ASHARI PORIS PLAWAD UTARA, Kota Tangerang, Banten",Kota Tangerang,Banten
"Jl. Raya Cipondoh Kota Tangerang, Kota Tangerang, Banten",Kota Tangerang,Banten
"Jl. Kh Hasyim Ashari No.27D & 27E, Cipondoh, Tangerang",Kota Tangerang,Banten
"Jl. Kh Hasyim Ashari 26-32, Rt.003/Rw.001, Poris Plawad Utara, Kec. Cipondoh, Kota Tangerang, Banten 15141",Kota Tangerang,Banten
"Bandara Soekarno-Hatta, Pajang, Benda, Kota Tangerang, Banten 15118",Kota Tangerang,Banten
"Bandara Soekarno-Hatta, Cargo Area Gedung 501, Benda",Kota Tangerang,Banten
"Bandara Soekarno Hatta Cargo Area Gd 501, Kota Jakarta Barat, Dki Jakarta - 19101",Kota Tangerang,Banten
"Bandara Soekarno-Hatta, Gedung 601, Kota Tangerang, Banten",Kota Tangerang,Banten
"Perkantoran Garuda Sentra Operasi Bandara Soekarno Hatta, Neglasari Kota Tangerang",Kota Tangerang,Banten
Kawasan Pergudangan Mutiara Kosambi 2 Blok A No.11,Kota Tangerang,Banten
Jl Raya Perancis Ruko Mutiara Kosambi Blok A No 10-11 Kosambi,Kota Tangerang,Banten
Jl Raya Perancis Ruko Mutiara Kosambi Blok A No 10-11 Kosambi,Kota Tangerang,Banten
"Jl. Perancis Blok A1 No.3, Benda, Kota Tangerang, Banten",Kota Tangerang,Banten
"Ruko Blvd Business Center - Jatake Blok A No. 12, Jl. Gatot Soebroto Km 5,3, Gandasari",Kota Tangerang,Banten
"Ruko Blvd Business Center - Jatake Blok A No. 12, Jl. Gatot Soebroto Km 5,3",Kota Tangerang,Banten
"Ruko Madrid, Jalan Palem Raya No.39, Rt.001/Rw.004, Panunggangan Bar., Kec. Cibodas, Kota Tangerang, Banten 15138",Kota Tangerang,Banten
"Ruko Madrid No. 38-39 Jl. Palem Raja I, Palem Semi - Tangerang",Kota Tangerang,Banten
"Jl. Marsekal Suryadharma, Ruko Millenium, No. 3.B, Banten",Kota Tangerang,Banten
"Jl. Raya Mauk 6, Rt.001/Rw.008, Margasari, Kec. Karawaci, Kota Tangerang, Banten 15114",Kota Tangerang,Banten
"Jl. Poris Indah Raya, Cipondoh Indah, Kec. Cipondoh, Kota Tangerang, Banten 15148",Kota Tangerang,Banten
"Jl. Prabu Kian Santang, Sangiang Jaya, Periuk, Kota Tangerang, Banten 15132",Kota Tangerang,Banten
"Taman Prestasi, Sukaasih, Kec. Tangerang, Kota Tangerang, Banten, Indonesia",Kota Tangerang,Banten
"Taman Prestasi, Sukaasih, Kec. Tangerang, Kota Tangerang, Banten, Indonesia",Kota Cilegon,Banten
"Jl. Jend. Ahmad Yani No. 9 Tangerang, Kota Tangerang, Banten",Kota Tangerang,Banten
"Jl. Jend. Ahmad Yani No.26, RT.005/RW.005, Sukarasa, Kec. Tangerang, Kota Tangerang, Banten 15111, Indonesia",Kota Tangerang,Banten
"Jl. Jend. Ahmad Yani No.15, Rt.002/Rw.001, Sukaasih, Kec. Tangerang, Kota Tangerang, Banten 15111",Kota Tangerang,Banten
"Jl. Jend. Ahmad Yani No.15, Rt.002/Rw.001, Sukaasih, Kec. Tangerang, Kota Tangerang, Banten 15111",Kota Tangerang,Banten
"Jl. Merdeka Raya Kota Tangerang, Kota Tangerang, Banten",Kota Tangerang,Banten
"Jl. Kh. Hasyim Ashari, Ruko Green Village Blok A 8, Kel. Neroktog, Kec. Pinang,",Kota Tangerang,Banten
"Wisma Tigris, Jl. Batu Ceper No. 19 Def, Banten",Kota Tangerang,Banten
"Ruko Mahkota Mas Blok C No. J4 - J5, Cikokol, Banten",Kota Tangerang,Banten
"Mahkota Mas Blok C / 14-15, Cikokol, Kota Tangerang, Banten",Kota Tangerang,Banten
"Jl. Hos Cokroaminoto, Rt.003/Rw.001, Kreo, Kec. Larangan, Kota Tangerang, Banten",Kota Tangerang,Banten
"Jl. Atang Sanjaya  Rawa Bokor Kota Tangerang, Banten",Kota Tangerang,Banten
Jl.Jend.Sudirman Kav. B7/A1-03 Cbd Bintaro Jaya Sektor 7,Kota Tangerang Selatan,Banten
"Jl. Bintaro Utama 3A Blok D No. 42-43, Sektor Iii, Bintaro Jaya",Kota Tangerang Selatan,Banten
Jl.Jend.Sudirman Kav. B7/A1-03 Cbd Bintaro Jaya Sektor 7,Kota Tangerang Selatan,Banten
"Kota Taman Bintaro Jaya A1-03, Blok B7, Jl. Bintaro Utama Raya Sektor Vii, Bintaro Jaya, Tangerang Selatan",Kota Tangerang Selatan,Banten
"Jl Jend. Sudirman Kav B7, A1-3 Cbd Bintaro Sektor 7, Tangerang Selatan",Kota Tangerang Selatan,Banten
Jl.Jend.Sudirman Kav. B7/A1-03 Cbd Bintaro Jaya Sektor 7,Kota Tangerang Selatan,Banten
"Jalan Raya Puspiptek No66, Rt 11 / Rw 03, , Desa Setu, Kecamatan Setu, Tangerang Selatan 15310",Kota Tangerang Selatan,Banten
"Jl. Red Diamond III No.22, Jelupang, Kec. Serpong Utara, Kota Tangerang Selatan, Banten 15323, Indonesia",Kota Tangerang Selatan,Banten
"Jl Raya Puspitek No 66 Rt 11 Rw 03 Kel Setu, Serpong, Tangerang",Kota Tangerang Selatan,Banten
"Ruko Villa Melati Mas Blok Sr1 No. 20, Jl. Pahlawan Seribu, Serpong",Kota Tangerang Selatan,Banten
"Ruko Villa Melati Mas Blok Sr1 No. 20, Jl. Pahlawan Seribu, Serpong",Kota Tangerang Selatan,Banten
"Jl. Villa Melati Mas Raya No.12A, Lengkong Karya, Kec. Serpong Utara, Kota Tangerang Selatan, Banten 15323",Kota Tangerang Selatan,Banten
"Rumah Sakit Eka Hospital Cbd Lot Ix Bsd City, Serpong",Kota Tangerang Selatan,Banten
"Rumah Sakit Eka Horpital Cbd Lot Ix Bsd City, Serpong",Kota Tangerang Selatan,Banten
"Ruko Tita, Jl. Raya Siliwangi No. 9 A, Pamulang, Banten",Kota Tangerang Selatan,Banten
"Ruko Tita, Jl. Raya Siliwangi No. 9 A, Pamulang, Banten",Kota Tangerang Selatan,Banten
"Jl.Cirendeu Raya Pertokoan Prima Indah  No.10, Banten",Kota Tangerang Selatan,Banten
"PERTOKOAN PRIMA INDAH NO 10 JL CIRENDEU RAYA, Banten",Kota Tangerang Selatan,Banten
"Jl. Ir H. Juanda No.95, Cemp. Putih, Kec. Ciputat, Kota Tangerang Selatan, Banten 15412",Kota Tangerang Selatan,Banten
"Jl Ir Juanda No 95 Ciputat Tangerang, Kota Tangerang Selatan, Banten",Kota Tangerang Selatan,Banten
"Jl. Ir. H. Juanda No. 64, Ciputat, Kota Tangerang Selatan, Banten",Kota Tangerang Selatan,Banten
"Jl. Ir.H. Juanda No.64, Ciputat Tangerang Selatan 15412",Kota Tangerang Selatan,Banten
"Jl. Ciputat Raya, Rw.2, Cireundeu, Kec. Ciputat Tim., Kota Tangerang Selatan, Banten 15412",Kota Tangerang Selatan,Banten
"Pertokoan Ciputat Center, Jl. Ciputat Raya No. 75 Tangerang",Kota Tangerang Selatan,Banten
"Jl. Ciputat Raya, Rw.2, Cireundeu, Kec. Ciputat Tim., Kota Tangerang Selatan, Banten 15412",Kota Tangerang Selatan,Banten
"Jl. Alam Sutera Boulevard, Pakulonan, Kec. Serpong Utara, Kota Tangerang Selatan, Banten 15325",Kota Tangerang Selatan,Banten
"Jl. Alam Sutera Boulevard, Pakulonan, Kec. Serpong Utara, Kota Tangerang Selatan, Banten 15325",Kota Tangerang Selatan,Banten
"Jl. Alam Sutera Boulevard, Pakulonan, Kec. Serpong Utara, Kota Tangerang Selatan, Banten 15325",Kota Tangerang Selatan,Banten
"Ruko Sutera Niaga I No. 71, Jl. Raya Serpong, Banten",Kota Tangerang Selatan,Banten
"Ruko Sutera Niaga I No. 71, Jl. Raya Serpong, Banten",Kota Tangerang Selatan,Banten
"Ruko Jalur Sutra Blok 29A/ No.7-10, Paku Alam, Serpong",Kota Tangerang Selatan,Banten
"Komplek Pertokoan Pamulang Permai Blok. Sh Ix Kav. 11-14, Pamulang Barat, Pamulang, Pamulang Bar., Kec. Pamulang, Kota Tangerang Selatan, Bante",Kota Tangerang Selatan,Banten
"Komplek Pertokoan Pamulang Permai Blok. Sh Ix Kav. 11-14, Pamulang Barat, Pamulang, Pamulang Bar., Kec. Pamulang, Kota Tangerang Selatan, Bante",Kota Tangerang Selatan,Banten
"Komplek Pertokoan Pamulang Permai Blok. Sh Ix Kav. 11-14, Pamulang Barat, Pamulang, Pamulang Bar., Kec. Pamulang, Kota Tangerang Selatan, Bante",Kota Tangerang Selatan,Banten
"Komplek Pertokoan Pamulang Permai Blok. Sh Ix Kav. 11-14, Pamulang Barat, Pamulang, Pamulang Bar., Kec. Pamulang, Kota Tangerang Selatan, Bante",Kota Tangerang Selatan,Banten
"Komplek Pertokoan Pamulang Permai Blok. Sh Ix Kav. 11-14, Pamulang Barat, Pamulang, Pamulang Bar., Kec. Pamulang, Kota Tangerang Selatan, Bante",Kota Tangerang Selatan,Banten
"Komplek Pertokoan Pamulang Permai Blok. Sh Ix Kav. 11-14, Pamulang Barat, Pamulang, Pamulang Bar., Kec. Pamulang, Kota Tangerang Selatan, Bante",Kota Tangerang Selatan,Banten
"Komp Ptkoan Pamulang Permai Blok Sh Ix Tgr, Banten",Kota Tangerang Selatan,Banten
"Jl. Jalur Sutera Kav. 29D, Alam Sutera, Serpong, Kec. Serpong, Tangerang, Banten 15314",Kota Tangerang Selatan,Banten
"Jl Jalur Sutera Kav 29D No 58, Alam Sutera, Tangerang",Kota Tangerang Selatan,Banten
"Jl. Burung Gereja Blok B2 Hs 2 No.6, Sektor Ii, Bintaro Jaya, Rengas, Ciputat Timur, Rengas, Tangerang, Kota Tangerang Selatan, Banten 15412",Kota Tangerang Selatan,Banten
"Jl. Burung Gereja Blok B2 Hs 2 No.6, Sektor Ii, Bintaro Jaya, Rengas, Ciputat Timur, Rengas, Tangerang, Kota Tangerang Selatan, Banten 15412",Kota Tangerang Selatan,Banten
"Jl. Burung Gereja Blok B2 Hs 2 No.6, Sektor Ii, Bintaro Jaya, Rengas, Ciputat Timur, Rengas, Tangerang, Kota Tangerang Selatan, Banten 15412",Kota Tangerang Selatan,Banten
"Ruko Tol Boulevard, Blok G, Jl. Raya Rawa Buntu No.16, Rw. Buntu, Kec. Serpong, Kota Tangerang Selatan, Banten 15310",Kota Tangerang Selatan,Banten
"Ruko Tol Boulevard, Blok G, Jl. Raya Rawa Buntu No.16, Rw. Buntu, Kec. Serpong, Kota Tangerang Selatan, Banten 15310",Kota Tangerang Selatan,Banten
Bsd Pasar Segar Graha Raya Bintaro Blok Ra 1 No. 1-2 Jl. Graha Bunga Raya Tangerang,Kota Tangerang Selatan,Banten
"Graha Bintaro Jl. Trulek I Hg 13, Jl. Jalak Bali I No.18, Pd. Kacang Bar., Kec. Pd. Aren, Kota Tangerang Selatan, Banten 15226",Kota Tangerang Selatan,Banten
Bsd Pasar Segar Graha Raya Bintaro Blok Ra 1 No. 1-2 Jl. Graha Bunga Raya Tangerang,Kota Tangerang Selatan,Banten
"Graha Bintaro Jl. Trulek I Hg 13, Jl. Jalak Bali I No.18, Pd. Kacang Bar., Kec. Pd. Aren, Kota Tangerang Selatan, Banten 15226",Kota Tangerang Selatan,Banten
"Ruko Sentra Menteng, Bintaro Jaya, Sektor Vii Blok Mn 29, Pd. Jaya, Kec. Pd. Aren, Kota Tangerang Selatan, Banten 15220",Kota Tangerang Selatan,Banten
Jl.Jend.Sudirman Kav. B7/A1-03 Cbd Bintaro Jaya Sektor 7,Kota Tangerang Selatan,Banten
"Sunbrust Cbd Lot 1.2 Bsd City, Tangerang Selatan 15311",Kota Tangerang Selatan,Banten
"Sunbrust Cbd Lot 1.2 Bsd City, Tangerang Selatan 15311",Kota Tangerang Selatan,Banten
"Jl. Bintaro Utama 3 A Blok E/52, Sektor Iii, Banten",Kota Tangerang Selatan,Banten
Jl. Jend.Sudirman Kav. B7/A1-03 Cbd Bintaro Jaya Sektor 7,Kabupaten Lebak,Banten
"Jl. Bintaro Utama 3A Blok D No. 42-43, Sektor Iii, Bintaro Jaya",Kota Tangerang Selatan,Banten
"Ruko Citiwalk Blok A No.1, Jalan Pondok Cabe Raya, Pondok Cabe Udik, Pamulang, Pd. Cabe Udik, Kec. Pamulang, Kota Tangerang Selatan, Banten 154",Kota Tangerang Selatan,Banten
"Ruko Citiwalk Blok A No.1, Jalan Pondok Cabe Raya, Pondok Cabe Udik, Pamulang, Pd. Cabe Udik, Kec. Pamulang, Kota Tangerang Selatan, Banten 154",Kota Tangerang Selatan,Banten
"Ruko Citiwalk Blok A No.1, Jalan Pondok Cabe Raya, Pondok Cabe Udik, Pamulang, Pd. Cabe Udik, Kec. Pamulang, Kota Tangerang Selatan, Banten 154",Kota Tangerang Selatan,Banten
"Ruko Citiwalk Blok A No.1, Jalan Pondok Cabe Raya, Pondok Cabe Udik, Pamulang, Pd. Cabe Udik, Kec. Pamulang, Kota Tangerang Selatan, Banten 154",Kota Tangerang Selatan,Banten
"Jl. Raya Serpong No. 12 Rt 004 Rw 004,  Serpong, Banten",Kota Tangerang Selatan,Banten
"Ruko Mutiara Center Ciputat,Jl.Dewi Sartika No. B3, Ciputat",Kota Tangerang Selatan,Banten
"Ruko Ciputat Lot Kav. 01-02,Jl.Dewi Sartika, Ciputat",Kota Tangerang Selatan,Banten
"Ruko Ciputat Lot Kav. 01-02,Jl.Dewi Sartika, Ciputat",Kota Tangerang Selatan,Banten
"Harmony Swalayan Ruko C, Jalan Ceger Raya, Jurang Mangu Timur, Pondok Aren, Jurang Manggu Tim., Kec. Pd. Aren, Kota Tangerang Selatan, Banten",Kota Tangerang Selatan,Banten
"Harmony Swalayan Ruko C, Jalan Ceger Raya, Jurang Mangu Timur, Pondok Aren, Jurang Manggu Tim., Kec. Pd. Aren, Kota Tangerang Selatan, Banten",Kota Tangerang Selatan,Banten
"Jl. Gunung Rinjani No.13 Blok R-G Sektor Iv, Bumi Serpong Damai, Lengkong Wetan, Serpong, Lengkong Wetan, Kec. Serpong, Kota Tangerang Selatan,",Kota Tangerang Selatan,Banten
"Jl. Gunung Rinjani No.13 Blok R-G Sektor Iv, Bumi Serpong Damai, Lengkong Wetan, Serpong, Lengkong Wetan, Kec. Serpong, Kota Tangerang Selatan,",Kota Tangerang Selatan,Banten
"Jl. Gunung Rinjani No.13 Blok R-G Sektor Iv, Bumi Serpong Damai, Lengkong Wetan, Serpong, Lengkong Wetan, Kec. Serpong, Kota Tangerang Selatan,",Kota Tangerang Selatan,Banten
"Jl. Merpati Raya, Sawah Lama, Kec. Ciputat, Kota Tangerang Selatan, Banten",Kota Tangerang Selatan,Banten
"Rumah Sakit Eka Horpital Cbd Lot Ix Bsd City, Serpong",Kota Tangerang Selatan,Banten
"Jl. Pahlawan Seribu, Ruko Pasar Modern Bsd, Sektor Commercial I Blok R No.56-57, Serpong, Rw. Mekar Jaya, Kec. Serpong, Kota Tangerang Selatan, Ba",Kota Tangerang Selatan,Banten
"Jl. Pahlawan Seribu, Ruko Pasar Modern Bsd, Sektor Commercial I Blok R No.56-57, Serpong, Rw. Mekar Jaya, Kec. Serpong, Kota Tangerang Selatan, Ba",Kota Tangerang Selatan,Banten
"Pasar Modern Intermoda Bsd City. Jl. Raya Cisauk, Bsd City. Tangerang",Kota Tangerang Selatan,Banten
Ruko Bintaro Baru Pdk Aren Jl. Jombang Raya Blok A No 18,Kota Tangerang Selatan,Banten
"Jl. Kp. Rokal No.42, RT.3/RW.10, Ramanuju, Kec. Purwakarta, Kota Cilegon, Banten 42431, Indonesia",Kabupaten Serang,Banten
"Jl. Kp. Rokal No.42, RT.3/RW.10, Ramanuju, Kec. Purwakarta, Kota Cilegon, Banten 42431, Indonesia",Kota Cilegon,Banten
"Jl. Kp. Rokal No.42, RT.3/RW.10, Ramanuju, Kec. Purwakarta, Kota Cilegon, Banten 42431, Indonesia",Kota Cilegon,Banten
"Jl. Let Jend R Soeprapto No.02 Cilegon, Kota Cilegon, Banten",Kota Cilegon,Banten
"Jl. Let Jend R Soeprapto No.02 Cilegon, Kota Cilegon, Banten",Kota Cilegon,Banten
"Jl. R Suprapto No.2, Ramanuju, Kec. Cilegon, Kota Cilegon, Banten 42443",Kota Cilegon,Banten
"Jl. R Suprapto No.2, Ramanuju, Kec. Cilegon, Kota Cilegon, Banten 42443",Kota Cilegon,Banten
"Jl. Let Jend R Soeprapto No.02 Cilegon, Kota Cilegon, Banten",Kota Cilegon,Banten
"Jl. Let Jend R Soeprapto No.02 Cilegon, Kota Cilegon, Banten",Kota Cilegon,Banten
"Jl. Jend. Sudirman No.36 Serang, Kota Serang, Banten",Kota Serang,Banten
"Serang, Sumurpecung, Serang, Serang City, Banten",Kota Serang,Banten
"Samangraya, Citangkil, Cilegon City, Banten, Banten",Kota Cilegon,Banten
Jl. Jend Sudirman No.10 Kp Sawah Labuan - Pandeglang,Kabupaten Pandeglang,Banten
"Pasar Anyar Blok C1-C10 Jl. Jend. Sudirman, Banten",Kabupaten Pandeglang,Banten
"Labuan, Pandeglang Regency, Banten, Kabupaten Pandeglang, Banten",Kabupaten Pandeglang,Banten
Jl. Jendral Sudirman Pasar Anyer Labuan Blok E 01 Kec Labuan Pandeglang,Kabupaten Pandeglang,Banten
"Jl. Pelabuhan Merak, Merak, Tamansari, Kec. Pulomerak, Kota Cilegon, Banten",Kota Cilegon,Banten
"Jl. S.Parman KM13 Cilegon-BANTEN, Kota Cilegon, Banten",Kota Cilegon,Banten
"Jl. Nn No.36, Rt.2/Rw.10, Ramanuju, Kec. Purwakarta, Kota Cilegon, Banten",Kota Cilegon,Banten
"Jl. SA. Tirtayasa No.3, Ramanuju, Kec. Purwakarta, Kota Cilegon, Banten 42431",Kota Cilegon,Banten
"Jl. Nn No.36, Rt.2/Rw.10, Ramanuju, Kec. Purwakarta, Kota Cilegon, Banten",Kota Cilegon,Banten
"Jl. Nn No.36, Rt.2/Rw.10, Ramanuju, Kec. Purwakarta, Kota Cilegon,",Kota Cilegon,Banten
"Jl. Nn No.36, Rt.2/Rw.10, Ramanuju, Kec. Purwakarta, Kota Cilegon, Banten",Kota Cilegon,Banten
"Jl. Pangeran Diponegoro No.8, Kotabaru, Kec. Serang, Kota Serang, Banten",Kabupaten Serang,Banten
"JL. PANGERAN DIPONEGORO NO.8, KOTABARU, KEC. SERANG",Kabupaten Serang,Banten
"Jalan Maulana Hasanuddin No. 57 B, Kotabaru, Kec. Serang, Kota Serang, Banten",Kota Serang,Banten
"Jalan Maulana Hasanuddin No. 57 B, Kotabaru, Kec. Serang, Kota Serang",Kota Serang,Banten
Jl. Raya Serang - Jakarta Km. 9 No 26-27 Desa Citerep,Kabupaten Serang,Banten
"Komplek Pertokohan Ciruas Mandiri, Jl. Raya Serang Km. 9, Ciruas, Citerep, Kec. Ciruas, Serang, Banten 42182",Kabupaten Serang,Banten
"Jl. Raya Serang - Jkt No.Km 9, Kwaron, Kec. Ciruas, Serang, Banten",Kabupaten Serang,Banten
"Jl. Ciputri, Menes, Kabupaten Pandeglang, Banten Pasar Menes",Kabupaten Pandeglang,Banten
"Tj. Burung, Kec. Teluknaga, Tangerang, Banten, Indonesia",Kota Cilegon,Banten
"Komp Ruko Modern Cikande Blk B No.1, Kabupaten Serang, Banten",Kabupaten Serang,Banten
"Kawasan Industri Modern Cikande, Komplek Ruko Modern Cikande Blok B No. 1 Jl Raya Cikande",Kabupaten Serang,Banten
"Jl Ry Serang Kaw Industri Cikande, Kabupaten Serang, Banten",Kabupaten Serang,Banten
"Jl. Raya Serang - Pandeglang Blk. B KM.12 No.27, Baros, Kec. Baros, Serang, Banten 42173, Indonesia",Kota Cilegon,Banten
"Jl. Maulana Hasanudin No.57b, Kotabaru, Kec. Serang, Kota Serang, Banten 42112, Indonesia",Kota Serang,Banten
"Jl. Maulana Hasanudin No.57 B, Kotabaru, Kec. Serang, Kota Serang",Kota Serang,Banten
"Jl. Maulana Hasanudin No.57 B, Kotabaru, Kec. Serang, Kota Serang",Kota Serang,Banten
"Jl. Raya Anyer-Sirih No.3, Anyar, Kec. Anyar, Serang, Banten 42166, Indonesia",Kabupaten Serang,Banten
"Jl. Raya Anyer-Sirih No.3, Anyar, Kec. Anyar, Serang, Banten 42166, Indonesia",Kabupaten Serang,Banten
"Jl. Raya Sirih Jl. Raya Anyer-Sirih No.9, RT.28/RW.2, Anyar, Kec. Anyar, Serang, Banten 42166, Indonesia",Kabupaten Serang,Banten
"Jl. Multatuli, Muara Ciujung Bar., Kec. Rangkasbitung, Kabupaten Lebak",Kabupaten Lebak,Banten
"Jl. Multatuli, Muara Ciujung Bar., Kec. Rangkasbitung, Kabupaten Lebak",Kabupaten Lebak,Banten
"Jl. Multatuli, Muara Ciujung Bar., Kec. Rangkasbitung, Kabupaten Lebak",Kabupaten Lebak,Banten
"Pertokoan Cilegon City Square Blok B1 & B2 Jl. A. Yani, Kedaleman, Cibeber, Kedaleman, Kec. Cilegon, Kota Cilegon, Banten 42423, Indonesia",Kota Cilegon,Banten
"Pertokoan Cilegon City Square Blok B1 & B2 Jl. A. Yani, Kedaleman, Cibeber, Kedaleman, Kec. Cilegon, Kota Cilegon, Banten 42423, Indonesia",Kota Cilegon,Banten
"Cilegon, Kedaleman, Cibeber, Cilegon City,, Banten",Kota Cilegon,Banten
"Cilegon, Kedaleman, Cibeber, Cilegon City, Banten",Kota Serang,Banten
"Ruko Gading Serpong Blok Aa4 No. 38, Jl. Boulevard - Tangerang",Kota Tangerang,Banten
"Jl. Boulevard Raya Gading Serpong Tangerang, Banten",Kabupaten Serang,Banten
"Ruko Financial Center Blok BA2 No. 16-17, Jl. Boulevard Raya, Pakulonan Barat, Kelapa Dua, Pakulonan Bar., Kec. Tangerang, Banten, 15810, Indonesia",Kabupaten Tangerang,Banten
Ruko Gading Serpong Blok Aa 4 No 36-38 Jl. Boulevard Raya Gading Serpong,Kabupaten Tangerang,Banten
"Ruko Gading Serpong Blok Aa4 No. 38, Jl. Boulevard",Kabupaten Tangerang,Banten
"Jl. Bsd Raya Utama, Pagedangan, Kec. Pagedangan, Tangerang, Banten 15345",Kabupaten Tangerang,Banten
"Jl. Bsd Raya Utama, Desa Sampora, Kec. Cisauk, Kec. Tangerang, Banten",Kabupaten Tangerang,Banten
Aeon Mall Bsd City Jl. Bsd Raya Utama. Pagedangan. Tangerang Banten,Kabupaten Tangerang,Banten
"Jalan Raya Plp Curug, Serdang Wetan, Legok, Serdang Wetan, Legok, Tangerang, Banten 15820",Kabupaten Tangerang,Banten
"Bsd Green Office Park - Bsd City Tangerang, Banten",Kabupaten Tangerang,Banten
"Jl. BSD Green Office Park, Sampora, Kec. Cisauk, Tangerang, Banten 15345, Indonesia",Kabupaten Tangerang,Banten
"Jl. Gading Serpong Boulevard, Pakulonan Bar., Kec. Tangerang, Tangerang, Banten 15333",Kabupaten Tangerang,Banten
"Summarecon Mal Serpong Unit Gf - Lt. Dasar Summarecon Mal Serpong 2, Jln. Boulevard Gading Serpong",Kabupaten Tangerang,Banten
"Sentra Gading Serpong, Jl. Boulevard Raya Gading Serpong, Pakulonan, Bar, Kec. Kelapa Dua Tangerang Banten 15810",Kabupaten Tangerang,Banten
Jl. Cientia Boulevard Kav U2 Summarecon Gading Serpong Tangerang,Kabupaten Tangerang,Banten
"Graha Anabatic, Jl Scientia Boulevard Barat Blok U No 02, Scientia Gargen, Summarecon Gading Serpong",Kabupaten Tangerang,Banten
"Jl. Boulevard Diponegoro No.105, Bencongan, Klp. Dua, Tangerang, Banten 15810",Kabupaten Tangerang,Banten
"Komlek Lippo Karawaci 1200 Jl. 105, Jl. Boulevard Di Ponegoro, Bencongan, Kec. Kelapa Dua, Tangerang, Banten 15810",Kabupaten Tangerang,Banten
"Jl. Suvarna Sutera Boulevard No.19, Wana Kerta, Kec. Sindang Jaya, Tangerang, Banten 15560",Kabupaten Tangerang,Banten
"Jl. Suvarna Sutera Boulevard No.19, Wana Kerta, Kec. Sindang Jaya, Tangerang, Banten 15560",Kabupaten Tangerang,Banten
"Serenade Lake, Panunggangan Cibodas Gading Serpong, Tangerang Selatan",Kota Tangerang Selatan,Banten
"Ruko Perum Citra Raya, Jl. Boulevard Utama Blok L1/16",Kabupaten Tangerang,Banten
"Ruko Perum Citra Raya, Jl. Boulevard Utama Blok L1/16",Kabupaten Tangerang,Banten
"Kompleks Vila Tomang Baru 01-25 Ab - Tangerang, Banten",Kabupaten Tangerang,Banten
"Jl. Raya Sentiong -Balaraja Tangerang, Kabupaten Tangerang, Banten",Kabupaten Tangerang,Banten
"Ps. Klp. Dua, Jalan Sampan, Klp. Dua, Kec. Klp. Dua, Tangerang, Banten 15810",Kabupaten Tangerang,Banten
"Cukang Galih, Jl. Raya Curug, Suka Bakti Kec. Curug - Tangerang",Kabupaten Tangerang,Banten
"Ruko Ultimate Blok E-F, Jalan Raya Serang Km. 24, Balaraja, Talagasari, Balaraja, Tangerang, Banten 15710, Indonesia",Kabupaten Tangerang,Banten
"Ruko Ultimate Blok E-F, Jalan Raya Serang Km. 24, Balaraja, Talagasari, Balaraja, Tangerang, Banten 15710, Indonesia",Kabupaten Tangerang,Banten
Jl. Raya Serang KM 28 Talagasari Kec Balaraja Tangerang Banten 15610,Kabupaten Tangerang,Banten
"Ruko Ultimate Blok E-F, Jalan Raya Serang Km. 24, Balaraja, Talagasari, Balaraja, Tangerang, Banten 15710, Indonesia",Kabupaten Tangerang,Banten
"Taman Borobudur Ii Blok Dd No.1-2,Jl. Borobudur Raya, Perum Ii, Karawaci - Tangerang",Kabupaten Serang,Banten
"Ruko Taman Borobudur Ii/Dd No. 1-2 Jl. Borobudur Raya Perum Karawaci, Bencongan Tangerang - Banten 15810",Kabupaten Tangerang,Banten
"Taman Borobudur Ii Blok Dd No.1-2,Jl. Borobudur Raya, Perum Ii, Karawaci - Tangerang",Kabupaten Tangerang,Banten
Taman Borobudur. Jl. Borobudur Raya. Perum Ii. Karawaci. Tangerang,Kabupaten Tangerang,Banten
"Jl. Surya Kencana No.1, Pamulang Bar., Kec. Pamulang, Kota Tangerang Selatan",Kota Tangerang Selatan,Banten
"Jl. Wijaya Kusuma 1 No 24 Rempoa Ciputat, Banten",Kota Tangerang Selatan,Banten
Jl. Musholla Nurul Huda No.1 Jurang Mangu Barat Kec. Pd. Aren Kota Tangerang Selatan,Kota Tangerang Selatan,Banten
"Jl. Purnawarman No. 8A-B Pisangan Ciputat Timur, Banten",Kota Tangerang Selatan,Banten
"Jl. Raden Fatah, Sudimara Barat, Ciledug, Banten",Kota Tangerang,Banten
"Bsd City Sektor 1.1, Jl. Letnan Soetopo, Rawa Mekar Jaya, Serpong, Rw. Mekar Jaya, Serpong, Kota Tangerang Selatan, Banten 15111",Kabupaten Tangerang,Banten
Jl. DI Panjatitan RT 09 RW 05 Kel.Bendungan Cilegon,Kota Cilegon,Banten
Jl. Raya salira Merak RT 08 RW 02 Kec. Puloampel Kel. Salira,Kota Serang,Banten
Jl. Profesor Dr. Ir Soetami Sukamanah Kec. Rangkasbitung Kab. Lebak - Banten,Kota Rangkasbitung,Banten
"Jl. Batas Peninggilan No.10, RT.002/RW.008, Paninggilan Utara, Kec. Ciledug, Kota Tangerang, Banten 15153",Kota Tangerang,Banten
"Jl.Raya Siliwangi No. 189 Kel. Benda Baru Kec. Pamulang, Tangerang Selatan",Kota Tangerang Selatan,Banten
"Jl. Pisangan Raya No.1-72, Cireundeu, Kec. Ciputat Tim., Kota Tangerang Selatan, Banten 15419",Kota Tangerang Selatan,Banten
"Jl. Letnan Soetopo, Ruko Pasar Modern Bsd, Sektor Commercial I, Serpong, Rw. Mekar Jaya, Kec. Serpong, Kota Tangerang Selatan, Banten 15318",Kota Tangerang Selatan,Banten
"Jl. Thamrin, RT.001/RW.005, Ketapang, Kec. Cipondoh, Kota Tangerang, Banten 15147, Indonesia",Kota Tangerang,Banten
"Jl. Pahlawan, Rt.1/Rw.13, Rempoa, Kec. Ciputat Tim., Kota Tangerang Selatan",Kota Tangerang Selatan,Banten
"Jl. Kawasan Industri Krakatau Steel, Samangraya, Kec. Citangkil, Kota Cilegon",Kabupaten Lebak,Banten
"Jl. Batas Peninggilan No.10, RT.002/RW.008, Paninggilan Utara, Kec. Ciledug, Kota Tangerang, Banten 15153",Kota Tangerang,Banten
