"Jl. Raya Cilegon No.14, Rt.4/Rw.6, Kagungan, Kec. Serang, Kota Serang, Banten",Kota Serang,Banten
"V, Jl. Kenari, Rengas, East Ciputat, South Tangerang City, Banten 15412, Indonesia",Kota Tangerang Selatan,Banten
"Pasar Tambak Kibin, Kibin, Kec. Kibin, Serang, Banten 42185, Indonesia",Kabupaten Serang,Banten
"Jl. Karyawan Iv, Rt.003/Rw.013, Karang Tengah, Kec. Karang Tengah, Kota Tangerang, Banten 15157",Kota Tangerang,Banten
"Jl.Klimantan Blok E2,No.9,Sektor 14,Rawa Mekar Jaya,Serpong Tangsel",Kota Tangerang Selatan,Banten
"Jl. Raya Cilegon Km.8 No.45 Kramat Watu, Banten",Kabupaten Serang,Banten
"MP6F+FJG, West Pamulang, Pamulang, South Tangerang City, Banten 15415, Indonesia",Kota Tangerang Selatan,Banten
"Jl. Moh. Toha, RT.002/RW.005, Gerendeng, Kec. Karawaci, Kota Tangerang, Banten 15114, Indonesia",Kota Tangerang,Banten
"Perumahan Grand Duta Claster Jade Blok J2.No.57, RT.003/RW.007, Periuk Jaya, Kec. Periuk, Kota Tangerang, Banten 15131, Indonesia",Kota Tangerang,Banten
"Jl. Bojonegara, Mangkunegara, Bojonegara, Serang, Banten",Kota Cilegon,Banten
"Jalan Prambanan, Rt.004/Rw.011, Cibodas Baru, Kec. Cibodas, Kota Tangerang, Banten",Kabupaten Lebak,Banten
"Pertokoan Cikupa Blok B No.3, Jl. Raya Serang Km. 14,8",Kabupaten Tangerang,Banten
"Pertokoan Cikupa Blok B No.03 Jl. Raya Serang Km. 14,8, Cikupa",Kabupaten Tangerang,Banten
"Jl. Raya Jend. Ahmad Yani, Serang, Banten, Banten",Kota Serang,Banten
"Jl. Kawasan Industri Krakatau Steel No.285, Warnasari, Kec. Citangkil, Kota Cilegon",Kabupaten Lebak,Banten
"Jl. D.I Panjaitan Rt 011/Rw.03 Kel. Ketileng, Banten",Kota Cilegon,Banten
"Perum Melati Mas Blok I 10 No. 21 Rt. 039 Rw. 09, Jelupang, Bumi Serpong Damai, Jelupang, Tangerang",Kota Tangerang Selatan,Banten
"Ruko Titan Arum Rt 1/13 Dranggong Serang - Banten, Banten",Kota Serang,Banten
"Jl. Gatot Subroto Rt.009/002 Gandasari, Tangerang, Banten",Kota Tangerang,Banten
"Komp. Ruko Modern Cikande - Jl. Raya Serang, Banten",Kabupaten Serang,Banten
"Jl. Ceger Raya No.99, Jurang Manggu Tim., Kec. Pd. Aren, Kota Tangerang Selatan",Kota Tangerang Selatan,Banten
"Jl. Ceger Raya No.99, Jurang Manggu Tim., Kec. Pd. Aren, Kota Tangerang Selatan",Kota Tangerang Selatan,Banten
"Jln. Raya Rangkasbitung Kp. Pengkolan Asem, Cikande-Serang",Kabupaten Serang,Banten
"Jln. Sa Tirtayasa No. 75 Serang, Kabupaten Serang, Banten",Kabupaten Serang,Banten
"Jl. Raya Serang Km,15 Pasar Cikupa, Kabupaten Tangerang, Banten",Kabupaten Tangerang,Banten
"Perum Mutiara Garuda Block Ai No 1/3/3, Jl. Raya Kampung Melayu No.Ds, RT.07/RW.018Kel, Kp. Melayu Timur, Kec. Teluknaga, Tangerang, Banten 15",Kota Tangerang,Banten
"Jl. W R Supratman, Cemp. Putih, Ciputat Tim., Kota Tangerang Selatan, Banten 15412",Kabupaten Lebak,Banten
"Pasar Binong, Perumahan Dasana Indah, Tangerang, Banten",Kabupaten Tangerang,Banten
"Jl. Mh. Thamrin Cikokol Tangerang, Kota Tangerang, Banten",Kota Tangerang,Banten
"Jl. Jurang Mangu Bar., Jurang Mangu Barat, Kec. Pd. Aren, Kota Tangerang Selatan",Kota Tangerang Selatan,Banten
Jl. Ayip Usman No. 5-6 Komplek Perum Agung Permai Cilegon,Kota Serang,Banten
"Tegalratu, Ciwandan, Cilegon City, Banten, Banten",Kota Cilegon,Banten
"Jl. Lumba-Lumba 1-5, Masigit, Kec. Jombang, Kota Cilegon, Banten",Kota Cilegon,Banten
"Jl. Maulana Hasanudin Desa kadu agung timur Lebak, Banten",Kota Rangkasbitung,Banten
"Jl. Enggano No.24, Tj. Priok, Kota Jkt Utara, Daerah Khusus Ibukota Jakarta 14310, Indonesia",Kota Tangerang,Banten
"Jl. Belimbing Raya Rt.16/07, Kosambi, Tangerang, Banten",Kota Tangerang,Banten
"Jl. Gelora Raya No.43, RT.002/RW.003, Pajang, Benda, Kota Tangerang, Banten 15126, Indonesia",Kota Tangerang,Banten
"Caringin, Cisoka, Tangerang, Banten 15730, Banten",Kabupaten Tangerang,Banten
"Jl Raya Serang Km 68 Kp Malang Rt 17 Rw 03, Banten",Kabupaten Serang,Banten
"Jl. Raya Pandeglang, Sindangsari, Kec. Pabuaran, Kota Serang, Banten 42163, Indonesia",Kabupaten Serang,Banten
Ruko Iv Serpong Garden Blok F-13 Dan G-14 No 4-5 Cibogo Cisauk Tangerang,Kota Tangerang Selatan,Banten
Kp.Cileutik Rt/Rw 005/003 Kel.Situgadung Kec.Pagedangan Kab.Tangerang,Kota Tangerang Selatan,Banten
Jl Perum Mutiara Serpong A01-08 &08 A Rt.05/11 Eks Jl. Jelupang Utama Rt. 05 / 02 Serpong Tangerang,Kota Tangerang Selatan,Banten
"Jl. H. Rean No.18, Rt.3/Rw.1, Benda Baru, Kec. Pamulang, Kota Tangerang Selatan",Kota Tangerang Selatan,Banten
"Jl. Raya Sirih Km. 128, Cikoneng, Anyar, Serang, Banten 42166",Kabupaten Serang,Banten
"Jl. Raya Plp Curug Rt 004 Rw 003, Kadu Jaya, Curug, Kadu Jaya, Tangerang, Banten 15810, Indonesia",Kabupaten Tangerang,Banten
"Jl. Jalur Sutera Barat Kav.17, Alam Sutera, Panunggangan Timur, Pinang, Panunggangan Tim., Pinang, Kota Tangerang, Banten 15143",Kota Tangerang,Banten
Bsd Blok Ruko Rc 3/14 Sektor 1-2 Rawa Buntu Serpong Tangerang 15311,Kota Tangerang Selatan,Banten
"Jl. Bintaro Melati, Ciputat, Tangerang Banten, Banten",Kota Tangerang Selatan,Banten
Ruko Banjar Wijaya Bi A/23 Poris Plawad Cipondoh Kota Tangerang,Kota Tangerang,Banten
"Jl. Prabu Kiansantang, Tangerang, Kota Tangerang, Banten",Kota Tangerang,Banten
"Jl Hos Cokroaminoto Ciledug Larangan Kreo, Banten",Kota Tangerang,Banten
"Jl. W R Supratman No.4, Rengas, Kec. Ciputat Tim., Kota Tangerang Selatan, Banten 15412",Kota Tangerang Selatan,Banten
"Jl. W R Supratman No.4, Rengas, Kec. Ciputat Tim., Kota Tangerang Selatan, Banten 15412",Kota Tangerang Selatan,Banten
"Jl. Akses St. Rw. Buntu No.1, Rw. Buntu, Kec. Serpong, Kota Tangerang Selatan",Kota Tangerang Selatan,Banten
"Jl. Ceger Raya No.31, Jurang Mangu Barat, Kec. Pd. Aren, Kota Tangerang Selatan, Banten 15223, Indonesia",Kota Tangerang Selatan,Banten
"Spbu Pertamina 34-15415, Jl. R. E. Martadinata No.Desa, Cipayung, Kec. Ciputat, Kota Tangerang Selatan, Banten 15411, Indonesia",Kota Tangerang Selatan,Banten
Jl. Kh Wahid Hasyim No 72 Kelurahan Jurang Mangu Timur Kecamatan Pondok Aren,Kota Tangerang Selatan,Banten
Jl. Raya Siliwangi Blok Ab 15-17 Villa Dagp Kelurahan Benda Baru Kecamatan Pamulang,Kota Tangerang Selatan,Banten
Jl. Raya Siliwangi Ruko Puri Pamulang Tangerang Selatan 15417,Kota Tangerang Selatan,Banten
Jl. Aria Putra Kelurahan Ciputat Kecamatan Ciputat,Kota Tangerang Selatan,Banten
"Jl.Ciomas  Mandalawangi Kec.Ciomas Kab.Serang, Banten",Kabupaten Serang,Banten
"Komp Citra Garden Bmw Kramatwatu Serang 42161, Banten",Kabupaten Serang,Banten
"Jl. Ciruas - Walantaka Km. 3 Taman Pipitan Indah, Pipitan, Walantaka, Pipitan, Serang, Serang City, Banten 42183",Kabupaten Serang,Banten
"Jl. Puspitek Jl. Raya Serpong, RT.007/RW.002, Babakan, Kec. Setu, Kota Tangerang Selatan, Banten 15315, Indonesia",Kota Tangerang Selatan,Banten
Jl.Lanud Rt/Rw 01/001 Ds.Gembong Udik Kec.Cikande Kab.Serang,Kabupaten Serang,Banten
Kp Kadu Kahalang Rt 01/Rw 02 Desa Cililitan Kec Picung Kab Pandeglang,Kabupaten Pandeglang,Banten
Jl. Raya Serang Kel Tambak (  Halaman Utama Pt Nikkomas),Kabupaten Serang,Banten
"Jl. Griya Kencana 2, Ciledug Tangerang, Kota Tangerang, Banten",Kota Tangerang,Banten
"Jl. M Toha Desa Pasar Baru, kecamatan karawaci RT.003/RW.005, Tangerang City, Banten",Kota Tangerang,Banten
"Jl. Raya Perancis No. 2A Rt 001/06 Tangerang, Banten",Kota Tangerang,Banten
"apartemen aeropolis,jl, selapanjang neglasari tangerang",Kota Tangerang,Banten
"Jl. Modern Golf Raya No. 1 Modernland Tangerang, Banten",Kota Tangerang,Banten
"Jl. Cipto Mangun Kusumo, Ciledug, Tgr, Kota Tangerang, Banten",Kota Tangerang,Banten
"Jl. Irigasi Sipon No. 8-10, Poris Plawad, Tangerang",Kota Tangerang,Banten
"Blok C3 No.6, Selapajang Jaya, Tangerang, Tangerang City, Banten 15127",Kota Tangerang,Banten
"Jl. Tanah Seratus No.50, Sudimara Jaya, Ciledug, Kota Tangerang, Banten 15151",Kota Tangerang,Banten
"Jl. Hos Cokroaminoto, Larangan Utara, Kec. Larangan, Kota Tangerang, Banten",Kota Tangerang,Banten
"Jl. Pesantren No.10 Rt.009/12, Larangan, Ciledug, Banten",Kota Tangerang,Banten
"Jl. Aria Wangsakara Rt 03/02, Bugel, Tangerang, Banten",Kota Tangerang,Banten
"Jl. Desa Medang No. 42, Medang, Kec Pagedangan, Tangerang Banten 15334",Kabupaten Tangerang,Banten
"Jl.Perum Batan Indah Blok H No.27,Kademangan Setu Tangsel",Kota Tangerang Selatan,Banten
"Jl. Ki Hajar Dewantoro No.89, Rt. 02 / 05, Sawah Baru, Ciputat, Kec. Ciputat, Kota Tangerang Selatan",Kota Tangerang Selatan,Banten
Jl. Yaktapena Raya No. 34 Rt 004 Rw 007 Pondok Ranji Ciputat Timur Tangerang Selatan 15412,Kota Tangerang Selatan,Banten
"Jl. Ki Hajar Dewantoro, Ciputat, Ciputat, Tangerang, Kota Tangerang Selatan",Kota Tangerang Selatan,Banten
"Jalan Bintaro Utama 3A, Pondok Ranji, Ciputat Timur, Jl. Bintaro Utama 3A, Pd. Ranji, Kec. Ciputat Tim., Kota Tangerang Selatan, Banten 15412",Kota Tangerang,Banten
Perum Serpong Park Blok P-1 No. 1&2 Jelupang Serpong Utara Tangerang Selatan 15323,Kota Tangerang Selatan,Banten
Jl. Pondok Kacang D/06 Rt 05 Rw 03 Kel. Pondok Kacang Timur Kec. Pondok Aren Tangerang Selatan,Kota Tangerang Selatan,Banten
"Jl. Sumatera, Jombang, Ciputat, Kota Tangerang Selatan, Banten",Kota Tangerang Selatan,Banten
Perum Citra Raya Blok Ki No 24 R Rt 12/02 Tangerang 15710,Kabupaten Tangerang,Banten
"Boulevard Citra Raya, Cikupa, Kec Cikupa  Tangerang",Kabupaten Tangerang,Banten
"Jl Raya Kotabumi Blok D10 No 39-40 Tangerang, Banten",Kabupaten Tangerang,Banten
"Gedung Dx Water Park, Bojong Nangka Kelapa Dua Tangerang",Kabupaten Tangerang,Banten
"Jl. Raya Anyer-Sirih No.3, Anyar, Serang, Banten 42166",Kabupaten Serang,Banten
"Desa Caringin, Kec Legok - Tangerang, Kabupaten Tangerang, Banten",Kabupaten Tangerang,Banten
"Pasar Modern Intermoda Bsd City. Jl. Raya Cisauk, Bsd City. Tangerang",Kabupaten Tangerang,Banten
"Jl Raya Karawaci Rt 1 Rw 1 No 19 - Tangerang, Banten",Kabupaten Tangerang,Banten
"Ps. Tigaraksa, Jl. Aria Wasangkara A No.8, Tigaraksa, Tigaraksa Kec., Tangerang, Banten 15720, Indonesia",Kabupaten Tangerang,Banten
"Perum Griya Suradita Indah Ruko Blok A3 No. 14-15, Banten",Kabupaten Tangerang,Banten
"Kp Babakan Barat Rt 002/001 - Tangerang, Banten",Kabupaten Tangerang,Banten
"Jl. Moh. Toha Jl. Nagrak No.Kp, RT.004/RW.006, Periuk, Kec. Periuk, Kota Tangerang, Banten 15131, Indonesia",Kota Tangerang,Banten
"Jl. Cabe Raya, Pondok Cabe, Pamulang, Pd. Cabe Udik, Kec. Pamulang, Kota Tangerang Selatan",Kota Tangerang Selatan,Banten
"Jl. Raya Serang Km 11 Desa Ciagel Kragilan Banten, Banten",Kabupaten Serang,Banten
Jln. Raya Serang Km. 11 Ds Ciagel Ciujung Kragilan,Kabupaten Serang,Banten
"Jl. Green Lake City Boulevard No.A30, Petir, Kec. Cipondoh, Kota Tangerang, Banten 15147",Kota Tangerang,Banten
Jl. Prancis Eks Jl. Daan Mogot Eks Jl. Daan Mogot - Tangerang,Kabupaten Tangerang,Banten
Jl. Sumatra Blok G7 No 11-12 Rt 007 Rw 012 Pondok Kacang Timur Pondok Aren Tangerang Selatan 15226,Kota Tangerang Selatan,Banten
Jalan Kasuari Raya Blok Hb 19 No. 1 Kelurahan Pondok Pucung Kecamatan Pondok Aren,Kota Tangerang Selatan,Banten
Jl. Raya Astek No. 3 Lengkong Gudang Timur Kec Serpong Tangerang Selatan,Kota Tangerang Selatan,Banten
"Jl. Pakupatan Blok A No.9, RT.2/RW.5, Panancangan, Kec. Cipocok Jaya, Kota Serang, Banten 42124, Indonesia",Kabupaten Serang,Banten
"Jl. Kh Abdul Fatah Hasan 27, Sumurpecung, Kec. Serang, Kota Serang, Banten",Kota Serang,Banten
"Jl.Raya Moh.Toha Km.1 Tangerang Banten, Kota Tangerang, Banten",Kota Tangerang,Banten
"JL. Moh.Toha No.10, Tangerang, RT.001/RW.004, Gerendeng, Kec. Karawaci, Kota Tangerang, Banten 15112, Indonesia",Kota Tangerang,Banten
"Jl. Sukamulya Raya No.59, Serua Indah, Kec. Ciputat, Kota Tangerang",Kota Tangerang Selatan,Banten
"Jl. Taman Asri Utama, Cipadu, Larangan, Kota Tangerang, Banten 15154",Kota Tangerang,Banten
"Kompl Permata Tangerang, Kompl Permata Tangerang Bl Ed-1/32, Pasar Kemis, Tangerang 15560 Banten Tangerang",Kota Tangerang,Banten
"Ranjeng, Ciruas, Serang, Banten, Kabupaten Serang, Banten",Kabupaten Serang,Banten
Komplek Perumahan Dan Perkantoran Green Ville Real Estate Blok Bg No. 31-36,Kota Tangerang Selatan,Banten
"Jl. Ki Samaun No. 214 Tangerang, Kota Tangerang, Banten",Kota Tangerang,Banten
"Ruko Gading Serpong Blok Aa4 No. 36-38Jl. Boulevard Gading Serpongtangerang, 15333",Kabupaten Tangerang,Banten
"Jl. Raya Kotabumi Kel. Karet, Kec Sepatan Tangerang",Kota Tangerang,Banten
"Soewarna Business Park, Bandara Soekarno-Hatta, Banten",Kota Tangerang,Banten
"Terminal Ii-E Komp. Bandara Soekarno Hatta, Banten",Kota Tangerang,Banten
"Terminal Ii-D Komplek Bandara Soekarno Hatta, Banten",Kota Tangerang,Banten
"Departures Terminal 2, Pajang Benda Terminal 2 Bandara Soetta",Kota Tangerang,Banten
"Bandara Terminal 3, Jalan P2, Pajang, Benda, Tangerang City, Banten 15126",Kota Tangerang,Banten
"Bandara Soekarno-Hatta, Pajang, Benda, Kota Tangerang, Banten",Kota Tangerang,Banten
Kcp Mandiri Bandara Terminal 3 Bandara Soekarno Hatta,Kota Tangerang,Banten
"Jl. Jalur Sutera Barat Kav.16, Alam Sutera, Panunggangan Timur, Pinang, Panunggangan Tim., Pinang, Kota Tangerang, Banten 15143",Kota Tangerang,Banten
Kcp Mandiri Bandara Terminal 3 Bandara Soekarno Hatta,Kota Tangerang,Banten
"Stasiun Bandara Soekarno Hatta, Tangerang, Banten, Banten",Kota Tangerang,Banten
"Gedung Alfa Tower Jl. Jalur Sutera Barat, Alam Sutera",Kota Tangerang,Banten
Kcp Mandiri Bandara Terminal 3 Bandara Soekarno Hatta,Kota Tangerang,Banten
"Jl. Musholla Nurul Huda No.115, Pd. Aren, Kec. Pd. Aren, Kota Tangerang Selatan",Kota Tangerang Selatan,Banten
"Jl. Hutama Karya No.56, Kademangan, Kec. Setu, Kota Tangerang Selatan, Banten 15314",Kota Tangerang Selatan,Banten
"Jl. Jombang Raya Rt 02 Pondok Aren, Kota Tangerang Selatan, Banten",Kota Tangerang Selatan,Banten
"Jl. Pahlawan No. 131 Blok D-17 Rempoa, Kel Cempaka Putih, Kec Ciputat Timur, Cemp. Putih, Kec. Ciputat Tim., Kota Tangerang Selatan",Kota Tangerang Selatan,Banten
"Jl. Dr. Setiabudi, Rt.004/Rw.009, Parung Serab, Kec. Ciledug, Kota Tangerang, Banten 15226",Kabupaten Lebak,Banten
"Jl. Kertamukti No.100, Rt.1/Rw.8, Pisangan, East Ciputat, South Tangerang City, Banten 15419",Kota Tangerang Selatan,Banten
"Jl. Otista Raya, Ciputat, Kec. Pamulang, Kota Tangerang Selatan",Kota Tangerang Selatan,Banten
"Jl. Benda Raya, Pd. Benda, Pamulang, Kota Tangerang Selatan, Indonesia 15415",Kota Tangerang Selatan,Banten
"Jl. Aria Putra No.115, Rt.7/Rw.10, Kedaung, Kec. Pamulang, Kota Tangerang Selatan",Kota Tangerang Selatan,Banten
"Jl. Raya Serang Km.24 Balaraja Balaraja, Gembong, Kec. Balaraja, Tangerang, Banten 15610",Kabupaten Tangerang,Banten
"Komp. Karyawan Apii, Jakarta Pusat, Kota Tangerang, Banten",Kota Tangerang,Banten
"Tenjoayu, Tanara, Serang, Banten 42194, Indonesia",Kota Cilegon,Banten
"Komp Perumahan Cikande Permai Blok K5 Sirurate, Banten",Kabupaten Serang,Banten
"Jl.Raya Pelabuhan No.1 Ciwandan Banten 42166, Banten",Kota Cilegon,Banten
"Jalan Raya Serang - Jakarta KM. 65, Julang, Serang, Julang, Kec. Cikande, Serang, Banten 42185, Indonesia",Kabupaten Serang,Banten
"Jl Boulevard, Citra Raya - Cikupa - Tangerang, Banten",Kabupaten Tangerang,Banten
"Jl. Raya Serang Km.15 No.42, Sentul Jaya, Balaraja, Tangerang, Banten 15610",Kabupaten Tangerang,Banten
"Jl Raya Ir Sutami No 12 Simpang 3 Pasar Mauk, Banten",Kabupaten Tangerang,Banten
"Kampus Umn, Scientia Garden, Jl Boulevard Gading Serpong - Tangerang",Kabupaten Tangerang,Banten
"Kp Picung No 05, Rt 05/05, Psr Kemis Tgr, Banten",Kabupaten Tangerang,Banten
"Dekat Ciputra Citra 5, Benda, Tangerang, Banten",Kota Tangerang,Banten
"Pajang, Benda, Tangerang City, Banten 15126, Banten",Kota Tangerang,Banten
"Jl. Grand Tomang Boulevard, Rt.005/Rw.011, Periuk, Kec. Periuk, Kota Tangerang, Banten 15131",Kota Tangerang,Banten
"Jl. Raden Patah Blok Saman No.68, Rt.6/Rw.3, Parung Serab, Kec. Ciledug, Kota Tangerang, Banten 15153",Kabupaten Lebak,Banten
"Jl. Pd. Betung Raya No.50, Pd. Betung, Kec. Pd. Aren, Kota Tangerang Selatan",Kota Tangerang Selatan,Banten
"Jl. Letnan Sutopo Blok H8 No.8, Rt.1/Rw.6, Lengkong Gudang Tim., Kec. Serpong, Kota Tangerang Selatan",Kota Tangerang Selatan,Banten
"Jl. Pondok Jagung Timur No.26, Pd. Jagung Tim., Kec. Serpong Utara, Kota Tangerang Selatan",Kota Tangerang Selatan,Banten
Jl. Amd Raya 15/16 No 90 Rt 04 Rw 01 Kel Pondok Aren Barat Kec Pondok Aren Tangerang Selatan,Kota Tangerang Selatan,Banten
Perumahan Residen One Club House Kel. Lengkong Karya Kec Serpong Tangerang Selatan,Kota Tangerang Selatan,Banten
"Jl. Taruma Negara Cirendeu, Ciputat Timur   Tangerang Selatan",Kota Tangerang Selatan,Banten
"Jl. Merpati Raya No.87, Sawah Lama, Kec. Ciputat, Kota Tangerang Selatan",Kota Tangerang Selatan,Banten
"Jl. Pinang Pamulang, Pamulang Timur Tangerang Selatan 15417",Kota Tangerang Selatan,Banten
"Jl. K.H. Ahmad Dahlan, Cireundeu, Kec. Ciputat Tim., Kota Tangerang Selatan",Kota Tangerang Selatan,Banten
"Jl. K.H. Ahmad Dahlan, Cireundeu, Kec. Ciputat Tim., Kota Tangerang Selatan",Kota Tangerang Selatan,Banten
Jl. Mujair Raya Rt 008 Rw 004 Bambu Apus Pamulang Tangerang Selatan,Kota Tangerang Selatan,Banten
"Jl. Ruko Reni Jaya No.2A, Pamulang Bar., Kec. Pamulang, Kota Tangerang Selatan",Kota Tangerang Selatan,Banten
"Jl.Perum Pamulang Permai 2/ Benda Timur 1 Blok V34, Benda Baru Pamulang Tangsel",Kota Tangerang Selatan,Banten
"Jl. Dr. Setia Budi No 49 C-D Pamulang, Pamulang Timur Tangerang Selatan 15417",Kota Tangerang Selatan,Banten
"Jl. Raya Serang Pandeglang Km. 45, Pandeglang, Banten",Kabupaten Pandeglang,Banten
"Jl. Ps Kemis - Cikupa, Ps Kemis Kec. Ps Kemis, Tangerang Banten 15560",Kabupaten Tangerang,Banten
"Jl. Merpati Raya Ruko Asri Plaza 2 No. 31-32, Kelurahan Sawah Lama Kecamatan Ciputat",Kota Tangerang Selatan,Banten
Jl. Chairil Anwar  No. 7 Kelurahan Kreo Kecamatan Cileduk,Kota Tangerang,Banten
"Jalan Adam Malik, Rt.004/Rw.001, Kreo Selatan, Kec. Larangan, Kota Tangerang, Banten 15156",Kota Tangerang,Banten
Jl. Pondok Cabe Raya No. 89 Kelurahan Pondok Cabe Udik Kecamatan Pamulang,Kota Tangerang Selatan,Banten
Jl. Cirendeu Raya No. 54 Rt 05/05 Cirendeu Ciputat Timur Tangerang Selatan 15419,Kota Tangerang Selatan,Banten
"Jl. Kh. Maulana Hasanuddin No. 108 Cipondoh, Banten",Kota Tangerang,Banten
"Jl. Ir H. Juanda No.6, Cireundeu, Kec. Ciputat Tim., Kota Tangerang Selatan, Banten 15412, Indonesia",Kota Tangerang Selatan,Banten
"Jl. Raya Ps. Kemis No. 1, Sidang Panon, Kec. Ps. Kemis, Tangerang Banten 15560",Kabupaten Tangerang,Banten
"Jl. Bulak Wareng Raya No.21, Rt.002/Rw.004, Larangan Sel., Kec. Larangan, Kota Tangerang, Banten 15154",Kota Tangerang,Banten
"Jl. Kp. Melayu Barat, Bojong Renged, Teluknaga, Kota Tangerang, Banten",Kota Tangerang,Banten
"Tangerang, Rt.001/Rw.005, Babakan, Tangerang, Tangerang City, Banten 15118",Kota Tangerang,Banten
"Tangerang, Rt.001/Rw.005, Babakan, Tangerang, Tangerang City, Banten 15118",Kota Tangerang,Banten
"Jl. Merpati Raya No.65, Rt.4/Rw.3, Sawah Lama, Kec. Ciputat, Kota Tangerang Selatan",Kota Tangerang Selatan,Banten
"Jl. Danau Klp. Dua Raya, Klp. Dua, Tangerang, Banten 15810",Kabupaten Tangerang,Banten
"Jl. Prancis Eks Jl. Raya Tomang Dalam - Tangerang, Banten",Kabupaten Tangerang,Banten
Jl. Ki Hajar Dewantara No. 180 Sawah Lama Ciputat Tangerang Selatan,Kota Tangerang Selatan,Banten
"Jl Bintaro Utama Sektor Iiia Bintaro Jaya, Banten",Kota Tangerang Selatan,Banten
"Jl. Jendral Sudirman Kota Tangerang, Kota Tangerang, Banten",Kota Tangerang,Banten
"Jl. W R Supratman No.20, Rt.4/Rw.5, Cemp. Putih, Kec. Ciputat Tim., Kota Tangerang Selatan",Kota Tangerang Selatan,Banten
"Jl. Cirendeu Raya No.38, Cireundeu, Kec. Ciputat Tim., Kota Tangerang Selatan",Kota Tangerang Selatan,Banten
"Jl. Boulevard Bintaro Jaya Sektor 7 Ruko Arcade 2, Pondok Jaya, Pondok Aren, Tangerang, Banten 15220",Kota Tangerang Selatan,Banten
"Ruko Golden Vienna 1 Ba32 - 33, Rawa Buntu, Bumi Serpong Damai, Kelapa Dua, Tangerang, Banten 15318",Kota Tangerang Selatan,Banten
"Jalan Pahlawan Seribu Cbd Lot Vii B, Lengkong Gudang, Serpong, Lengkong Gudang, Serpong, Kota Tangerang Selatan, Banten 15322",Kota Tangerang Selatan,Banten
"Jl. Raya Kronjo Desa Pasilian Tangerang, Banten",Kabupaten Tangerang,Banten
"Ruko Venice No. 5-6-7 Graha Bintaro, Kel Paku Jaya, Kec Serpong Utara, Tangerang Selatan",Kota Tangerang Selatan,Banten
"Pajang, Benda, Tangerang City, Banten 15126, Banten",Kota Tangerang,Banten
"Jl. Delima Jaya, Rempoa, Kec. Ciputat Tim., Kota Tangerang Selatan, Banten 15412",Kota Tangerang Selatan,Banten
"Pertokoan Cikupa Blok B No.3, Jl. Raya Serang Km. 14,8 Tangerang",Kabupaten Tangerang,Banten
"Ruko Pabuaran Jatake, Jl. Manis 2 Jatake, Jatiuwung",Kota Tangerang,Banten
"Jl. Cendana Residence, Business Area, Kec. Ciputat, Kota Tangerang Selatan, Banten 15414",Kota Tangerang Selatan,Banten
"Jl. Bukit Raya, Serua Indah, Kec. Ciputat, Kota Tangerang Selatan, Banten 15414",Kota Tangerang Selatan,Banten
Rest Area Jalan Tol Tangerang Jakarta Km. 14 Pinang,Kota Tangerang,Banten
"Kp Ranca Leutik, Jl. Raya Serang, Rt 001 Rw 001, Pasir Gintung, Jayanti, Tangerang",Kabupaten Tangerang,Banten
"Jl Palem Semi, Ruko Viera No.16 Rt 01/01Kel Bencongan Kec Kelapa Dua",Kota Tangerang,Banten
"Rest Area Km. 43 Tol Jakarta Merak, Kabupaten Serang, Banten",Kabupaten Serang,Banten
"Jl. Kemang Raya Komp. Krakatau Steel, Kota Cilegon, Banten",Kota Cilegon,Banten
"Jl. Raya Serang No. 29 Km 30 Gembong, Balaraja- Tangerang",Kabupaten Tangerang,Banten
"Jl. Raya Serang Taman Kopasus Serang, Kota Serang, Banten",Kota Serang,Banten
"Jalan Raya Carita Labuan Km 3.8, Caringin, Pandeglang, Caringin, Kabupaten Pandeglang, Banten 42211",Kabupaten Pandeglang,Banten
"Jl. Raya Jkt, Kibin, Kec. Kibin, Serang, Banten 42185, Indonesia",Kota Tangerang,Banten
"Jalan Raya Banten Km. 5 No. 014, Kasemen, Kec. Kasemen, Kota Serang, Banten",Kota Serang,Banten
"Jl. Raya Serpong, Pd. Jagung, Kec. Serpong Utara, Tangerang",Kota Tangerang Selatan,Banten
"Green Hills, Jl. Aria Putra, Serua Indah, Kec. Ciputat, Kota Tangerang Selatan",Kota Tangerang Selatan,Banten
Jl. Taman Nasional Ujung Kulon RT 002 RW 005 Ds. Taman Jaya Kec. Sumur Kab. Pandeglang,Kota Rangkasbitung,Banten
"Jl. S.Parman KM13 Cilegon-BANTEN, Kota Cilegon, Banten",Kota Cilegon,Banten
"Jl. Mawar III No.46, RT.004/RW.005, Neglasari, Kec. Neglasari, Kota Tangerang, Banten 15129, Indonesia",Kota Tangerang,Banten
"Jl. Perimeter Utara, Rw. Burung, Kec. Kosambi, Kota Tangerang, Banten 15215, Indonesia",Kota Tangerang,Banten
"Jl. Raya Pandeglang KM.5 Sempu Serang, Kota Serang, Banten",Kota Serang,Banten
"Jl. Bintaro Utama 3, Pd. Karya, Kec. Pd. Aren, Kota Tangerang Selatan",Kota Tangerang Selatan,Banten
"Jl. Witana Harja No.15, Pamulang Bar., Tangerang, Kota Tangerang Selatan",Kota Tangerang Selatan,Banten
Jl. Raya Serang Km. 33 Sumur Bandung Jayanti Tangerang,Kabupaten Tangerang,Banten
"L. Cendrawasih Raya No.25, Rt.1/Rw.1, Sawah Lama, Kec. Ciputat, Kota Tangerang Selatan",Kota Tangerang Selatan,Banten
"Jl. Raya Serang Km.4 No.483, Balaraja, Kec. Balaraja, Tangerang, Banten",Kabupaten Tangerang,Banten
Jl. Danau Agung Rt 01/11 Gelam Jaya Pasar Kemis Tangerang,Kabupaten Tangerang,Banten
Jl. Boulevard Bintaro Jaya Parigi Lama Pondok Aren Tangerang Selatan,Kota Tangerang Selatan,Banten
"Taman Tekno Bsd Sektor Xi Blok.K-3/3 C, Banten 15314",Kota Tangerang Selatan,Banten
"Jl. Serpong Garden, Cibogo, Kec. Cisauk, Tangerang, Banten 15344",Kota Tangerang,Banten
"Pd. Jagung Tim., Kec. Serpong Utara, Kota Tangerang Selatan, Banten",Kota Tangerang Selatan,Banten
"Jl. Raya PLP Curug No.23, Suka Bakti, Tangerang, Banten 15810, Indonesia",Kabupaten Tangerang,Banten
"Jl. Pd. Cabe Raya No.68, Pd. Cabe Ilir, Kec. Pamulang, Kota Tangerang Selatan, Banten 15418",Kota Tangerang Selatan,Banten
"Jl. Syech Moh. Nawawi, Banjaragung, Kec. Cipocok Jaya, Kota Serang, Banten 42121, Indonesia",Kota Serang,Banten
Jl.Graha Raya Utama Bintaro Desa Paku Jaya Kec. Serpong Tangerang 15144,Kota Tangerang Selatan,Banten
"Perum Ruko Centro Havana, Jl. De Latinos, Rw. Buntu, Kec. Serpong, Kota Tangerang Selatan",Kota Tangerang Selatan,Banten
"Tanjungjaya, Panimbang, Pandeglang Regency, Banten",Kabupaten Pandeglang,Banten
"Jln. Raya Rangkasbitung Km. 3 Ds. Gabus Kec. Kopo, Serang",Kabupaten Serang,Banten
"Banjarsari, Cipocok Jaya, Serang City, Banten, Banten",Kota Serang,Banten
"Pinang, Kota Tangerang, Banten 15145, Kota Tangerang, Banten",Kota Tangerang,Banten
"Ruas Jalan Tol Jakarta - Merak Km 13.5 Tangerang, Banten",Kota Tangerang,Banten
"Cbd Area, Jl. Pahlawan Seribu, Lengkong Gudang, Kec. Serpong, Kota Tangerang Selatan, Banten 15310",Kota Tangerang Selatan,Banten
Jl. Bintaro Utama 9 Pd. Jaya Kec. Pd. Aren Kota Tangerang Selatan,Kota Tangerang Selatan,Banten
"Jln. Wana Kencana Bsd, Kencana Loka, Sektor 12-4 Blok R, No. 73 A, Serpong Utara",Kota Tangerang Selatan,Banten
"Jln. Raya Merak-Cilegon, Ds. Jombang Wetan, Cilegon",Kota Cilegon,Banten
"Jln. Ayip Usaman Kebaharan Dukuh, Serang, Banten",Kabupaten Serang,Banten
"Jalan Nn Blok F 9 No.5, RT.2/RW.9, Lopang, Kec. Serang, Kota Serang, Banten 42111, Indonesia",Kota Serang,Banten
"Jln. Lingkar Selatan Perum Taman Widya Asri, Serang",Kota Serang,Banten
Jl. Lingkar Selatan Cilegon Kramatwatu Serang Banten,Kabupaten Serang,Banten
"Jl. Honoris Raya Kav. 6 Modernland Tangerang, Banten",Kota Tangerang,Banten
"Jl. Raya Cipari Desa Ciakar Tangerang , Kodepos : 15710",Kabupaten Tangerang,Banten
"Jl. Cilenggang I Blok A1 No.3, Cilenggang, Serpong, South Tangerang City, Banten 15310",Kota Tangerang Selatan,Banten
"Buaran, Serpong, South Tangerang City, Banten 15310",Kota Tangerang Selatan,Banten
"Jl. MH. Thamrin Raya No.20/E7, RT.006/RW.4, Panunggangan Utara, Kec. Pinang, Kota Tangerang, Banten 15143",Kota Tangerang,Banten
"Jl. Boulevard Modernland, Kota Modern, Tangerang, Banten",Kota Tangerang,Banten
"Jl. Raya Parung Panjang No.81, Caringin, Kec. Legok, Tangerang, Banten 15820, Indonesia",Kabupaten Tangerang,Banten
